Reference,NumberOfShipsInvolved,ShipsInvolved,SOLASStatus,FlagStates,IncidentDateTime,TypeOfCasualty,Coordinates,Location,NumberOfInvestigationReports,NumberOfAnalyses,InitialEvent,SummaryOfEvents,ShipType1,Consequences1,GrossTonnage1,ClassificationSociety1,Deadweight1,Cargo1,CrewOnboard1,PassengersOnboard1,OthersOnboard1,DeadMissingCrew2,DeadMissingPassengers2,DeadMissingOthers3,SeriouslyInjuredCrew2,SeriouslyInjuredPassengers2,SeriouslyInjuredOthers2,InvestationReportDate,AnalysisDate
"C0006507","1","SCOT RANGER (IMO 9138769)","SCOT RANGER: Unknown/unspecified","GBR","2008-02-01 22:53","Less serious","5456N 00550E","Larne Approaches - Belfast","0","0","Machinery damage","On 1st February 2008 the vessel (a dry general cargo vessel carrying a cargo of road salt) was on passage from Belfast to Inverness.  Soon after leaving Belfast the main engine temperatures started to steadily increase.   The oil pressure dropped and it was noticed that there was an increase in the engine oil level.

Tests of the oil confirmed that it had become water contaminated.  The problem was located on a cylinder head and water was seen to transfer to the head valve operating gear into the sump.  The Chief Engineer advised the captain to come immediately to anchor, but the harbour authorities objected because of the frequent fast ferry service.  The vessel was taken further out from the harbour, but the engineer became increasingly concerned about the oil contamination and firmly advised the master to anchor or else risk the engine being written off.  By now the vessel was about 3.5 cables from a pipeline - the captain decided that it was safe to anchor.  After doing so the engineers removed the affected cylinder head and found blanking and locating screws loose.  The cylinder head had been subjected to the manufacturer's overhaul and had only been fitted 2 weeks previously.

While the repairs were being undertaken SOSREP was informed and decided that in light of the weather conditions and the potential risk to the pipeline,  the vessel should be towed into Belfast.  The vessel arrived alongside about 7 hours later.  Repairs were completed by the crew while alongside, and the oil change completed.","GENERAL CARGO","Ship rendered unfit to proceed","2260","Germanischer Lloyd (GL)","3418","Road salt","6","0","0","0","0","0","0","0","0","",""
"C0007631","1","HORNCLIFF (IMO 8912041)","HORNCLIFF: Unknown/unspecified","LBR","2008-02-01 12:30","Serious","484000N 0101200W","North Atlantic en route to Dover","0","0","Containers lost overboard","On February 1st 2008 at approximately 12.30 hours LT the Liberian Flag vessel HORNCLIFF was at sea experiencing very heavy weather, which caused the vessel to pitch and roll. 70 containers were lost overboard and the Master and two passengers were injured. It was decided to evacuate them by helicopter, but due to the weather conditions and the ship's position this idea was aborted. On 2nd February, whilst approaching Lands End in Cornwall, the injured were eventually evacuated by helicopter and taken to hospital. After treatment, all made good recoveries, and the vessel proceeded to Falmouth to carry out heavy weather repairs.","REFRIGERATED CARGO","Serious injuries,Ship remains fit to proceed","12887","","9160","","","","","[Primary Annex 2 not designated]","[Primary Annex 2 not designated]","[Primary Annex 2 not designated]","[Primary Annex 2 not designated]","[Primary Annex 2 not designated]","[Primary Annex 2 not designated]","",""
"C0006855","1","CMA CGM EVEREST (IMO 9300154)","CMA CGM EVEREST: SOLAS","MHL","2008-01-31 23:35","Serious","314800N 1225200E","East  China Sea","0","0","Collision","At 23:35, Jan. 31st 2008, MV CMA CGM EVEREST collided with MV JIAO ZHOUHAI in waters nearby 31°48＇.7N/122°52＇.2E. The accident caused MV CMA CGM EVEREST suffered damage of No.4 cargo hold on the starboard side, and M/V JIAO ZHOUHAI suffered the break of the bulbous bow and depressed on the port bow. The two vessels all remain fit to proceed.","CONTAINER SHIP","Ship remains fit to proceed","21971","","24084","","29","0","0","","","","","","","",""
"C0006724","1","RIVERDANCE (IMO 7635361)","RIVERDANCE: Unknown/unspecified","BHS","2008-01-31 19:27","Very serious","535235N 0030328W","Shell Flat","1","0","Capsizing / listing","On the evening of 31st Jan 2008 the RoRo Freight vessel Riverdance was on passage from Warrenpoint to Heysham. The weather throughout the day had been strong Westerly gale force winds, increasing in strength. At the time of the initial incident winds force 10 were experienced along with large sea / swells.
Although the passage had been easy, with sea and swell coming from astern, as Riverdance approached the Lune Deep buoy she began to roll. Initially two trailers were reported to have shifted before the rolling died down. As the trailer shift was being investigated the rolling started again, stronger than before and resulting in cargo shifting from the trailers. A list of 45 deg to port was experienced and the master decided to bring the vessel head to wind. He applied full starboard wheel and the vessel turned rapidly, thus increasing the angle of heel. As the vessel became broadside to the wind this also added to the total heeling effect and a maximum list/heel of 60 deg was reported.
The vessel turned from a heading of 090 to 170 in 70 seconds. She then lost one of her two engines due to lube oil low pressure trip and would not come any closer to the wind. At this time the master contacted the Coast Guard.
Attempts to restart the engine were made and to transfer ballast to bring her upright. During this time Riverdance drifted towards the Shell Flat sands off the coast near Blackpool. Around 2300 hrs UTC she grounded on Shell Flat on a falling tide.
Initially 14 persons were evacuated by helicopter leaving 9 onboard attempting to stabilise the situation. Whilst aground the list decresed to about 25 deg. Ballast was transfered ready for coming off on the next rising tide in the morning. 
Once the vessel was starting to refloat the engines were put astern in an attempt to bring her into deeper water, the wind and seas were still storm force from the West and the engines had no effect. After about two hours, attempts to re float the vessel were stopped, Riverdance then came broadside to the weather and sufferred a sudden severe heeling over to starboard. The remaining crew were taken off the vessel and Riverdance was left aground with a heel of about 40 deg.
Subsequent attempts to refloat and salvage the vessel failed.  ","RORO CARGO","Total loss of the ship","6041","DNV AS (DNV)","3046","Trailers","19","4","","0","0","0","0","0","0","2009-09-04",""
"C0006552","2","SCHLESWIG-HOLSTEIN  (IMO 9151539), SCHLESWIG-HOLSTEIN (IMO 9151539)","SCHLESWIG-HOLSTEIN : Unknown/unspecified, SCHLESWIG-HOLSTEIN: Unknown/unspecified","DEU","2008-01-31 16:45","Serious","553330N 0094640E","Snaevringen - Lille Baelt","1","1","Contact","On 31st January 2008  the M/V SCHLESWIG-HOLSTEIN departed Fredericia Harbour. At approximately 16.45 hours LT  the ship collided with Skanseodde Lighthouse 0.7 nm east of the harbour.  The weather was bad. The wind came from south-west with a speed of 22 m/s, and the current was to the north-east speed 3 knots. Due to narrow waters and a considerable drift, it was difficult to manoeuvre the ship, and it collided with the lighthouse.","RORO CARGO/FERRY","Ship rendered unfit to proceed","15187","Lloyd's Register (LR)","2904","","","","","","","","","","","2009-02-17","2010-08-11"
"C0006725","1","PRIDE OF CANTERBURY (IMO 9007295)","PRIDE OF CANTERBURY: Unknown/unspecified","GBR","2008-01-31 12:50","Serious","511445N 0012910W","The Downs - Off Deal in Kent","1","1","Contact","On 31st January 2008  the port of Dover was closed during a period of high winds Force 10 / 11. The ro-ro cargo ship PRIDE OF CANTERBURY was inbound at the time the port closed, and deviated to The Downs to steam round awaiting the port to re-open.
During the morning the vessel made three circuits of the area, but on the last circuit she went further North than planned, and on making the turn to go South struck a charted wreck at approximately 12.50 hours LT.","Passenger/Roro Cargo","Ship rendered unfit to proceed","30635","Lloyd's Register (LR)","7509","RoRo freight, cars, lorries","101","275","","0","0","0","0","0","0","2009-01-23","2011-03-04"
"C0007577","1","MORRABORG (IMO 9190274)","MORRABORG: Unknown/unspecified","NLD","2008-01-31 11:30","Serious","581800N 0061800E","Jossingfjord, Norway","0","0","Contact","Vessel sailed from Rotterdam to Jossingfjord. Orders came suddenly, no proper voyage preparation could be made, detailed chart of Jossingfjord was not on board. At arrival 30-01-08, 23.00 LT) vessel anchored outside the fjord (waterdepth > 37m), since according to the pilot, no achorage position was available inside the fjord. Both seacharts and sailing directions give warnings of ""dangerous waves"" in the area, but this was not noticed by the crew.
in the morning of 31st of January windforce increases towards 10BFt. At 11.00 hrs anchor is noticed to be dragging. Main engine is started, anchor heeved up. Due to wind and waves vessel is moving towards shallows rocks, near Baer-buoy. Vessel touches bottom several times with severe damage to hull and steering gear. After half an hour steering gear failure occurs. By means of bow thruster and ME, master succeeds to bring vessel to deeper water. Vessel towed to repair port.","GENERAL CARGO","Pollution,Ship rendered unfit to proceed","6540","Bureau Veritas (BV)","9200","","","","","[Primary Annex 2 not designated]","[Primary Annex 2 not designated]","[Primary Annex 2 not designated]","[Primary Annex 2 not designated]","[Primary Annex 2 not designated]","[Primary Annex 2 not designated]","",""
"C0007404","1","NORSUL VITÓRIA (-)","NORSUL VITÓRIA: Unknown/unspecified","BRA","2008-01-30 23:20","Very serious","260980S 0483100W","Babitonga Bay, in São Francisco do Sul","1","0","Capsizing / listing","On 30 January 2008 the combined vessels pusher tug “Norsul Vitoria” and barge “Norsul 12”, flagged Brazil, Call sign PPTH, laden with 340 tonnes steel coils, capsized in the entrance channel of Babitonga Bay, at the entrance of the port of São Francisco do Sul. The convoy formed by the barge ‘NORSUL 12” and the pusher tug “NORSUL VITÓRIA”, is the type “Articulated Connection ITB” (Integrated Tug-Barge). The crew was picked up from the sea. The capsizing of the vessels did not cause any deaths amongst their crewmembers and their other occupants. All the upper works of the vessels were damaged, as well as the equipment on board. Right after the accident it was possible to notice presence of oil in the water around the vessels and, that after 12 hours, the oil stain had an extension of approximately 1500 m length by 300 m width.
","","Pollution,Ship rendered unfit to proceed","730","American Bureau of Shipping (ABS)","197.7","steel coils","11","0","1","[Primary Annex 2 not designated]","[Primary Annex 2 not designated]","[Primary Annex 2 not designated]","[Primary Annex 2 not designated]","[Primary Annex 2 not designated]","[Primary Annex 2 not designated]","2009-09-08",""
"C0007622","1","OJARS VACIETIS (IMO 8207305)","OJARS VACIETIS: SOLAS","LBR","2008-01-30 08:08","Serious","334802N 0780356W","Cape Fear River","0","0","Stranding / grounding","On January 30th 2008 at approximately 08.08 hours LT the Liberian Flag oil/chemical tanker OJARS VACIETIS ran aground while approaching the Cape Fear River Pilot boarding area. The intention was to pick up the river pilot for the inward transit from the sea to the port of Wilmington, North Carolina USA. Several attempts to board the river pilot had failed due to the rough weather and wind conditions (winds blew at approximately 23 -24 knots). The vessel, while grounded in a low tide, suffered damage to the doubtle bottom tank areas, but without any breach or flooding of any kind, and no injuries were sustained. By 10.00 hours LT the next day the tide had changed and the vesssel refloated without any external assistance, and was fit to proceed with her journey. Flag State investigation was conducted by obtaining the Flag State report and follow-up communications for clarification after review, as necessary.","TANKER","Ship remains fit to proceed","10944","Romanian Naval Register (RNR)","16341","","22","0","0","","","","","","","",""
"C0007621","1","TRANS PACIFIC (IMO 9283643)","TRANS PACIFIC: SOLAS","LBR","2008-01-27 03:55","Serious","555290N 0104980E","Hatter Barn deepwater route","0","0","Stranding / grounding","On January 27th 2008 at approximately 03.55 hours LT the Liberian Flag bulk carrier TRANS PACIFIC was transiting the Hatter Barn deepwater route when she noticed another vessel crossing from the starboard bow. The TRANS PACIFIC altered course to avoid a collision, and consequently ran aground. After contacting rescue assistance , the TRANS PACIFIC was refloated on 6th February 2008, and declared without danger on 7th February 2008.
Flag State investigation was conducted by obtaining the Flag State report and follow-up communications for clarification after review, as necessary. 
","BULK CARRIER","Ship remains fit to proceed","40485","American Bureau of Shipping (ABS)","74403","Dry Bulk","25","","","","","","","","","",""
"C0007042","1","WINCO ROSE (IMO 8100064)","WINCO ROSE: Unknown/unspecified","LBR","2008-01-27 00:00","Serious"," ","Doha Port, berth no. 2, Qatar","0","0","Collision","On 27th January 2008 the roro cargo vessel WINCO ROSE collided witht the jetty at Doha Port, berth no. 2.","RORO CARGO","","7955","","7239","","","","","[Primary Annex 2 not designated]","[Primary Annex 2 not designated]","[Primary Annex 2 not designated]","[Primary Annex 2 not designated]","[Primary Annex 2 not designated]","[Primary Annex 2 not designated]","",""
"C0006771","1","JIN HUI (IMO 9039341)","JIN HUI: SOLAS","CHN","2008-01-25 14:15","Serious"," ","At sea","1","1","Fire or explosion","At 12.30 hours LT on 9 February 2008, the Chinese-registered bulk carrier JIN HUI berthed in Geelong, Australia. The ship’s master had previously informed the Australian authorities that there had been a fire in the ship’s number three cargo hold. As a result, the emergency services were on standby when the ship arrived in Geelong. When the number three cargo hold was opened, it was apparent that only two small areas of the cargo (palm kernel expeller) had been affected.
These small areas of cargo were still smouldering, so they were sprayed with water and then discharged onto the wharf.
At 15.30 hours LT, the local fire authority declared the fire extinguished. The ship’s normal cargo discharge was then allowed to begin.","Bulk Carrier","Ship remains fit to proceed","10904","China Classification Society (CCS)","15571","Non hazardous palm kernell expeller (PKE)","28","","","","","","","","","2008-08-14","2010-08-10"
"C0006797","2","NEW ETERNITY (IMO 9087647), SEABULK CHALLENGE (IMO 7816551)","NEW ETERNITY: SOLAS, SEABULK CHALLENGE: Unknown/unspecified","PAN,USA","2008-01-25 14:03","Serious"," ","AT CITY DOCK BERTH NO.27 at Houston, Texas, United States","2","1","Contact","On 23rd January 2008 the bulk carrier NEW ETERNITY berthed at City Dock No. 27 at Houston to  discharge her cargo of steel products.

At 14.03 hours LT on 25th January 2008 the m/v Seabulk Challenge was turning her bow around whilst manoeuvering in the port when she made contact with NEW ETERNITY.  As a result, NEW ETERNITY sustained damages to her starboardd side hull plate.  A Class NK Inspector ordered temporary repairs to be made, which were carried out and approved by Class NK inspector. The NEW ETERNITY later continued on her journey.  
","Bulk carrier","Ship rendered unfit to proceed","26064","","45741","","23","","","","","","","","","2008-09-15","2011-03-04"
"C0006726","1","WESTFALIA EXPRESS (IMO 9233832)","WESTFALIA EXPRESS: SOLAS","GBR","2008-01-23 19:50","Serious","040500N 0471800W","South America","0","0","Fire or explosion","On 23rd January 2008 a fire broke out in one of the containers stowed on board the M/V WESTFALIA EXPRESS.  The Chief Officer raised the alarm at 19.50 hours LT, the crew were mustered, the deck lights switched on, the electrical supplies to the reefers were isolated and the fire pumps were started. The ship's speed was also reduced to dead slow ahead and her course was adjusted to reduce the wind over the deck. Four crew members fought the fire with sea water from hoses. Boundary cooling was also established. About 15 minutes after the fire was discovered, one of the containers exploded. Its door opened and its cargo of a white powder substance started to spill onto a hatch cover. Twenty minutes later, the fire was extinguished although heavy smoke continued to pour from the containers. About 12 hours after the fire, small holes were made in the containers most affected, which were then flooded via the insertion of hose nozzles. Boundary cooling continued. The door of one container emitting heavy smoke was opened and the fire inside was extinguished using four hoses. By the following morning (32 hours after detection), the containers had stopped smoking. 
The fire had started spontaneously in an open top container carrying a dangerous cargo class 4.2. The cargo, which is believed to have spilled and spontaneously combusted, was carried in 2 small tanks approx 1m in size.  A number of containers were damaged by fire. Some were flooded by water which accumulated in the hold during the fire-fighting operation. Others were also water-damaged.","CONTAINER SHIP","Ship remains fit to proceed","39941","","50813","Containers","24","","","[Primary Annex 2 not designated]","[Primary Annex 2 not designated]","[Primary Annex 2 not designated]","[Primary Annex 2 not designated]","[Primary Annex 2 not designated]","[Primary Annex 2 not designated]","",""
"C0006779","1","ROYALIST (-)","ROYALIST: Unknown/unspecified","GBR","2008-01-23 16:53","Very serious"," ","180 miles WNW of Dingle, Ireland","2","0","Capsizing / listing","In preparation to shoot nets, a 36 metre fishing vessel opened the fish net hatch, the hatch from the upper deck into the accommodation alleyway, the hatch from the upper deck to the main deck and the weathertight door between the accommodation alleyway and main deck. This allowed the crew unrestricted movement between the upper and main deck during fishing operations. The weather was described as moderate to rough and the vessel was steaming on beam seas.
The vessel was struck by a large wave which heeled her over to starboard. She was starting to return to the upright when she was hit by another wave and the vessel took on a permanent list due to the amount of sea water on her main deck net space and starboard accommodation alleyway. The list increased as water continued to wash over the vessel’s submerged starboard gunwale in way of an open net hatch and was able to progressively flood the engine room and aft accommodation via the weathertight door which had been left open. Although the crew attempted to close the net hatch on the upper deck, this did not stem the flow of water into the hull and the vessel started to sink.
","Fish Catching Vessel","Total loss of the ship","288","Lloyd's Register (LR)","","","18","","","0","0","0","0","0","0","2008-08-19",""
"C0007497","1","SAGITAIRE (-)","SAGITAIRE: Unknown/unspecified","","2008-01-23 14:40","Very serious"," ","North of Batz Island","1","0","crew member overboard","Le 23 Juillet 2008 en début d'après-midi, le Sagitaire est en pêche à  20 miles dans le nord de l'île de Batz. Le mécanicien et un matelot sont sur le pont arrière, ils ramendent le  chalut tribord, endommagé au cours du trait précédent et rangé le long du pavois.

Les conditions de mer sont bonnes, mer 3 et vent de Nord-Est 18 nœuds.

Vers 14 heures, le train  de pêche croche. Le patron rejoint la plage arrière et prend les commandes des treuilles afin de virer le chalut, le second restant à la timonerie. Le mécanicien se poste  à bâbord et le matelot à tribord. Afin de passer  une bosse sur les panneaux, le matelot  est amené, à plusieurs reprises, à  grimper sur le chalut entreposé sur le pont.


Vers 14:40 heures, le mécanicien, entrant dans le pont de travail, entend le cri du matelot et s'aperçoit que ce dernier est tombé à la mer. Le mécanicien se dévêt et se jette à l'eau pour lui  porter secours.

Le second entreprend aussitôt une manœuvre de récupération d'homme à la mer. Le matelot perd rapidement connaissance et est hissé à bord avec difficulté.

Malgré les soins prodigués par le mécanicien puis par l'équipe médicale acheminée par hélicoptère, il décède environ une heure et demi plus tard.
","Fish Catching Vessel","Loss of life","104.24","","","","6","","","[Primary Annex 2 not designated]","[Primary Annex 2 not designated]","[Primary Annex 2 not designated]","[Primary Annex 2 not designated]","[Primary Annex 2 not designated]","[Primary Annex 2 not designated]","2009-10-26",""
"C0006658","2","EBISU MARU (-), EVER GOLDEN (IMO 8519411)","EBISU MARU: Unknown/unspecified, EVER GOLDEN: SOLAS","JPN,KHM","2008-01-22 11:30","Serious"," ","Off the west of Kajitori Hana, Imabari, Ehime Prefecture, Japan","0","0","Collision","At 11.30 hours LT on 22nd January 2008 the dredger EVER GOLDEN  (registered Cambodia, 1,470 gt, built 1985), and trawler Ebisu Maru (registered Japanese, 4 gt) were in collision off the west of Kajitori Hana, Imabari, Ehime Prefecture, Japan
EVER GOLDEN sustained scratching to her port side plating. Ebisu Maru sustained cracking to the bow and holding in the bottom, resulting in water ingress.
No injuries or oil spill were reported.","DREDGER","Ship remains fit to proceed","1470","","2300","","","","","[Primary Annex 2 not designated]","[Primary Annex 2 not designated]","[Primary Annex 2 not designated]","[Primary Annex 2 not designated]","[Primary Annex 2 not designated]","[Primary Annex 2 not designated]","",""
"C0006659","1","SEA SAPPHIRE (IMO 9115030)","SEA SAPPHIRE: SOLAS","PAN","2008-01-22 06:10","Very serious"," ","At wharf of JFE Steel Corporation, Fukuyama City, Hiroshima Prefecture, Japan","0","0","Loss of life","On 22nd January 2008 the general cargo ship SEA SAPPHIRE (registered Panama, 7,657 gt, built 1995), with 18 crew members on board (2 Korean and 16 Vietnamese), was berthing at the wharf of JFE Steel Corporation, Fukuyama City, Hiroshima Prefecture, Japan. At approximately 06.10 hours LT a Vietnamese crew member, while covering the lid of the cargo hold, fell down to bottom floor and hit in his head, resulting in death.","GENERAL CARGO","Loss of life","7657","Nippon Kaiji Kyokai (NKK)","9038","","18","","","[Primary Annex 2 not designated]","[Primary Annex 2 not designated]","[Primary Annex 2 not designated]","[Primary Annex 2 not designated]","[Primary Annex 2 not designated]","[Primary Annex 2 not designated]","",""
"C0009482","1","SERINE (IMO 7128370)","SERINE: SOLAS","SLE","2008-01-22 00:35","Serious","444180N 0141660E","island Unije","1","0","Stranding / grounding","On 22nd January 2008, at 00:35 hrs,in the position φ = 44 41.8 'N, λ = 014 ° 16.6' E, 200 meters northwest of the lighthouse Lokunji, island Unije, general cargo ship ""Serine"" under Sierra Leone flag, IMO number 7128370, port of registry Freetown, with nine crew members, had a grounding which caused damage to the hull resulted with the penetration of the sea and flooding in the hold and engine room and list to the starboard side with an angle of about 7 °. After stranding there was no contamination of marine oil. ","General Cargo Ship","Ship rendered unfit to proceed","2433","Dromon Bureau of Shipping (DBS)","3610","","","","","[Primary Annex 2 not designated]","[Primary Annex 2 not designated]","[Primary Annex 2 not designated]","[Primary Annex 2 not designated]","[Primary Annex 2 not designated]","[Primary Annex 2 not designated]","2014-10-23",""
"C0006759","2","F/V ALLENA (-), NORTHERN FORTUNE (IMO 8302167)","F/V ALLENA: Unknown/unspecified, NORTHERN FORTUNE: SOLAS","ATG,AUS","2008-01-21 21:01","Serious","194800S 1483100E","Queensland Coast, Australia","1","1","Collision","At about 18.15 hours LT on 21 January 2008, the fishing vessel ALLENA, which had been fishing near Gould Reef off the Queensland coast, began its voyage back to Bowen, Queensland. 
At 21.00 hours LT  ALENA collided with Northern Fortune, a container ship en route from Singapore to Brisbane. The fishing vessel’s bow was badly damaged but the crew was able to control the ingress of water and return the vessel to Bowen. 
","CONTAINER SHIP","Ship remains fit to proceed","30509","","30685","","","","","[Primary Annex 2 not designated]","[Primary Annex 2 not designated]","[Primary Annex 2 not designated]","[Primary Annex 2 not designated]","[Primary Annex 2 not designated]","[Primary Annex 2 not designated]","2009-07-27","2010-08-10"
"C0006853","1","JI DA (IMO 8627804)","JI DA: SOLAS","GEO","2008-01-19 18:30","Serious","304400N 1253500E","East  China Sea","0","0","Collision","On 19th January 2008 a collision occurred at about  08.35 hours local time (Beijing time)   between the Georgia registered general carrier vessel “JI  DA”, which was proceeding from TAIZHOU China to Shanghai China, and a local fishing vessel “Zheshengyu 07715”. The accident caused the fishing boat  to sink, but all 12 fishermen were rescued.","GENERAL CARGO","Ship remains fit to proceed","1197","","1098","","10","","","","","","","","","",""
