Reference,NumberOfShipsInvolved,ShipsInvolved,SOLASStatus,FlagStates,IncidentDateTime,TypeOfCasualty,Coordinates,Location,NumberOfInvestigationReports,NumberOfAnalyses,InitialEvent,SummaryOfEvents,ShipType1,Consequences1,GrossTonnage1,ClassificationSociety1,Deadweight1,Cargo1,CrewOnboard1,PassengersOnboard1,OthersOnboard1,DeadMissingCrew2,DeadMissingPassengers2,DeadMissingOthers3,SeriouslyInjuredCrew2,SeriouslyInjuredPassengers2,SeriouslyInjuredOthers2,InvestationReportDate,AnalysisDate
"C0006415","1","PACIFIC STAR (IMO 7915096)","PACIFIC STAR: SOLAS","GBR","2007-07-10 21:00","Unspecified","362000S 1750500E","South Pacific Ocean","1","0","Damages to ship or equipment","After sailing from Auckland New Zealand, the ship ran into heavy weather which was in excess of that forecast before sailing. The ship suffered damage to fittings and fixtures including loss of the satellite communications dome, various aerials and antennae, and some windows cracked due to the working of the ship in the seaway. The following day, investigation of water leaking into the hull identified two areas where pre-existing corrosion damage had been exacerbated by the storm, and the ship side plating had begun to weep water in the forepeak tank, and through structural ventilation ducts.","PASSENGER","Ship rendered unfit to proceed","35144","Rinave - Registro Internacional Naval, S.A. (RIN)","5630","","510","1287","33","","","","","","","2009-01-26",""
"C0006337","1","GRUS (IMO 8000458)","GRUS: SOLAS","PAN","2007-07-10 11:15","Serious","335700N 1314700E","INSIDE DRY DOCK","0","0","Fire or explosion","THE VEHICLE CARRIER 'GRUS'  ARRIVED SHIN KASADO DOCKYARD ON 26th JUNE 2007 FOR ROUTINE DOCKING AND SURVEYS, AND ENTERED DRYDOCK NO. 5 ON 27th JUNE
ON 10th JULY AT 11.15 HOURS LT AN EXPLOSION OCCURRED IN HER BOTTOM PLATFORM FORWARD OF MAIN ENGINE WHILE  DOCKYARD WORKERS AND SHIP´S ENGINEERS WERE WORKING ON VARIOUS JOBS (INCLUDING HOT WORK) AROUND MAIN ENGINE AND BOILER.
THE DOCKYARD TOOK FULL RESPONSIBILITY FOR THE EXPLOSION (WHICH POSSIBLY OCCURRED DUE TO COMBUSTION OF COLLECTED, SPILLED CLEANING AGENTS).
AS A RESULT, THE SHIP´S 4TH ENGINEER SUFFERED SUPERFICIAL FACIAL BURNS AND RECEIVED FIRST AID AT THE LOCAL HOSPITAL IN TOKUYAMA.
14 DOCKYARD WORKERS WERE ALSO TAKEN TO TOKUYAMA GENERAL HOSPITAL. OUT OF THESE, 3 WORKERS RECEIVED SECOND DEGREE BURNS AND WERE KEPT IN ICU. THE REMAINING WERE DISCHARGED AFTER FIRST AID.
THE SHIP´S CREW / MANAGERS WERE IN NO WAY INVOLVED WITH EITHER THE INCIDENT OR THE SUBSEQUENT INVESTIGATIONS CARRIED OUT BY THE LOCAL POLICE.
THE DOCKYARD ASSUMED FULL RESPONSIBILITY FOR THE INCIDENT.
THE VESSEL LEFT SHIN KASADO ON 18th JULY 2007 AFTER COMPLETION OF ALL PLANNED REPAIRS.","VEHICLES CARRIER","Serious injuries","45544","Nippon Kaiji Kyokai (NKK)","14161","","28","3","","","","","","","3","",""
"C0006332","1","GENKI STAR (IMO 9370575)","GENKI STAR: SOLAS","PAN","2007-07-10 11:01","Serious","354032N 1395705E","In lat 35 40.318N, long 139 57.046E","0","0","Stranding / grounding","On 10th July 2007 the combined chemical and oil tanker GENKI STAR  (registered Panama, 1930 gt, built 2006) with 14 crew (Japanese: 1, South Korean: 2, Filipino: 11), grounded on shallows in latitude 35 40.318N, longitude 139 57.046E.
Local agents arranged tugs, which refloated the vessel.
Damage to hull was limited to peeling of bottom paint coating.","TANKER","Ship rendered unfit to proceed","1930","Nippon Kaiji Kyokai (NKK)","2500","","14","","","[Primary Annex 2 not designated]","[Primary Annex 2 not designated]","[Primary Annex 2 not designated]","[Primary Annex 2 not designated]","[Primary Annex 2 not designated]","[Primary Annex 2 not designated]","",""
"C0006547","1","SASANQUA (IMO 9061904)","SASANQUA: SOLAS","PAN","2007-07-07 12:40","Serious","264600N 0402400W","ATLANTICO OCEAN","1","0","Fire or explosion","At 12.40 hours LT on 7th July 2007 the M/V SASANQUA was approximately 1000 miles north-west of the Cape Verde Islands when a fire broke out in the engine room, rendering the ship unfit to proceed.","REFRIGERATED CARGO","Ship rendered unfit to proceed","7307","Nippon Kaiji Kyokai (NKK)","5388","","21","","","","","","","","","2008-03-05",""
"C0006260","1","SOUTHERN SPIRIT (IMO 9171125)","SOUTHERN SPIRIT: SOLAS","PAN","2007-07-06 09:54","Less serious","2935N 09345W","SABINE PASS OUTER BAR CHANNEL BREAKWATER","0","0","Contact","AT 08:15LT/6th/JUL/2007 SABINE PASS PILOT ON BOARD MY VESSEL AND PROCEED TO PORT BEAUMONT.
AT 09:54 MY VESSEL TOUCHED THE SABINE PASS EAST JETTY. AT 09:55 SLOW ASTERN, AT 10:02 ENGINE STOP, AT 10:13 P/PASSED N0.34 L/B, 10:55 DROPPED ANCHOR, 11:18 FINISHED WITH ENGINE. 11:52 DROP PILOT.
NOW WE FOUND THE N0.4 WBT S`SIDE TANK LEAKING. VESSEL HAVE 2 DEGREES LIST TO PORT SIDE. NOW ANCHORED AT FAIRWAY ANCHORAGE FOR FURTHER INSTRUCTION AND POSITION LAT 29º35N, LONG 093º45W.","BULK CARRIER","Ship remains fit to proceed","18459","Nippon Kaiji Kyokai (NKK)","29482","","21","","","","","","","","","",""
"C0006384","2","NAVIGATOR (-), TORNADO (IMO 8404575)","NAVIGATOR: Unknown/unspecified, TORNADO: SOLAS","PAN,ZZZ","2007-07-05 23:06","Less serious","204190N 0170080W","NOVADHIBOU","1","0","Collision","                                   El buque TORNADO tenia programado proceder directamente desde el puerto de Abidján a Las Palmas , pero debido a la falta de combustible  fue necesario programar una escala en la rada de Nouadhibou para tomar unas 15 mtons de gas oil, lo cual le proporcionaba  un  mejor margen de seguridad 

			Arribo a la rada de Nouadhibou el día 4 de Mayo de 2007  a las 1500 hrs.  abarloándose a su costado de babor el buque SHELF, maniobrando posteriormente para fondear con su ancla de estribor.  Finalizada la operación de trasiego de combustible levo anclas sobre las 2200 hrs., maniobrando para facilitar el desabarloamiento del buque SHELF, posteriormente procedió a parar maquinas y arranchar las defensas Yokohama que pendían por el costado de babor.

                                 Finalizada la operación  arrumbaron hacia la salida , produciéndose la Colisión con el pesquero NAVIGATOR sobre las 23 06 hrs., como mas adelante se detalla,  el cual se encontraba fondeado. 

                                 El buque TORNADO, con daños estructurales en su bulbo y amurada de proa – estribor  prosiguió su rumbo a Las Palmas, en donde fue detenido por las Autoridades Marítimas (PSC). 

                                 El pesquero NAVIGATOR, se hundió debido a los daños sufridos en su costado .

","FISH CARRIER","Ship remains fit to proceed","3219","Russian Maritime Register of Shipping (RMRS)","2349","","22","","","","","","","","","2007-10-09",""
"C0007738","1","JORDAN EXPRESS (IMO 8105258)","JORDAN EXPRESS: SOLAS","JOR","2007-07-03 08:35","Serious"," ","anchorage area  ","0","0","Damages to ship or equipment","On 3rd July 2007 the JORDAN EXPRESS  was lowering her port anchor when at approximately 8:35 hours the anchor fell into the sea, resulting in a serious injury to one seaman and slight injury to the Bosun.","[Primary Annex 1 not designated]","[Primary Annex 1 not designated]","[Primary Annex 1 not designated]","[Primary Annex 1 not designated]","[Primary Annex 1 not designated]","[Primary Annex 1 not designated]","[Primary Annex 1 not designated]","[Primary Annex 1 not designated]","[Primary Annex 1 not designated]","[Primary Annex 2 not designated]","[Primary Annex 2 not designated]","[Primary Annex 2 not designated]","[Primary Annex 2 not designated]","[Primary Annex 2 not designated]","[Primary Annex 2 not designated]","",""
"C0006254","1","ECSTASY (IMO 8711344)","ECSTASY: SOLAS","PAN","2007-07-01 07:34","Very serious","262780N 0911000W","OPEN SEA","0","0","man overboard","On July 1st 2007 the passenger vessel ECSTASY was in open seas when at  07:34 hours LT one of the passengers, MR.DAVID RITCHESON, jumped overboard. The man overboard procedure was immediately activated and at 07.55 hours LT the man was recovered from the sea. At 08.09 hours LT the passenger was pronounced dead by the ship's doctor. ","PASSENGER","Loss of life","70367","Lloyd's Register (LR)","7200","","907","2565","","","1","","","","","",""
"C0006823","1","MARIA S. (IMO 7514220)","MARIA S.: Unknown/unspecified","PAN","2007-06-30 18:20","Very serious","095831N 0760082E","North entrance to channel at Cochin Port, India","0","0","Damages to ship or equipment","On 17 April 2007 the general cargo ship MARIA S left Tiaiyin, China, en route to Albania  with a cargo of steel rods and trucks. Her jpurney was repeatedly delayed by heavy weather, ingress of water and listing, and a change of crew took place at Singapore. Temporary repairs were carried out at Tuticorn (India), and the vessel anchored off the southern coast to take shelter. When the vessel arrived at Cochin outer anchorage she was denied entry by the port authorities, and was detained by the PSC on 29th June 2007 because of serious deficiencies. The vessel eventually sank on 30th June 2007 at a location north of the entrance to  the channel at Cochin Port. The vessel was in the charge of a Pilot, and there was no loss of life or major case of oil pollution.","GENERAL CARGO","Total loss of the ship","2614","","3645","","","","","","","","","","","",""
"C0006582","2","PRINKIPO (IMO 8030398), WMS HARLINGEN (IMO 9339040)","PRINKIPO: SOLAS, WMS HARLINGEN: Unknown/unspecified","CYP,PAN","2007-06-30 03:00","Serious"," ","kING GEORGE V DOCK (HULL) ","2","0","Collision","On 30th June 2007 the M/V PRINKIPO was inbound to King George V dock in Hull to load a cargo of maize oil. At 03.00 hours the M/V WMS Harlingen was outbound when the two vessels collided. Both vessels were under pilotage at the time. The collision occurred in a position just to the east of the Anson buoy, approximately 0.3 nm north west of the Saltend jetty. The collision appears to have occurred due to a ""manoeuvring problem"" on board m/v WMS Harlingen. No injuries to personnel were reported and there was no pollution.  ","Chemical Tanker","Ship remains fit to proceed","7286","DNV AS (DNV)","10501","","","","","","","","","","","2008-06-16",""
"C0006546","1","RONGA (IMO 7223144)","RONGA: SOLAS","PAN","2007-06-29 18:45","Serious","204524N 0703833E","MULDWARKA PORT","1","1","Stranding / grounding","THE BULK CARRIER M/V RONGA ARRIVED AT PADANG PORT, INDONESIA ON 31st  MAY 2007 AND ANCHORED OFF ROADS. ON 3 JUNE 2007 SHE BERTHED IN TO LOAD PORLAND CEMENT CARGO IN BULK FOR DISCHARGING AT HAMARIYA PORT, UAE. SHE LOADED 30115MT CARGO AND SAILED ON 7TH JUNE.
ON 29th JUNE 2007 AT 23.55HRS, THE VESSEL WAS SAFELY GROUNDED IN POSITION: LAT 20 45.24N LONG 070º38.33E OFF MULDWARKA PORT, INDIA.  A SECOND EMERGENCY MESSAGE ABOUT GROUNDING OF VESSEL WAS SENT ON DSC AND MF/HF/VHF RADIO TELEPHONE FREQUENCIES TO ALL STATIONS. THE PORT AUTHORITY AT MULDWARKA PORT WAS INFORMED ON VHF TELEPHONE ABOUT GROUNDING OF VESSEL.","Bulk Carrier","Ship remains fit to proceed","19978","","32404","","16","","","","","","","","","2008-03-05","2010-08-11"
"C0007197","1","JAL PARI-1 (-)","JAL PARI-1: Unknown/unspecified","IND","2007-06-29 05:00","Very serious"," ","Sandhakud Sea beach off Paradip Port, India","0","0","Stranding / grounding","The fishing trawler JAL PARI-1 wanted to dock at Paradip Port on 28th June 2007 for her annual inspection/dry docking repairs, but was not allowed to because of the ISPS code restriction. The crew of the trawler lifted anchor to move on, but could not start the engine in time. As a result, the trawer drifted on a high swell at strong wind speed, towards the local beach off Paradip port. It stranded on the beach at around 05.00 hours on 29th June 2007. Her crew was made up of Thai and Mynamar nationals, at least eight of whom lost their lives. The exact number could not be confirmed because another vessel, the Jal-Pari-3, had also washed up on the same beach at the same time.","Fish Catching Vessel","Total loss of the ship","78.64","","","","14","","","","","","","","","",""
"C0006444","2","STAR PROVIDENCE (IMO 8317289), THOR MERCHANT (IMO 7905895)","STAR PROVIDENCE: SOLAS, THOR MERCHANT: Unknown/unspecified","PAN,THA","2007-06-29 04:05","Serious","014415N 1043950E","SOUTH CHINA SEA","0","0","Collision","AT 04.05 LT ON 29TH JUNE 2007 THE M/V STAR PROVIDENCE WAS EN ROUTE FROM KAOSSHIUNG TO BATA, WHEN IT  COLLIDED WITH M/V THOR MERCHANT IN POSTION 01º44N 104º39 E, 28NM NORTH OF HORSBURG LIGHTHOUSE.
THE VESSEL WAS LOADED WITH BAGGED RICE 39.199.96 MT.
THERE WERE NO CASUALTIES AND NO POLLUTION FROM EITHER OF THE VESSELS.
","OPEN-HATCH BULK CARRIER","Ship rendered unfit to proceed","27226","Lloyd's Register (LR)","40698","","23","","","","","","","","","",""
"C0006240","1","ATLANTIC TRAVELLER (IMO 9058995)","ATLANTIC TRAVELLER: SOLAS","XDA","2007-06-28 09:47","Less serious","570750N 0083580E","Hanstholm Habour","0","0","Contact","When a ro-ro passenger ship entered the port of call, its usual quay berth was not available, as another ship could not depart because of bad weather. Consequently, the passenger ship had to berth at another quay. Because of heavy wind and lack of thrusters, the passenger ship was not able to turn around and it had to berth on port side instead of starboard side as planned. 

When the ship was loaded and had departed from the berth, a rescue vessel was standby to help to turn the ship around. The passenger ship went astern the stern facing the wind. After a short distance, the ship stopped and swung around to port. At this point, the wind was on port side, approximately 15 m/s. The wind was strong on port side and the ship drifted to starboard. The ship was getting closer and closer to the end of the pier, which the ship subsequently hit. 

While this was happening, attempts were made to navigate the ship further starboard. After the collision with the pier, the ship was navigated to the outer habour where the rescue vessel examined the damage. It was established that there were indentures and a hole. Shortly after, water level indicator on deck 1 triggered an alarm for deck 1. It was decided to return to the quay.
","PASSENGER/RORO CARGO/FERRY","Ship rendered unfit to proceed","16794","DNV AS (DNV)","3318","","77","","","0","0","0","0","0","0","",""
"C0006750","1","QUEST (IMO 8913904)","QUEST: Unknown/unspecified","BHS","2007-06-27 06:48","Serious","691490N 0532930W","Disko Bay, Greenland","1","0","Stranding / grounding","QUEST is a passenger ship, which sails tourists on one week round trips in Greenland waters. The actual voyage started in Kangerlussuaq on 22 June 2007 with 54 passengers and a crew of 20.
On the morning of 27th June the ship was en route from Equip Sermia to Qeqertarsuaq (Godhavn), when it grounded in calm weather 0.24 miles from the coast of the Disko Isle, approximately 1 mile east of Qeqertarsuaq.
At low water the ship listed about 15 degrees to starboard and the passengers were transferred to the shore by the ship’s Zodiac craft.
The ship was pulled free on 29th June 2007, and after an inspection by divers was allowed to proceed to Nuuk Shipyard for temporary repair of cracks in the bulb and of several dents and deformed frames in the bottom.
The ship was pulled free on 29 June and was after an inspection by divers allowed proceeding to Nuuk Shipyard for temporary repair of cracks in the bulb and of several dents and deformed frames in the bottom.
","Passenger Ship","Ship rendered unfit to proceed","1211","Bureau Veritas (BV)","170","","20","54","","","","","","","","2008-08-11",""
"C0006414","1","BARRI (IMO 8928208)","BARRI: Unknown/unspecified","LVA","2007-06-26 16:22","Very serious"," ","Riga harbour","1","0","Fire or explosion","On May 26, 2007 m/t BARRI was moored at JM-15 jetty in Riga harbour. Ship was being prepared  for a trip to RKB 7 jetty (same harbour) to collect bilge water from m/v KHATANGA. Chief engineer repeatedly tried to start the main engine for two hrs. These attempts were unsuccessful. At about 1622(UTC+3) there was an explosion in ships engine room which also caused fire. As a result of explosion both crew members lost their lives and ship was totally demolished.
","POLLUTION & DEBRIS COLLECTOR","Total loss of the ship,Pollution,Loss of life","191","[Flag Administration]","326","sludge, bilge waters, oil products with flash point >+60 C","2","0","0","2","","","","","","2008-02-13",""
"C0006712","2","GREEN PIONEER (IMO 9219941), HONG QI 201 (IMO 8033637)","GREEN PIONEER: SOLAS, HONG QI 201: Unknown/unspecified","CHN,PAN","2007-06-26 09:44","Serious","312390N 1213360E","WUSONG-KOU, CHINA","0","0","Collision","At 09.44 hours LT on 26th June 2007 a collision occurred in lat 31 23.9N, long 121 33.6E between combined chemical and oil tank GREEN PIONEER (2562 gt, built 2000) and bulker Hong Qi 201 (12096 gt, built 1980). Green Pioneer sustained damage to her starboard bow and Hong Qi 201 was damaged in the middle of the port side. -- DPS Teamhead Surveyors.","TANKER","Ship remains fit to proceed","2562","Korean Register (KR)","3497","","13","0","0","[Primary Annex 2 not designated]","[Primary Annex 2 not designated]","[Primary Annex 2 not designated]","[Primary Annex 2 not designated]","[Primary Annex 2 not designated]","[Primary Annex 2 not designated]","",""
"C0007169","1","ATHENA (IMO 9249166)","ATHENA: Unknown/unspecified","XFB","2007-06-26 04:00","Very serious"," ","Off Pointe Noire, Congo","1","1","Flooding and grounding","Le mardi 26 Juin 2007, peu avant 04:00 heures le navire ravitailleur de plate-forme française « Athena » affrété par Total E & P Congo à la compagnie Bourbon Offshore Surf,  subit un envahissement d’eau de mer du compartiment machine par tribord, alors qu’il est en « position dynamique » à 1 mille nautique au nord de la plate-forme Taf-E, au Sud-Ouest de  Pointe Noire, Congo.
La situation est rapidement évaluée et jugée suffisamment critique par le capitaine qui déclenche l’alarme de poste d’abandon. Soixante-trois personnes se trouvent à bord : vingt-six hommes d’équipage et trente-sept techniciens embarqués.

Simultanément, les tentatives  d’assèchement du compartiment machine et d’isolement de la traverse eau de mer tribord, effectuée par les second et 3ème  officiers mécaniciens, seront mises en échec par le niveau d’eau déjà atteint dans le compartiment machine.

Un plan de remorquage est décidé avec  la cellule  de crise de la compagnie, au moyen de deux autres navires présents sur le site, et « l’Athéna » sera échoué à 7.4 milles nautiques  au Nord-ouest de Pointe Noire. Après une tentative de renflouement, « l’Athena » est déclarée en perte totale. L’origine de la voie d’eau a été identique fin mars 2008.
","Supply Ship (O.R.S.V.)","Total loss of the ship","4316","","2600","","26","","37","[Primary Annex 2 not designated]","[Primary Annex 2 not designated]","[Primary Annex 2 not designated]","[Primary Annex 2 not designated]","[Primary Annex 2 not designated]","[Primary Annex 2 not designated]","2009-02-25","2010-08-10"
"C0006822","1","SEA GLORY (IMO 7212793)","SEA GLORY: Unknown/unspecified","MNG","2007-06-25 20:57","Very serious","233470N 0681386E","Sanghi/Jakau region, India","0","0","Stranding / grounding","On 19th June 2007 the general cargo ship SEA GLORY was in ballast condition en route from Dubai to the the Indian port of Gujarat. At approximately 36 - 48 hours away from her destination, she encountered heavy seas and started to roll and pitch. To avoid the effects of adverse weather the Master took the swell on the vessel's Quarters. The SEA GLORY dropped anchor off Jakau port on 25th June 2007 at 09.00 hours LT. At 13.14 hours LT her anchor dragged and a second anchor was dropped at 13.30 hours, but she continued to drift towards the Indian coast. By this time, she had dragged her anchor for almost five nautical miles. At 20.17 hours LT both anchors dragged again. The starboard chain subsequently parted and, at 20.57 hours LT the vessel grounded. On 29th June 2007 ingress of seawater was observed in No. 2 (P&S) ballast tanks. On 30th June 2007 the rate of ingress had increased, and it was apparent that the vessel could not be saved. On 1st July 2007 the vessel listed to 20 degrees, and on 3rd July 2007 she listed to 35 degrees. The vesssel was abandoned at 11.30 hours LT and by 14.30 hours LT all crew had been rescued by the Indian Coast Guard.","GENERAL CARGO","Total loss of the ship","3067","","5950","","","","","[Primary Annex 2 not designated]","[Primary Annex 2 not designated]","[Primary Annex 2 not designated]","[Primary Annex 2 not designated]","[Primary Annex 2 not designated]","[Primary Annex 2 not designated]","",""
"C0006373","1","SHUJAA 3 (IMO 7723455)","SHUJAA 3: SOLAS","PAN","2007-06-25 08:30","Very serious","2144N 0692780E","WEST OF PORBANDAR PORT, INDIA","1","1","Stranding / grounding","A) ON 18TH JUNE 2007 THE VESSEL SAILED FROM KANDLA PORT AND DROPPED ANCHOR OUTSIDE PORT LIMIT FOR INSTRUCTION. CARGO LOADED ON BOARD: 1006.266 MT STEEL FOR DISCHARGE AT KUWAIT.
B) 20/06/07 VESSEL SAILED TO THE NEXT PORT OF CALL, PORBANDAR, INDIA.
C) 21/06/07 VESSEL ARRIVED AT PORBANDAR PORT TO LOAD 5000MT SODA ASH FOR KUWAIT.
D) 21/06/07 TO 24/06/07 VESSEL WAITING AT ANCHORAGE TO BERTH IN PORBANDAR PORT.
E) 24/06/07, 17.00 HRS LT CHIEF OFFICER OBSERVED VESSEL DRAGGING ANCHOR TOWARDS SHORE.
F) 24/06/07, 18.00 HRS LT PILOT STATION INFORMED ABOUT APPROACHING DEEP DEPRESSION/CYCLONE AND ADVISED VESSEL TO MOVE TO A SAFE PLACE.
G) 24/06/07, 20.10 HRS LT VESSEL HEAVED UP ANCHOR AND SAILED TOWARDS GULF OF KUTCH TO TAKE SHELTER FROM APPROACHING CYCLONE.
H) 25/06/07, 03.30 HRS LT VESSEL UNABLE TO STEER SAFE COURSE TOWARDS GULF OF KUTCH. 04.00 HRS LT ANCHORED IN POSITION LAT 21º 43.09 N, LONG 069º27.06 E WITH 7 SHACKLES IN WATER. 04.30 HRS LT STARBOARD ANCHOR CHAIN SNAPPED FROM 5TH SHACKLE LENGTH, VESSEL STARTED DRIFTING TOWARDS SHORE.
I) 25/06/07, 06.00 HRS LT VESSEL CONTACTED INDIAN COAST GUARD FOR ASSISTANCE.
J) 25/06/07, 08.30 HRS LT DUE TO CYCLONIC/SEVERE WEATHER WIND FORCE 8 BEAUFORT SCALE, SWELL HEIGHT 6-7 METERS AND STRONG NE CURRENT VESSEL RAN AGROUND IN POSITION AT 21º44.60 N, LONG 069º27.80 E, 11NM WEST OF PORBANDAR PORT. 12 SHIP´S CREW MEMBERS ABANDON THE VESSEL. COOK, MR. SAMI AMIN, INJURED WHILE ABANDONING THE SHIP. 15 CREW MEMBERS CONTINUED ON BOARD.
K) 13/07/07 TO 23/07/07 SHIP´S BUNKERS PUMPED OUT TO SHORE TANKERS. ANOTHER 9 CREW MEMBERS INCLUDING THE MASTER EVACUATED THE VESSEL. 6 CREW MEMBERS VOLUNTEERED TO GUARD THE VESSEL FOR PILFERAGES.
L) 30/07/07 AMONG THE 6 VOLUNTEERED CREW, MESS BOY MR. P.K.S MUNOT SWEPT INTO THE SEA WHILE COMING ASHORE AND FOUND DEAD AT 19.30 HRS LT AT RATHI BEACH, 3.5 KILOMETERS S.E OF VESSEL´S GROUNDED POSITION.
","General Cargo","Ship rendered unfit to proceed","6673","International Register of Shipping (IS)","10147","","27","","","1","","","","","","2007-10-04","2010-08-11"
"C0007094","1","YOUNG LADY (-)","YOUNG LADY: Unknown/unspecified","IMN","2007-06-25 00:00","Unspecified","544050N 0010050W","54° 40.5 N  001° 00.5 W","1","0","","A large ship, dragging anchor in heavy weather, dislodged a strategic pipeline carrying gas into the United Kingdom. Although, in this case, the risk of pollution was avoided; the pipeline was out of action for over two months.","Crude Oil Aframax product carrier","","56.204","Lloyd's Register (LR)","105.528","","","","24","[Primary Annex 2 not designated]","[Primary Annex 2 not designated]","[Primary Annex 2 not designated]","[Primary Annex 2 not designated]","[Primary Annex 2 not designated]","[Primary Annex 2 not designated]","2009-01-26",""
"C0006890","2","KRISHNA I (IMO 9157155), RADHA IV (-)","KRISHNA I: Unknown/unspecified, RADHA IV: Unknown/unspecified","IND,ZZZ","2007-06-24 04:40","Very serious","184330N 0724707E","about 2 miles from Khanderi Island, off Mumbai Harbour","0","0","Collision","On 23rd June 2007 , the tug boat KRISHNA I and Dumb Barge Radha IV as a composite unit fitted with Articulate coupling system left Mumbai port en route to Revdanda port on the west coast of India. They encountered inclement weather that resulted in the failure of the Articulate Coupling system, and tug and barge became detatched.  Dumb Barge Radha IV hit the area of Krishna I's engine room resulting in ingress of water, and Krishna I eventually sank close to the vicinity of Khanderi Port Island at about midday on 25th June 2007. Dumb barge Radha IV drifted into harbour and grounded close to the shore of the naval establishment on North Karanja island near Mora. The tug had about 10  kilo litres of diesel oil on board, but no oil spillage was seen. SAR operations were carried out by port crafts and indian coast guard surface craft. Air sorties were not possible due to rough sea conditions. One crew member (the cook) died as a result of the incident and his body was found on the rocks. The other 24 crew members survived.","TUG","Loss of life,Total loss of the ship","241","Indian Register of Shipping (IRS)","324","","25","","","1","","","","","","",""
