Reference,NumberOfShipsInvolved,ShipsInvolved,SOLASStatus,FlagStates,IncidentDateTime,TypeOfCasualty,Coordinates,Location,NumberOfInvestigationReports,NumberOfAnalyses,InitialEvent,SummaryOfEvents,ShipType1,Consequences1,GrossTonnage1,ClassificationSociety1,Deadweight1,Cargo1,CrewOnboard1,PassengersOnboard1,OthersOnboard1,DeadMissingCrew2,DeadMissingPassengers2,DeadMissingOthers3,SeriouslyInjuredCrew2,SeriouslyInjuredPassengers2,SeriouslyInjuredOthers2,InvestationReportDate,AnalysisDate
"C0006838","2","ALIKI (IMO 9345427), APL PERU (IMO 9252230)","ALIKI: SOLAS, APL PERU: SOLAS","ATG,MHL","2007-10-26 03:04","Serious"," ","XIAZHI SOUTHERN ANCHORAGE in east China Sea","0","0","Collision","2007-Oct-26th-0305hrs, the M/V A LIKI anchored at XIAZHI southern anchorage was dragging and collided with starboard side the container ship APL PERU on her port side causing damages to both vessels.","","Ship remains fit to proceed","90091","Nippon Kaiji Kyokai (NKK)","180235","","22","0","0","","","","","","","",""
"C0007131","1","EWL WEST INDIES (IMO 9118501)","EWL WEST INDIES: Unknown/unspecified","BEL","2007-10-24 22:50","Very serious"," ","Alongside berth Ocamar, in purto Cabello, Venezuela","1","1","Fatality on board","On 24 October 2007, EWL West Indies was carrying out cargo operations using the ship’s cranes alongside berth Ocamar, in Puerto Cabello, Venezuela.
The third officer, who was engaged in doing container lashing on number 1 hatch along with the rest of the crew, was asked by the chief officer to open the twist locks of the hatch cover. At about 22:50 hours, this third officer was found lying down on the cross deck passage between hatch number 3 and hatch number 4.
He was taken to the military hospital for treatment and was later declared dead.	
 
","Container Ship","Loss of life","9.948","Germanischer Lloyd (GL)","13.729","","16","","","[Primary Annex 2 not designated]","[Primary Annex 2 not designated]","[Primary Annex 2 not designated]","[Primary Annex 2 not designated]","[Primary Annex 2 not designated]","[Primary Annex 2 not designated]","2009-02-17","2010-08-10"
"C0006681","1","ALANDSFARJAN (IMO 7211074)","ALANDSFARJAN: Unknown/unspecified","SWE","2007-10-23 14:04","Serious","600156N 0195219E","Aland archipelago","1","0","Stranding / grounding","
On 23rd October 2007  the Ålandsfärjan was en route from Kapellskär, Sweden to Mariehamn, Åland. When the vessel entered the Mariehamn archipelago the OOW reported the vessel's arrival to the VTS area. After doing this he turned his attention to a computer that was placed on the  table at the bridge. His intention was to take a quick look at the working schedule, but he became engrossed in the information he found and lost track of time. 
When the master arrived to the bridge he could see that the vessel was about to run aground and it was too late to doing anything about it.  He immediately put the engines on full astern and managed to reduce the speed a few knots before the vessel grounded at 14.04 hours LT. The vessel was later able to proceed to Mariehamn by its own power.
","PASSENGER/RORO CARGO/FERRY","Ship rendered unfit to proceed","6172","Marconi International Marine Company Ltd. (MIMC)","965","","44","134","","","","","","","","2008-05-08",""
"C0006732","1","THOR (IMO 7227669)","THOR: SOLAS","ITA","2007-10-23 08:45","Serious","453806N 0134605E","Port of Trieste","0","0","Machinery damage","On 23 October 2009 the tug THOR was berthed at the port of Trieste. During a cleaning operation of the sea chest on the starboard side, the engine room was flooded by sea water coming fom the sea chest line. Within approximately 20 minutes the tug was partially submerged, while berthed. The chief engineer and the fitter were cleaning the sea chests after a soft grounding suffered on October 22nd 2007 while sailing in a bottom sea mud areas. When they opened the cover of the chest and started to clean the filter, an immediate entrance of sea water flooded the engine room and the surrounding areas, at approximately 08.45 hours LT. It was not possible to activate the bilge pump as power was only available from the shoreside.
On November 08th the tug was re-floated and it was discovered that the valve between the sea chest filter and hull was in the open position. The compressed mud in the pipe and in the valve had given the impression that the valve was closed.","TUG","Ship rendered unfit to proceed","318","RINA Services S.p.A (RINA)","173","e.g. oil, dry bulkand goods under the IMDG code","5","","","[Primary Annex 2 not designated]","[Primary Annex 2 not designated]","[Primary Annex 2 not designated]","[Primary Annex 2 not designated]","[Primary Annex 2 not designated]","[Primary Annex 2 not designated]","",""
"C0006401","1","YANNA A (IMO 6715308)","YANNA A: SOLAS","PAN","2007-10-23 01:00","Less serious","381610N 0213180E","7 MILES WEST OF RIO ANTIRIO BRIDGE ","0","0","TEMPORARY BLACKOUT","ON MONDAY THE 22nd OCTOBER AT 00.17 HOURS LT, APPROXIMATELY SEVEN MILES BEFORE THE RIO-ANTIRIO BRIDGE IN PATRAS GULF, GREECE, THE VESSEL EXPERIENCED A BLACK OUT FOR ABOUT 20 MINUTES ONLY
THE WEATHER CONDITIONS ON THE PREVOIUS DAY HAD BEEN VERY STRONG (7/8 BF) RESULTING IN A SMALL MIXTURE OF WATER APPEARING IN THE GAS OIL SERVICE TANK. HOWEWVER, IT MANAGED TO BLOCK THE FUEL OIL FILTERS OF THE MAIN ENGINE AND GENETRATOR.
AFTER CHANGING FILTERS AND EXPELLING RAIN WATER FROM SERVICE TANK (OPERATION OF JUST 15/20 MINUTES) THE CHIEF ENGINEER MANAGED TO START THE ENGINE AND GENERATOR WITHOUT ANY PROBLEM.

WE CONSIDER THIS EVENT TO BE INSIGNIFICANT AND FEEL THAT IT WAS ONLY REPORTED BECAUSE SHIP WAS CLOSE TO A MONITORED AREA OF THE RIO BRIDGE . AT OUR REQUEST SHIP´S CLASSIFICATION SOCIETY ATTENDED AT NEXT PORT OF CALL (SOUSSAKI GREECE) ON 23 OCTOBER 2007 AND INSPECTED THE SHIP. THEY FOUND THE VESSEL AND HER MACHINERY TO BE IN FULL SEAWORTHY CONDITION.
CLAA REPORT IS ATTACHED (IN GREEK LANGUAGE AND TRANSLATED IN ENGLISH) ","GENERAL CARGO","Ship remains fit to proceed","781","Bulgarian Register of Shipping BRS (BRS)","1089","","7","","","","","","","","","",""
"C0006432","1","KOSMAS (IMO 6613316)","KOSMAS: SOLAS","PAN","2007-10-21 08:55","Less serious","492942N 0250344E","NEA KARVALI PORT, GREECE","0","0","Contact","ON 21ST OCTOBER 2007 AT 08.55 HOURS LT M/V KOSMAS, FLAG PANAMA, WAS BERTHING AT NEA KARVALI PORT (PHOSPHORIC FERTILIZERS INDUSTRY PRIVATE DOCK). VESSEL WAS IN BALLAST CONDITION AND CALLING A/M PORT FOR LOADING. DURING MOORING OPERATIONS, VESSEL`S BOW SLIGHTLY COLLIDED WITH THE PIER OF THE DOCK, RESULTING IN A SMALL BREACH (IN THE FORM OF A CRACK). THE VESSEL COMPLETED BERTHING SAFELY.
NO PERSONNEL, EITHER ON BOARD (CREW) OR ON SHORE WERE INJURED AS A RESULT OF THE COLLISION.
THERE WAS NO INCIDENT OF LEAKAGE LEADING TO SEA POLLUTION BY THE VESSEL`S BUNKERS OR OILS OR ANY OTHER SUBSTANCE.
NO DAMAGE WAS DONE TO THE PIER OR TO ANY ON SHOR EQUIPMENT DUE TO THE COLLISION
THE STABILITY OF THE VESSEL WAS NOT AFFECTED AT ALL BY THE BREACH OF FORE PEAK TANK.
ALL NAVIGATION/RADIO/ELECTRONICS AND MACHINERY EQUIPMENT OF THE VESSEL WERE FULLY OPERATIVE AS PER INTERNATIONAL REGULATIONS AT THE TIME OF THE COLLISION.
ALL THE VESSEL`S CERTIFICATES WERE FULLY VALID AND VESSEL WAS MANNED BY SUITABLY CERTIFIED CREW, AS PER PANAMA SAFE MANNING CERTIFICATE.
NO DANGEROUS CARGOES IN BULK OR PACKAGE FORM WERE ON BOARD AT THE TIME OF THE INCIDENT.
THE DAMAGE TO THE VESSEL`S BOW WAS FULLY RECTIFIED AT THE SAME PORT, AND THE REPAIRS WERE WITNESSED/ATTESTED BY HRS SURVEYOR WHO ATTESTED VESSEL AS FIT TO CONTINUE HER VOYAGES. ","GENERAL CARGO","Ship remains fit to proceed","2517","Hellenic Register of Shipping (HRS)","2.345","","10","","","","","","","","","",""
"C0006684","1","GAS PRUNUS (IMO 9020479)","GAS PRUNUS: SOLAS","PAN","2007-10-21 02:30","Serious"," ","Near Coast Korokuhana","0","0","Collision","On 21st October 2007 the LPG Tanker ""Gas Prunus"" salied from Takasago"" at 20:00 hours LT en route to Taicang, China with a cargo of  Vinyl Chloride Monomer.  At about 02.30 hours LT the vessel collided with an east bound pusher barge while navigating in south Mushima Island.  Damaged areas included a dent on the poop deck- port aft- corner.","LIQUEFIED GAS TANKER","Ship remains fit to proceed","3247","Nippon Kaiji Kyokai (NKK)","3785","","16","","","[Primary Annex 2 not designated]","[Primary Annex 2 not designated]","[Primary Annex 2 not designated]","[Primary Annex 2 not designated]","[Primary Annex 2 not designated]","[Primary Annex 2 not designated]","",""
"C0006436","1","VIOLET ACE (IMO 8501660)","VIOLET ACE: SOLAS","PAN","2007-10-20 19:22","Serious"," ","In Kanda Port, Fukuoka Prefecture, Japan","0","0","Stranding / grounding","Vehicles Carrier Maersk Welkin (registered Panama, 28,452 gt, built 1986), ran aground on the shallows in Kanda Port, Fukuoka Prefecture, Japan. 
She was refloated by tugs.  No water ingress, oil spill or personal injury has been reported.","VEHICLES CARRIER","Ship rendered unfit to proceed","28452","Nippon Kaiji Kyokai (NKK)","11633","","","","","[Primary Annex 2 not designated]","[Primary Annex 2 not designated]","[Primary Annex 2 not designated]","[Primary Annex 2 not designated]","[Primary Annex 2 not designated]","[Primary Annex 2 not designated]","",""
"C0006893","1","ASL PRONTO (IMO 9155200)","ASL PRONTO: Unknown/unspecified","SGP","2007-10-20 13:50","Serious","164400N 0822200E","Kakinada, India","0","0","Capsizing / listing","The tug ASL PRONTON was actings as a guide for the floating pipeline in Godavari Basin off Yanam, Kakinada, on the east coast of India. At 13.50 hours LT on 20th October 2007 the tug overturned near Gautami river in approximately 3.4 metres of water. All crew were rescued by the standby vessel operating in the proximity of this position. No loss of life or oil pollution reported. The vessel sustained damages.","TUG","Ship rendered unfit to proceed","138","","119","","7","","","","","","","","","",""
"C0007369","1","USL HAWK (IMO 9347968)","USL HAWK: Unknown/unspecified","BEL","2007-10-18 09:48","Serious"," ","From Brisbane, Australia to Hong kong, China","1","1","Main engine failure","In October 2007, the MV USL Hawlk was sailing from Brisbane, Australia to Hong Kong, China.
On the 18 October, at 09:48 hours (local time), the main engine failed and a black out occurred. The ship was not under command and drifting.

First the engine room staff thought the failure was owing to a broken stud of the fuel injector, later it became clear that the damage was more extensive.

The office was informed and communication was set up with the owners, insurance and all other parties involved.

On the 20 October, around 20:40 hours (local time), an ocean tug arrived in position and towed the ship safely to a shipyard in Cebu in the Philippines. Repairs were carried out from the 25 October till the 10 November 2007.

The crew responded well taking the circumstances into consideration.
","Container Ship","Ship rendered unfit to proceed","9948","Germanischer Lloyd (GL)","13769","","17","","","[Primary Annex 2 not designated]","[Primary Annex 2 not designated]","[Primary Annex 2 not designated]","[Primary Annex 2 not designated]","[Primary Annex 2 not designated]","[Primary Annex 2 not designated]","2009-07-09","2010-08-11"
"C0007888","1","ALMA AMY (IMO 9032501)","ALMA AMY: Unknown/unspecified","IRL","2007-10-17 00:00","Very serious"," ","Off the South East coast of Ireland","1","1","","On Wednesday 17 October 2007, a crewman fell overboard from the MFV Alma Amy and drowned in an area off the Southeast of the Wexford coast.
The cause of death was determined by post mortem examination as being due to cardiorespiratory arrest secondary to drowning.
","Fishing","Loss of life","140","","","","4","","","[Primary Annex 2 not designated]","[Primary Annex 2 not designated]","[Primary Annex 2 not designated]","[Primary Annex 2 not designated]","[Primary Annex 2 not designated]","[Primary Annex 2 not designated]","2010-09-22","2012-04-25"
"C0006397","1","CSK UNITY (IMO 9077226)","CSK UNITY: SOLAS","SGP","2007-10-16 04:37","Serious","001830N 0503880W","Amazonas River, close to Pedreiras Island.","0","0","Stranding / grounding","On October 16th 2007, the Bulk carrier ship CSK UNITY, IMO Nr 9077226, flag Singapore, call sign 9VPU, 38371 dwt, 36074 gt, built January 1995, with 25 crew, ran aground near Pedreiras Island, Amazon River, latitude 00º 18, 306 N and longitude 050º 38,808 W, at 04.37 hours local time, when travelling from Porto Trombetas harbour (Brazil) to Corpus Christi, Texas - USA.
The vessel was refloated on October 22nd 2007 at 10.09 hours LT using her own machines and with tugboat help, after trying to be refloated with the aid of their own machines without success three times. During the grounding and refloating operations no injury and no pollution (no oil spill ) were observed. ","BULK CARRIER","Ship remains fit to proceed","36074","Bureau Veritas (BV)","68371","dry bulk","25","0","0","[Primary Annex 2 not designated]","[Primary Annex 2 not designated]","[Primary Annex 2 not designated]","[Primary Annex 2 not designated]","[Primary Annex 2 not designated]","[Primary Annex 2 not designated]","",""
"C0006398","1","STENA VOYAGER (IMO 9080209)","STENA VOYAGER: Unknown/unspecified","GBR","2007-10-15 11:18","Serious","573812N 0203765W","Irish Sea","0","0","Fire or explosion"," On 15th October 2007 at 11.18 hours LT the Stena Voyager, a large catamaran, was about 30 minutes into its Irish Sea crossing when the fire alarm sounded in No 1 gas turbine engine (LM 2500) enclosure located in the port hull/pontoon.  The engineer, who was located on the bridge immediately viewed the enclosure and confirmed that there was a small but discernible flash indicating a fire.  The enclosure UV sensors picked up the fire and the automatic shut down and fire extinguishing process activated.  The engine was shut down, and the fuel, ventilation, air intake and exhaust systems were isolated.  The CO2 system was discharged into the enclosure and the fire was seen to die down and be extinguished.  In the meantime the captain alerted the passengers, and as a precaution they were issued with lifejackets.  The fire team confirmed that the fire was out - the whole fire incident lasted about 2 minutes.  It was decided to return to the departure port on the starboard hull engines.  The passengers were stood down from emergency stations a short time later.

The affected engine had its power turbine replaced as part of the lifed programme of components the previous day. However the General Electric contractors were used to dealing with aero engines which do not have a powere turbine fitted as this one does.   This trip was the first since the change.  On investigation it was found that the module, power turbine channel plate recess had some oil residue in it that was soaked up by the power turbine to exhaust lagging.  It was also found that there was a hot gas leak from the power turbine to piston seal, exhaust joint that heated up the lagging and ignited the oil that was soaked in it.  There was no damage except for a small scorch mark identifying the source of the gas leak.  The contractors attended the vessel and rectified the leak and the lagging has been replaced.  All auto drains have been cleaned and checked to ensure oil that oil leakage is directed to the drain tank as designed.
","RORO CARGO/FERRY, TWIN-HULL","Ship remains fit to proceed","19638","DNV AS (DNV)","1320","Nil","46","555","","0","0","0","0","0","0","",""
"C0006836","1","JING BO HU (IMO 8108913)","JING BO HU: Unknown/unspecified","CHN","2007-10-13 09:20","Serious"," ","Zhan Jiang Port in China","0","0","Fire or explosion","At 0930, 13th, Oct., 2007, JING BO HU, mooring at 19# anchorage of Zhanjiang port, Guangdong Province, China, which its first middle tank and second first middle tank happened explosion, causing damage to its tank, bow and causing 5 crewmembers light injury, furthermore, 68.8 tons cargo diesel leaked in sea.","TANKER","Ship rendered unfit to proceed","11780","","19989","","","","","","","","","","","",""
"C0006435","1","MAERSK WELKIN (IMO 9303558)","MAERSK WELKIN: SOLAS","SGP","2007-10-12 15:50","Serious"," ","In Mikawa Port, Aichi Prefecture, Japan","0","0","Stranding / grounding","On 12th October 2007 at 15.50 LT vehicle carrier Maersk Welkin (registered Singapore, 52,691 gt, built 2006), with 25 crews (1 Singaporean, 7 Indians, 8 Chinese, 8 Filipinos and 1 Malaysian), ran aground on the shallows in Mikawa Port, Aichi Prefecture, Japan. 
She was refloated by tugs.  No water ingress, oil spill or personal injury was reported.","VEHICLES CARRIER","Ship rendered unfit to proceed","52691","DNV AS (DNV)","21500","","25","","","[Primary Annex 2 not designated]","[Primary Annex 2 not designated]","[Primary Annex 2 not designated]","[Primary Annex 2 not designated]","[Primary Annex 2 not designated]","[Primary Annex 2 not designated]","",""
"C0006399","1","CHEMBULK SAVANNAH (IMO 9248461)","CHEMBULK SAVANNAH: SOLAS","MHL","2007-10-12 13:20","Serious","224940S 04309W","Guanabara Bay, Rio de Janeiro Harbour, accsess chanell to Exxon Mobill´s Terminal","0","0","Collision","On 12th October 2007 at 13.20 hours LT the Chemical / Oil Products Tanker ship CHEMBULK SAVANNAH, IMO nr 9248461, call sign V7DI3, built January 2002, 24404 DWT, 15148 GT, with 26 crew, was navigating for the access channel to the terminal of Movable Exxon when it collided with the buoy of demarcation of the channel, stranding soon afterwards. The vessel was refloated on the same day, with the help of two tugboats. No injuries were sustained, nor pollution (oil spill)observed during the collision with the buoy, grounding and refloating operations. The ship was unfit to proceed due to structural propeller damage, and remained waiting for repair. ","TANKER","Ship rendered unfit to proceed","15148","DNV AS (DNV)","24404","oil","26","0","0","[Primary Annex 2 not designated]","[Primary Annex 2 not designated]","[Primary Annex 2 not designated]","[Primary Annex 2 not designated]","[Primary Annex 2 not designated]","[Primary Annex 2 not designated]","",""
"C0006429","1","MSC SONIA (IMO 7111999)","MSC SONIA: SOLAS","PAN","2007-10-12 05:40","Less serious","043800N 1353900E","PACIFIC OCEAN, NORTH OF PNG","0","0","VESSEL DIVERTED FROM VOYAGE TO PICK UP TECHNICIAN TO RECTIFY ELECTRICAL PROBLEM","ON 12TH OCTOBER 2007 THE CONTAINER SHIP 'SONIA' WAS PROCEEDING FROM KAOHSIUNG TO MELBOURNE, 0540mt AT LAT 04º38N, LONG 135º39E., WHEN THE POWER FROM THE MAIN SHIPBOARD GENERATORS WAS DISRUPTED DUE TO AN ELECTRICAL FAULT. DUE TO MALFUNCTIONING  OF THE AVR, IT WAS NOT POSSIBLE FOR PARALLEL OPERATION OF THE OTHER GENERATOR. THE VESSEL WAS STOPPED FOR ABOUT 17 HOURS, DURING WHICH THE SHIP STAFF LOCATED AND REPAIRED THE FAULT ON AVR FOR NO.1 AUXILIARY ENGINE. IN KEEPING WITH THE COMPANY SAFETY POLICY, COMPETENT SERVICE TECHNICIANS WERE EMBARKED AT THE PORT OF LAE, PAPUA NEW GUINEA ON 18th OCTOBER 2007 TO THOROUGHLY CHECK AND CARRY OUT THE REQUIRED SERVICE TO THE ELECTRICAL SYSTEM OF THE SHIP. THE VESSEL RESUMED HER VOYAGE TO MELBOURNE WITH THE SERVICE TECHNICIANS ON BOARD. THERE WAS NO STRUCTURAL DAMAGE, CREW INJURY OR POLLUTION DURING THIS ENTIRE PERIOD.","CONTAINER SHIP","Ship remains fit to proceed","50646","Germanischer Lloyd (GL)","35280","","32","","","[Primary Annex 2 not designated]","[Primary Annex 2 not designated]","[Primary Annex 2 not designated]","[Primary Annex 2 not designated]","[Primary Annex 2 not designated]","[Primary Annex 2 not designated]","",""
"C0006690","1","MSC SAMANTHA (IMO 8013766)","MSC SAMANTHA: SOLAS","PAN","2007-10-10 20:15","Very serious","335700N 0353400E","BEIRUT , LEBANON","2","0","Loss of life","On 10th October 2007 at 20.15 hours LT, the electrical Officer, MR. CIPRIANO P.J. GONSALVES, who had been working on the ship's elevator, was found dead.","CONTAINER SHIP","Loss of life","30657","Bureau Veritas (BV)","34098","","26","0","0","1","","","","","","2008-05-13",""
"C0006837","1","PLATINUM DIAMOND (IMO 9160970)","PLATINUM DIAMOND: Unknown/unspecified","THA","2007-10-09 14:13","Unspecified"," ","Shanghai Baoshan wharf no.14 Shanghai port","0","0","Collision","At 1415hrs, On 9th Oct 2007, while MV JIANG Ning (Port registry NANJING, IMO No. 9425289, Owner ZHENJIANG SHIPPING CO. LTD., LOA 99.98m, Breadth 16.6m, Depth 8.4m, 4259GT, Dry Cargo Ship) handling for berthing Shanghai Baoshan wharf berth no.6, collided MV PLATINUM DIAMOND mid part of port side with angle about 60 degree. This caused some parts of the two ships indented and deformed respectively. ","CONTAINER SHIP","Ship remains fit to proceed","8892","","12855","","","","","[Primary Annex 2 not designated]","[Primary Annex 2 not designated]","[Primary Annex 2 not designated]","[Primary Annex 2 not designated]","[Primary Annex 2 not designated]","[Primary Annex 2 not designated]","",""
"C0006835","1","QIYUNHE (IMO 9228760)","QIYUNHE: Unknown/unspecified","PAN","2007-10-08 15:35","Serious","295400N 1221400E","East China Sea","0","0","Collision","A collision accident occurred at about 1537 hours local time (Beijing time) , the 7th of OCT 2007, between a PANAMA Container  vessel QI YUN HE and a China  Bulk  vessel HUA  TONG 9. The accident caused HUA  TONG  9 vessels partially destroyed but all the crew were safe .","CONTAINER SHIP","Ship remains fit to proceed","16738","","24261","","24","","","[Primary Annex 2 not designated]","[Primary Annex 2 not designated]","[Primary Annex 2 not designated]","[Primary Annex 2 not designated]","[Primary Annex 2 not designated]","[Primary Annex 2 not designated]","",""
"C0006434","2","GRAND FREE (IMO 8703062), SHIROYAMA MARU (-)","GRAND FREE: SOLAS, SHIROYAMA MARU: Unknown/unspecified","JPN,KHM","2007-10-05 20:09","Very serious"," ","Off Ushi Shima, Kagawa Prefecture, Japan","1","0","Collision","General Cargo Ship Grand Free (registered Cambodia, 648 gt, built 1987), with 7 crew (Chinese), and Tug Boat Shiroyama Maru (19 gt), towing a barge, with 2 crew (Japanese), were in collision off Ushi Shima, Kagawa Prefecture, Japan.
Grand Free sank and a little oil spill was reported.  All crew members on board both ships were unharmed.","GENERAL CARGO","Pollution,Total loss of the ship","648","","670","","7","","","","","","","","","2009-02-27",""
"C0006683","1","MT MARKAB (-)","MT MARKAB: Unknown/unspecified","NGA","2007-10-05 14:30","Very serious","062250N 0032350E","Lagos","0","0","Heavy down pour of rain and sudden change in weather","Due to heavy flood in the engine room, the ship was badly trimmed by the storm, going down bodily by the stem at a very fast rate. ","","Ship rendered unfit to proceed,Total loss of the ship","1000","","","","","","","[Primary Annex 2 not designated]","[Primary Annex 2 not designated]","[Primary Annex 2 not designated]","[Primary Annex 2 not designated]","[Primary Annex 2 not designated]","[Primary Annex 2 not designated]","",""
"C0006402","1","PANAMAX PEPPOU (IMO 8024272)","PANAMAX PEPPOU: SOLAS","PAN","2007-10-05 13:05","Serious","345680S 0681420W","12 KM PARANA RIVER","0","0","Stranding / grounding","On 4th October 2007 at 16:30hrs the m/v Panamax Peppou had departed from San Lorenzo port, T6 terminal, after loading 43076mt S.B.M. with destination to N.Europe, with sailing draughts of 10.33mtr f.w even keel..
During the navigation through the Parana river waters and the River plate the vessel was assisted by the river pilots.
On 5th October 2007 at 13:05hrs when proceeding from Emilio mitre channel to the Buenos Aires approach channel the vessel touched bottom (ran aground) at km 12 of the Buenos Aires approach channel, right side. 
At the time of the incident, the captain was on duty and assisting the navigation. Several unsuccessful attempts to refloat were carried out. Soundings around the vessel showed that the vessel was standing at her forward section about 30mts on starboard side.
At 17:30hrs the re-floating attempts where suspended waiting for H.W tide.
At 23:30hrs the re-floating maneuverings where resumed during favourable tide.
On 8th October at 00:30hrs the vessel was re-floated and Coast Guard authorised navigation to Zona Comun for further inspection at anchorage, and the vessel anchored at 03.10hours LT.
At 03:20hrs PSC boarded the vessel and joint survey with   Technical Inspector of P&I Club representative commenced.
All water ballast and bunker tanks together with confferdams and hold bilge water sounded and soundings compared with previous records with satisfactory results.
F.P.T.were inspected internally and no any damage observed and no evidence of water ingress was detected. Steering equipment was also tested with satisfactory results. No damage to vessel, cargo or environmental was observed and/or reported. Accordingly the vessel was authorised to resume navigation to destination port .
","BULK CARRIER","Ship remains fit to proceed","34446","Lloyd's Register (LR)","61537","","24","","","","","","","","","",""
