Reference,NumberOfShipsInvolved,ShipsInvolved,SOLASStatus,FlagStates,IncidentDateTime,TypeOfCasualty,Coordinates,Location,NumberOfInvestigationReports,NumberOfAnalyses,InitialEvent,SummaryOfEvents,ShipType1,Consequences1,GrossTonnage1,ClassificationSociety1,Deadweight1,Cargo1,CrewOnboard1,PassengersOnboard1,OthersOnboard1,DeadMissingCrew2,DeadMissingPassengers2,DeadMissingOthers3,SeriouslyInjuredCrew2,SeriouslyInjuredPassengers2,SeriouslyInjuredOthers2,InvestationReportDate,AnalysisDate
"C0009726","1","PEACE (-)","PEACE: Unknown/unspecified","KHM","2014-01-01 15:39","Very serious","173300S 0535800E","SOUTH WEST INDIAN OCEAN 275 MILES NORTH WEST OF SAINT-DENIS, REUNION ","0","0","Mechanical failures","THE CAMBODIAN-FLAGGED GENERAL CARGO SHIP 'PEACE' SUSTAINED MECHANICAL FAILURE AND DRIFTED IN THE SOUTH WEST INDIAN OCEAN 275 MILES NORTH WEST OF SAINT-DENIS, REUNION IN IN LAT. 17 33S., LONG. 053 58E., AT 1539 HOURS LT ON 01/01/14.

EXACT NATURE OF PROBLEM UNKNOWN. CREW ABANDONED SHIP TO LIFERAFT 220 MILES NORTHWEST OF SAINT-DENIS IN LAT. 17 37S., LONG. 054 34E., ON 02/01/14. MT 'PATRIS' PROCEEDED TO ASSIST AND RESCUED 9 CREW AND 1 BODY FROM THE LIFERAFT. SURVIVORS TAKEN TO CAPE TOWN, SOUTH AFRICA. ABANDONED DERELICT VESSEL HAD DRIFTED 190 MILES SOUTHWEST TO LAT. 20 14S., LONG. 053 08E., BY 15/01/14.","General Cargo Ship","Loss of life,Total loss of the ship","1490","","1599","","10","","","1","","","","","","",""
"C0009732","1","SAE BYOL (IMO 8823783)","SAE BYOL: SOLAS","KHM","2013-12-29 08:30","Very serious","385220N 1210080E","Bo Hai Strait","1","1","Stranding / grounding","At around 0830 on 29 December 2013, the Cambodia registered general cargo vessel SAE BYOL, owned by Dalian Jinyang shipping Co., Ltd., ran aground on the reef to the west of Haimao isle(AP 38°52′.2N；121°00′.8E) while on passage from Panjin，China to Nampo, DPRK in ballast. The vessel was subsequently declared a total loss without casualties, with a direct economic loss of $ 1,200,000.","Aggregates Carrier","Total loss of the ship","2762","Universal Shipping Bureau Inc. (USB)","4400","","0","","","[Primary Annex 2 not designated]","[Primary Annex 2 not designated]","[Primary Annex 2 not designated]","[Primary Annex 2 not designated]","[Primary Annex 2 not designated]","[Primary Annex 2 not designated]","2015-05-27","2016-08-11"
"C0013049","1","Maritime Maisie (IMO 9251535)","GRAVITY HIGHWAY: Unknown/unspecified, Maritime Maisie: SOLAS","HKG","2013-12-29 02:06","Very serious"," ","about nine nautical miles (nms) southeast of Busan, the Republic of Korea","0","0","Collision","At 0206 hours on 29 December 2013, a collision occurred between the Hong Kong registered oil/chemical tanker “Maritime Maisie” and the Bahamas registered vehicles carrier “Gravity Highway” at about nine nautical miles (nms) southeast of Busan, the Republic of Korea (South Korea). ","Chemical/Products Tanker","Ship rendered unfit to proceed","29211","Lloyd's Register (LR)","44404","","","","","[Primary Annex 2 not designated]","[Primary Annex 2 not designated]","[Primary Annex 2 not designated]","[Primary Annex 2 not designated]","[Primary Annex 2 not designated]","[Primary Annex 2 not designated]","",""
"C0009570","1","HANJIN ITALY (IMO 9484936)","AL GHARRAFA: Unknown/unspecified, HANJIN ITALY: SOLAS","LBR","2013-12-28 20:25","Serious","011299N 1035450E","Singapore Strait","0","0","Collision","On 28 December 2013 the vessel HANJIN ITALY was traveling in the Singapore Strait when a tanker AL GHARRAFA collided with her starboard side at 20:25hrs (LT).  HANJIN ITALY had recently left Pasir Pajang Terminal and was headed to Shanghai when the incident occurred.","Container Ship (Fully Cellular)","Ship remains fit to proceed","114144","Korean Register (KR)","122961","General","26","0","0","[Primary Annex 2 not designated]","[Primary Annex 2 not designated]","[Primary Annex 2 not designated]","[Primary Annex 2 not designated]","[Primary Annex 2 not designated]","[Primary Annex 2 not designated]","",""
"C0009738","1","VINH HOA (IMO 8915172)","VINH HOA: Unknown/unspecified","VNM","2013-12-28 00:00","Very serious"," ","OFF PORO POINT, LA UNION, PHILIPPINES","0","0","Stranding / grounding","STRANDED IN THE SOUTH CHINA SEA OFF PORO POINT, LA UNION, PHILIPPINES IN LAT. 16 38N., LONG. 120 17E., AT 1300 HOURS LT ON 28/12/13. DAMAGED BEYOND ECONOMICAL REPAIR AND BROKEN UP AT BUSAN, S. KOREA IN OCTOBER 2014.
NO INJURIES OR POLLUTION REPORTED. P & I CLUB SURVEYORS ATTENDED THE SCENE. 23,000 BAGS OF RICE CARGO LIGHTERED TO BARGE PRIOR TO REFLOATING ATTEMPTS. ADVERSE WEATHER CONDITIONS HAMPERED FURTHER SALVAGE OPERATIONS. REFLOATED IN SEPT 2014 AND TOWED TO BATANGAS, PHILIPPINES FOR TEMPORARY REPAIRS PRIOR TO SALE FOR DEMOLITION.","General Cargo Ship","Total loss of the ship","5506","","7371","","","","","[Primary Annex 2 not designated]","[Primary Annex 2 not designated]","[Primary Annex 2 not designated]","[Primary Annex 2 not designated]","[Primary Annex 2 not designated]","[Primary Annex 2 not designated]","",""
"C0009470","1","EVER URBAN (IMO 9169160)","EVER URBAN: Unknown/unspecified","PAN","2013-12-26 10:00","Very serious","375820N 0201460E","OPEN SEA","4","1","OTHER","We would like to inform your esteemed Organization that a very serious marine casualty has occurred on the 26th of December 2013 on board M/V EVER URBAN IMO 9169160 under Panama Flag as per attached Marine Casualty Notification. 
Herewith we would like to inform you that ""Hellenic Bureau for Marine Casualties Investigation"" has initiated a formal  safety investigation for issued very serious marine accident, pursuant to Directive 2009/18/EC and IMO ""Casualty Investigation Code"",  as incorporated in our National legislation by Law 4033/2011 (Official Government Gazette 264 A). ","Container Ship (Fully Cellular)","Serious injuries","69246","American Bureau of Shipping (ABS)","63216","","21","","","","","","1","","","2014-10-15","2015-08-03"
"C0010932","1","SAFMARINE LONGA (IMO 9500077)","SAFMARINE LONGA: Unknown/unspecified","LKA","2013-12-24 15:45","Very serious","383604N 0092402W","Coastal waters <= 12 nm","2","0","Other","A freak (abnormal) wave struck the vessel “SAFMARINE LONGA” after departing Lisbon. The anchor team were on the forecastle at the time securing both anchors - Five crewmen (all from Sri Lanka) were on the focsle deck and one inside the stores. Of the five on focsle, one was swept overboard and the remaining four, all suffered injuries. The injured four landed in Lisbon for hospitalizing on the same day and the missing person has been found as ceased. From the injured 4 there were 2 with minor injured who were discharged from hospital the next day 25th, while 2 remained hospitalized in Lisbon
Under the investigation process, Portuguese investigation body asked the cooperation of the South African Investigation Body to undergo interviews to the ship's crew
There have been full cooperation of the ship's company (based in Germany), flag State and SAMSA.","General Cargo Ship","Serious injuries","9772","[Other]","12346","","19","0","0","1","0","0","4","0","0","2018-05-25",""
"C0009527","1","SILVER (IMO 9236303)","SILVER: SOLAS","MAR","2013-12-23 17:30","Serious","282807N 0112190W","TANTAN","0","0","Stranding / grounding","La cause de l'échouement du navire SILVER est la présence d'un haut fond, constitué par un banc de sable, dont le chenal d'accès au port de TANTAN.
Le haut fond réduit la profondeur d'eau disponible et résulte d'un défaut de dragage du chenal d'accès. ","Chemical/Products Tanker","Pollution,Ship rendered unfit to proceed","4401","Lloyd's Register (LR)","6671","","17","","","[Primary Annex 2 not designated]","[Primary Annex 2 not designated]","[Primary Annex 2 not designated]","[Primary Annex 2 not designated]","[Primary Annex 2 not designated]","[Primary Annex 2 not designated]","",""
"C0009569","1","IRENES RAINBOW (IMO 9303780)","IRENES RAINBOW: SOLAS","LBR","2013-12-23 16:08","Less serious","334140N 0085660W","North Atlantic Ocean","0","0","Damages to ship or equipment","On 25 December 2013 at 16:08hrs (LT) in the Atlantic Ocean near Morocco the vessel IRENES RAINBOW lost 6 containers overboard and incurred damages to several other containers and the ship due to strong winds and seas.","Container Ship (Fully Cellular)","Ship remains fit to proceed","28592","Bureau Veritas (BV)","39382","General Cargo","21","0","0","[Primary Annex 2 not designated]","[Primary Annex 2 not designated]","[Primary Annex 2 not designated]","[Primary Annex 2 not designated]","[Primary Annex 2 not designated]","[Primary Annex 2 not designated]","",""
"C0009366","1","JINDAL VARAD (IMO 9082879)","JINDAL VARAD: SOLAS","PAN","2013-12-22 15:10","Serious"," ","BERTH 23, QINHUANGDAO, CHINA","1","0","Fire or explosion","We V-Ships Ship Management (India)Pte Ltd are the Technical Managers of the vessel Jindal Varad, IMO No. 9082879  - PANAMA FLAG . 

We would like to bring to your kind attention that the subject vessel is at Qinhuangdao port, China where there was a Fire in the E/Off cabin.","Bulk Carrier","Ship rendered unfit to proceed","39422","Bureau Veritas (BV)","75460","","23","","","[Primary Annex 2 not designated]","[Primary Annex 2 not designated]","[Primary Annex 2 not designated]","[Primary Annex 2 not designated]","[Primary Annex 2 not designated]","[Primary Annex 2 not designated]","2014-07-07",""
"C0009764","1","MANDAI MARU (IMO 8713093)","MANDAI MARU: Unknown/unspecified","JPN","2013-12-22 00:00","Very serious","282300N 1291800E","EAST CHINA SEA 2 MILES NORTHWEST OF AMAMI ISLAND, KAGOSHIMA, JAPAN","0","0","Ship Missing","REPORTED MISSING IN THE EAST CHINA SEA 2 MILES NORTHWEST OF AMAMI ISLAND, KAGOSHIMA, JAPAN IN LAT. 28 23N., LONG. 129 18E., CIRCA 22/12/13.

COASTGUARD SHIPS AND AIRCRAFT EFFECTED EXTENSIVE SAR OPERATION BUT NO TRACE OF VESSEL OR CREW FOUND. VESSEL WAS ON DELIVERY VOYAGE FROM HIROSHIMA, JAPAN TO NEW OWNERS IN MINDANAO, PHILIPPINES WITH 6 CREW ON BOARD. ALTHOUGH CONTACT WITH THE VESSEL WAS LOST ON 22/12/13 THE COASTGUARD WAS NOT ADVISED UNTIL 01/01/14. ","Fishing Vessel","Loss of life,Total loss of the ship","108","","","","","","","6","","","","","","",""
"C0009763","1","GENTLE LADY (IMO 8968818)","GENTLE LADY: Unknown/unspecified","CAN","2013-12-22 00:00","Very serious","422800N 0581900W","ATLANTIC OCEAN 125 MILES EAST OF CANSO, NS, CANADA ","0","0","Foundering","FOUNDERED IN THE ATLANTIC OCEAN 125 MILES EAST OF CANSO, NS, CANADA IN LAT. 44 28N., LONG. 058 19W., AT 0822 HOURS UTC ON 22/12/13.
4 CREW ABANDONED VESSEL AND TOOK TO A LIFERAFT AND WERE RESCUED BY FV 'OCEAN CONCORD'. THE 4 CREW MEMBERS WERE SUBSEQUENTLY TRANSFERRED TO THE CANADIAN COASTGUARD VESSEL 'SPINDRIFT'. NO INJURIES OR POLLUTION REPORTED","Fishing Vessel","Total loss of the ship","125","","","","","","","[Primary Annex 2 not designated]","[Primary Annex 2 not designated]","[Primary Annex 2 not designated]","[Primary Annex 2 not designated]","[Primary Annex 2 not designated]","[Primary Annex 2 not designated]","",""
"C0010288","2","Charon  (-), NIKI C (IMO 9497490)","Charon : Unknown/unspecified, NIKI C: SOLAS","LBR,ZZZ","2013-12-21 20:48","Very serious","060970N 0033435E","OFFSHORE LAGOS","1","1","Collision","At about 2048 hours of December 2013, two vessels MV Niki C (Bulk Carrier) and MT Charon (Tanker Barge) had just left Lagos for Warri and Agbara respectively. The MV Niki C while navigating, collided with the amidship port side of MT Charon, The Resultant damage caused the MT Charon to sink and loss of two crew members out of nine","Bulk Carrier","Loss of life","18722","","30000","","","","","2","","","","","","2016-05-07","2018-01-09"
"C0010931","1","Cochicho (-)","Cochicho: Unknown/unspecified","PRT","2013-12-21 17:00","Very serious","383900N 0091730W","Coastal waters <= 12 nm","2","0","Capsizing / listing","The pleasure boat ""Cochicho"" with 7 persons on board, when in transit to Lisbon, when was approaching to the Tejo river entrance, over the ""Cachopo do Sul"" sandbank,  have been stroked by a wave with a height over the media and had capsized. From the accident it had resulted that 6 persons had died. It had been found that the excessive speed was the cause of the accident. It had contributed to the severity of the accident the fact that no one on board wearied life jackets and that all safety equipment was stowed inside the cabinet. It had been found that the crew onboard didn't know what was the equipment that was available on board the boat in an emergence event.","Other Activities Ships","","2.581","","","","1","","6","","","","","","","2018-05-25",""
"C0010646","1","KEY BORA (IMO 9316024)","KEY BORA: SOLAS","GIB","2013-12-20 18:40","Serious"," ","Port area","1","0","Contact","At 1840 on 20 December 2013, the 93m chemical tanker Key Bora made heavy contact with the western approach jetty at Alexandra Dock, Hull. The vessel’s CPP system had a history of responding slowly to demands for astern pitch, and did not respond in time to the pilot’s order of full astern to prevent the bow striking the quay.
The bulbous bow was holed above the waterline, there was no pollution.","Chemical/Products Tanker","Ship rendered unfit to proceed","2627","Bureau Veritas (BV)","3502","","","","","[Primary Annex 2 not designated]","[Primary Annex 2 not designated]","[Primary Annex 2 not designated]","[Primary Annex 2 not designated]","[Primary Annex 2 not designated]","[Primary Annex 2 not designated]","2017-04-12",""
"C0010554","2","HEDAIYU (-), UNIVERSAL PRIME (IMO 9158886)","HEDAIYU: Unknown/unspecified, UNIVERSAL PRIME: Unknown/unspecified","MLT","2013-12-20 03:10","Serious","323036N 1240636E","Open sea - Within EEZ","3","0","Collision","On 20 December 2013, at about 0310 (UTC+8), the oil tanker Universal Prime collided with MFV Hedaiyu 204268, which was apparently engaged in fishing in position 32° 30.6’N  124° 06.6’E.  At the time of the collision, the vessel was proceeding at a speed of about 9.0 knots.  The fishing vessel was observed to be making about 2.0 knots. 

The master on board Universal Prime tried to contact the fishing vessel after the collision on VHF Channel 16 but received no response. 

There were no reported injuries as a result of the collision. 

The Maltese vessel reported damages in way of one of her bunker tanks.  As a result of the damage, a very small quantity of fuel oil spilled over the side. 

The safety investigation concluded that the immediate cause of the accident was inaccurate awareness of the developing situation on board both vessels.","Oil Tanker","Ship remains fit to proceed","156692","Bureau Veritas (BV)","299.985","","28","0","0","","","","","","","2017-02-23",""
"C0009536","1","SAINTY VANGUARD (IMO 9660578)","SAINTY VANGUARD: SOLAS","HKG","2013-12-19 09:08","Very serious"," ","Hadera, Israel","1","1","Enclosed Space Entry","	On 17 December 2013, the hydraulic remote control system for the ballast valves was found malfunctioning on board the Hong Kong,  China registered bulk carrier “Sainty Vanguard” (hereinafter referred to as the Vessel). On the next day, the crew tried to repair the system by entering the Valve Box Compartments in double bottom though the No.1 to No.4 cargo holds that were loaded with cargo “Coal”.  
	On 19 December 2013, the Bosun entered alone No.7 cargo hold forward access space without the permission or knowledge of senior shipboard staffs. The Bosun lost his conscious and was found lying on the spiral ladder in No.7 cargo hold forward access space. Thereafter both the Chief Officer and the Ordinary Seaman1 (OS1) tried to rescue and entered the same space consecutively without following the enclosed space entry procedure neither. Fortunately, the Chief Officer and the OS1 were rescued by other crew and did not lose their lives throughout the incident. The Bosun was sent to hospital by helicopter. But he was certified death by the hospital on the same date. 
	Investigation into the accident revealed that cargo hold access spaces were not safe for entry when the cargo holds were loaded with hazardous cargoes. The Bosun was overcome by high concentration of carbon monoxide and oxygen depletion inside the space that was lethal to him.
","Bulk Carrier","Loss of life","43974","Bureau Veritas (BV)","82000","","","","","[Primary Annex 2 not designated]","[Primary Annex 2 not designated]","[Primary Annex 2 not designated]","[Primary Annex 2 not designated]","[Primary Annex 2 not designated]","[Primary Annex 2 not designated]","2015-03-19","2020-01-20"
"C0009322","1","SEA MELODY (IMO 9006382)","SEA MELODY: SOLAS","BRB","2013-12-18 19:15","Very serious"," ","Groveport, River Trent","2","1","Man overboard","At 19.15 hrs on 18 December 2013, crewman X was pulled overboard from the forward mooring area of the general cargo ship Sea Melody when his foot became caught in the bight of a mooring rope as the ship was shifting berth. Despite an extensive search by the crew, a rescue helicopter, a lifeboat, coastguards and police divers the crewman's body was not found. 

","General Cargo Ship","Loss of life","2450","","3713","","8","","","1","","","","","","2017-04-12","2018-12-04"
"C0009469","1","PAZEH WISDOM (IMO 9524803)","PAZEH WISDOM: SOLAS","PAN","2013-12-18 10:00","Serious","010552S 1001902E","GOSONG SIRENDAH","1","0","Stranding / grounding","GROUNDING IN LAT: 01º05.525 LONG:100º19.02E (5NM OF TELUK BAYUR) AT 10.00 LT ON 06 18/DEC/2013","Bulk Carrier","Ship remains fit to proceed","11666","Germanischer Lloyd (GL)","18969","","20","","","[Primary Annex 2 not designated]","[Primary Annex 2 not designated]","[Primary Annex 2 not designated]","[Primary Annex 2 not designated]","[Primary Annex 2 not designated]","[Primary Annex 2 not designated]","2014-10-15",""
"C0012462","1","FLYING DOLPHIN XVII (IMO 8331467)","FLYING DOLPHIN XVII: Unknown/unspecified","GRC","2013-12-18 00:00","Serious","372620N 0233254E","Coastal waters (within 12 miles)","1","0","Stranding / grounding","On the 18th of December 2013, at about 18:50, passenger-hydrofoil ""Flying Dolphin XVII"" (Greek flag, registry of Piraeus 11483) grounded on the Isles of ""Tselevinia"". The hydrofoil was on route from the island of Hydra to the island of Poros, carrying 29 passengers. The Captain informed the Port Authority of Poros by telephone and a rescue enterprise was carried out thereafter. All the passengers were transferred to the port of Galata (right opposite to the port of Poros) by passenger launch ""John-Nakis"" (registry of Poros 22) and passenger vessel ""Christos"" (registry of Hydra 190). No injury or pollution was noted.""Flying Dolphin XVII"" re-floated by her own means and reached safely under the supervision of HCG Patrol Boat 607 and launch ""Liakos"" (registry of Poros 21) the port of Poros with one engine.The hydrofoil had suffered damage at the rudder and at both her propellers.","Passenger Ship","Ship remains fit to proceed","161.63","","","","","29","","0","0","0","0","0","0","2019-10-31",""
"C0009225","1","ONOE (IMO 9217759)","ONOE: SOLAS","JPN","2013-12-17 03:50","Very serious"," ","Berth of Cedros Island, Mexico","1","0","Fatal accident involving a crew","　While the vessel was moored at the berth of Cedros Island, Mexico, the second officer was found in an unconscious state on the dolphin wharf, about 5 to 6 meters below a shore gangway.
　It was found that the trolley wire of the shore gangway had parted.
　Subsequently, he was transferred to the terminal dispensary, but was confirmed dead.
","Bulk Carrier","Loss of life,Ship remains fit to proceed","87404","Nippon Kaiji Kyokai (NKK)","172572","","22","","","1","","","","","","2015-06-25",""
"C0009378","1","EVER APEX (IMO 9130523)","EVER APEX: SOLAS","PAN","2013-12-16 07:00","Serious"," ","PILOT SINGAPORE","1","0","Accidents with life-saving appliances","The second incident onboard M.V EVER APEX   
  
On 16th December 2013 at 0700Hrs there was a second incident onboard your vessel M.V EVER APEX when my pilot Mr Peter Wong was disembarking at DG7, when he was on the last two to three steps of the ladder before landing to the pilot boat the whole pilot ladder gave way. Fortunately Pilot Peter Wong was quick enough to jump on to the waiting pilot boat landing flat on his back on the deck. He sustained cut, scratch and bruises on his right hand from falling pilot ladder which requiring him to have medical first aid in the boat. 
  

  ","Container Ship (Fully Cellular)","Serious injuries","14807","Nippon Kaiji Kyokai (NKK)","15606","","22","","","[Primary Annex 2 not designated]","[Primary Annex 2 not designated]","[Primary Annex 2 not designated]","[Primary Annex 2 not designated]","[Primary Annex 2 not designated]","[Primary Annex 2 not designated]","2014-07-08",""
"C0009766","1","I. V. No. 10 (IMO 7012284)","I. V. No. 10: Unknown/unspecified","CAN","2013-12-15 00:00","Very serious","490100N 0653400W","ST. LAWRENCE RIVER 2 MILES WEST OF GROS MORNE, QC, CANADA IN LAT. 49 15N","0","0","Stranding / grounding","BROKE FROM TOW, DRIFTED AND STRANDED IN THE ST. LAWRENCE RIVER 2 MILES WEST OF GROS MORNE, QC, CANADA IN LAT. 49 15N., LONG. 065 34W., AT 1924 HOURS LT ON 15/12/13 IN STRONG WINDS. BROKEN UP IN SITU IN AUGUST 2014.
VESSEL WAS BEING TOWED BY THE TUG 'ANDRE H' AT THE TIME OF THE INCIDENT. NO INJURIES OR POLLUTION REPORTED. FIREFIGHTERS FROM MONT-LOUIS AND LOCAL COASTGUARD ATTENDED THE SCENE.","General Cargo Ship","Total loss of the ship","147","","320","","","","","[Primary Annex 2 not designated]","[Primary Annex 2 not designated]","[Primary Annex 2 not designated]","[Primary Annex 2 not designated]","[Primary Annex 2 not designated]","[Primary Annex 2 not designated]","",""
"C0009765","1","I. V. No. 9 (IMO 7012272)","I. V. No. 9: Unknown/unspecified","CAN","2013-12-15 00:00","Very serious","491500N 0653400W","ST. LAWRENCE RIVER 2 MILES WEST OF GROS MORNE, QC, CANADA ","0","0","Stranding / grounding","BROKE FROM TOW, DRIFTED, STRANDED AND PARTIALLY SANK IN THE ST. LAWRENCE RIVER 2 MILES WEST OF GROS MORNE, QC, CANADA IN LAT. 49 15N., LONG. 065 34W., AT 1924 HOURS LT ON 15/12/13 IN STRONG WINDS. BROKEN UP IN SITU IN AUG 2014.
SUSTAINED DAMAGE TO HULL AND TOOK WATER. VESSEL WAS BEING TOWED BY THE TUG 'ANDRE H' AT THE TIME OF THE INCIDENT. NO INJURIES OR POLLUTION REPORTED. FIREFIGHTERS FROM MONT-LOUIS AND LOCAL COASTGUARD ATTENDED THE SCENE. ","Hopper, Motor","Loss of life,Total loss of the ship","148","","320","","","","","[Primary Annex 2 not designated]","[Primary Annex 2 not designated]","[Primary Annex 2 not designated]","[Primary Annex 2 not designated]","[Primary Annex 2 not designated]","[Primary Annex 2 not designated]","",""
"C0010763","2","Caroline Russ (IMO 9197533), Merweborg (IMO 9142552)","Caroline Russ: Unknown/unspecified, Merweborg: Unknown/unspecified","ATG,CUW","2013-12-12 15:30","Serious","535207N 0084301E","Internal waters - Port area","2","0","Collision","At 1530hrs on 12 December 2013, the general cargo ship MERWEBORG, flying the flag of Curacao, collided in fog with the CAROLINE RUSS, which was laid up ahead of her at the ro-ro berth and flies the flag of Antigua & Barbuda, while mooring at Steubenhöft in Cuxhaven with the intention of collecting a technician to have the starboard radar system repaired. The MERWEBORG's starboard bow and rescue boat with davit were damaged. Moreover, the bridge wing buckled and the gantry crane was torn from its guideway. The CAROLINE RUSS had two tears on her bow above the waterline. The accident did not give rise to injuries and no pollutants escaped. The master, the chief officer, as well as the Elbe and port pilots manned the bridge of the MERWEBORG.
","General Cargo Ship","Ship remains fit to proceed","6540","","9200","Solid cargo - Dry bulk","11","0","","","","","","","","2018-03-16",""
"C0012452","1","SEGUNDO HERMANOS PAPIN (-)","SEGUNDO HERMANOS PAPIN: Unknown/unspecified","ESP","2013-12-12 00:00","Very serious","425460N 0090840W","Coastal waters (within 12 miles)","1","0","Machinery damage","On 12nd December, 2013, the fishing boat SEGUNDO HERMANOS PAPIN suffered an engine stop due to the propeller blocked with a rope or a piece of net. The crewmen lost of control of the boat, and due to strong waves she stranded at rocky area. The five crew members swam to the rocks without serious consequences. The hull broken totally because of the successive batterings of the sea.","Fish Catching Vessel","Pollution,Ship rendered unfit to proceed","13.1","","","","","0","","","","","","","","2019-10-28",""
"C0009767","1","NOUR-M (IMO 7226627)","NOUR-M: Unknown/unspecified","SLE","2013-12-11 12:15","Very serious","362649N 0281419E","RHODES, GREECE ","2","0","Capsizing / listing","BROKE MOORINGS, STRUCK THE QUAY, CAPSIZED AND PARTIALLY SANK AT RHODES, GREECE AT 1215 HOURS LT ON 11/12/13 IN HEAVY WEATHER.
ALL 4 CREW EVACUATED SAFELY. NO INJURIES OR POLLUTION REPORTED. PORT AUTHORITY WORKERS AND CREW FROM NEARBY MV 'PREVELIS' ATTEMPTED TO REATTACH MOORING LINES BUT THE VESSEL WAS REPEATEDLY THROWN AGAINST THE QUAY AND SUSTAINED SERIOUS DAMAGE. NOW LYING ON PORT SIDE PARTIALLY SUBMERGED BY QUAY.","General Cargo Ship","Total loss of the ship","1432","","2176","","","","","","","","","","","2019-07-23",""
