Reference,NumberOfShipsInvolved,ShipsInvolved,SOLASStatus,FlagStates,IncidentDateTime,TypeOfCasualty,Coordinates,Location,NumberOfInvestigationReports,NumberOfAnalyses,InitialEvent,SummaryOfEvents,ShipType1,Consequences1,GrossTonnage1,ClassificationSociety1,Deadweight1,Cargo1,CrewOnboard1,PassengersOnboard1,OthersOnboard1,DeadMissingCrew2,DeadMissingPassengers2,DeadMissingOthers3,SeriouslyInjuredCrew2,SeriouslyInjuredPassengers2,SeriouslyInjuredOthers2,InvestationReportDate,AnalysisDate
"C0012715","1","Pascal Paoli (IMO 9247510)","Pascal Paoli: Unknown/unspecified","FRA","2013-03-21 00:00","Serious","431900N 0052149E","Port","1","0","","On car deck 5 on board the ferry boat ""Pascal Paoli"" calling in at Marseilles (so without any passenger on board), a shore AB (3 years before - and graduated as ""sea going"" AB), involved in the loading operations of the trailers, believing the positioning of a trailer was complete, went between a bulkhead and the trailer to secure the lashing chains. The trailer was not fully placed. It moved back and trapped the AB. Deeply injured and shocked, he was taken to hospital. His sick leave lasted almost one year. This accident was taken to the knowledge of the BEAmer in a personal way (because it had occurred in a port) and 3 months later. The owner took immediate corrective actions, so the BEAmer did not have to make recommendations.","Passenger / Ro-Ro Cargo Ship","Serious injuries","35760","Bureau Veritas (BV)","9304","","53","0","","0","0","0","1","0","0","2020-02-17",""
"C0012696","1","Via Euros (IMO 9017862)","Via Euros: Unknown/unspecified","FRA","2013-03-21 00:00","Serious","033000N 0040000W","Open sea","1","0","","3 days after departure, from Abidjan, the seiner Via Euros was fishing in the Gulf of Guinea. An engineer officer decided to clean the heat exchanger units belonging to the cargo cooling system. After cleaning the port side one he put back that device. He began to operate the starboard side exchanger. He noticed a small steam leakage coming from the port one associated with an abnormal temperature. In order to manage the pressure, he tried to open a valve to evacuate the water towards the bilge. The pressure pushed the bonnet of this valve out of position, freeing steam. The engineer was heavily burnt on the right arm. French MRCC Boulogne was informed. In the early evening, the ship began sailing towards Abidjan whilst a French warship (with a doctor on board) approached its position. The doctor went on board the next night to check the injured man. He disembarked in the port of Abidjan and transferred to a hospital in Paris. Consequences: 30 days off for the engineer.","Fish Catching Vessel","","1737","","","","25","0","0","0","0","0","0","0","0","2020-02-17",""
"C0012684","1","Alf (-)","Alf: Unknown/unspecified","FRA","2013-03-21 00:00","Serious","514500N 0060000W","Open sea","1","0","","Whilst heaving up the trawl, on board the Alf, an AB was injured in the face by an iron block (shortly after a repair of a chain belonging to this fishing gear). The Master called the French MRCC who communicated with the British MRCC. Evacuation of the AB was decided and done by helicopter to a British hospital. Consequences: facial trauma 30 days off.","Fish Catching Vessel","Serious injuries","133.8","","","","5","0","0","0","0","0","1","0","0","2020-02-14",""
"C0009058","1","PIZARRO (-)","PIZARRO: Non-SOLAS","PER","2013-03-20 11:30","Very serious"," ","FRENTE ISLA LOBOS DE TIERRA","1","0","Capsizing / listing","201909 MAR-13 CAPIPITA.- DIA HOY 20 A 1130 HORAS RECEPCIONOSE PROTESTA INFORMATIVA SEÑOR MARIO ROSALES DIAZ, DNI 44647816 PATRON E/P """"PIZARRO"""" SIN MATRICULA INFORMANDO A 0300 HORAS APROXIMADAMENTE MIENTRAS SE ENCONTRABAN NAVEGANDO DE ISLA LOBOS DE TIERRA HACIA LA COSTA PUNTA VID, CON SIETE (07) TRIPULANTES A BORDO, POR FUERTE OLEAJE EN LA ZONA CITADA EMBARCACION SUFRIO SINIESTRO MARITIMO PROVOCANDO VOLTEADURA EN ZONA DE PEÑAS, ORIGINANDO CAIDA AL MAR TRIPULACION, LOGRANDO SALIR PROPIOS MEDIOS A LA PLAYA, SEIS (06) TRIPULANTES, TRES (03) TRIPULANTES HERIDOS CONDUCIDOS VIA TERRESTRE A POLICLINICO PETROPERU-BAYOVAR, UN (01) TRIPULANTE ENCUENTRASE CONDICON DESAPARECIDO SEÑOR CARLOS GUERRERO CHINCHAY EDAD 18 AÑOS, ESTATURA 1.50 METROS, CONTESTURA DELGADA, TEZ BLANCA, CABELLO RUBIO, PESO 62 KILOS, AL MOMENTO DE LA CAIDA VESTIA BUZO OSCURO CON CHOMPA COLOR AZUL, CON APOYO MOVILIDAD MUNICIPALIDAD PROVINCIAL SECHURA, PERSONAL ESTA, FAMILIARES REALIZARON BUSQUEDA RESULTADOS NEGATIVOS, EMITIOSE AVISO CAPITANIA FIN EMBARCACIONES DE LA ZONA COLABOREN CON LA BUSQUEDA, APERTUROSE SUMARIO, CONTINUARASE INFORMANDO.
2.- RECOMIENDASE ACTIVAR RCC, OFICIAL COORDINADOR MISION SAR TEPRI. VELARDE MORILLAS CHRISTIAN.
202105 MAR-13 JEDICAP-1.- AUTORIZADO ACTIVAR RCC.
221847 MAR-13 CAPIPITA.- DIA 20 A 1400 HORAS EFECTUOSE BUSQUEDA VIA TERRESTRE Y MARITIMA CON APOYO MOVILIDAD MUNICIPALIDAD PROVINCIAL SECHURA ACOMPANADO CINCO (05) PERSONAL SERENAZGO Y FAMILIARES; DIA 21 A 0700 HORAS CONTINUOSE BUSQUEDA CON APOYO PERSONAL BUZOS DE LA ZONA GREMIO PESCADORES PUERTO RICO - BAYOVAR, FAMILIARES E/P """"CEYRI"""" MATRICULA PT-38128-CM ENCUENTRANSE COLABORANDO CON LA BUSQUEDA EN LA ZONA RESULTADOS NEGATIVOS CONTINUARASE INFORMANDO.
251901 MAR-13 CAPIPITA.- DIA 23, 24 SE CONTINUO BUSQUEDA VIA MARITIMA, VIA TERRESTRE APOYO FAMIARES, POBLADORES AREA BAYOVAR, ZONA PUNTA AVID, PUNTA SHODE, BAHIA NUNURA, PUNTA AGUJA, BAHIA BAYOVAR, ZONA RESERVADA ILLESCAS, RESULTADOS NEGATIVOS, SE CONTINUARA INFORMANDO.
262001 MAR-13 CAPIPITA.- DIA 25 Y 26 EFECTUOSE BUSQUEDA A PARTIR 0830 A 1940 HORAS CON APOYO E/P """"MI LEONOR"""" DE MATRICULA PT-04196-BM REALIZOSE BUSQUEDA SIGUIENTES ZONAS PUNTA SHODE, BAHIA NUNURA, PUNTA AGUJA, BAHIA BAYOVAR, PLAYA PUNTA AVID, NUNURA, PLAYA REVENTAZON, VIA TERRESTRE, CON APOYO MOVILIDADES FAMILIARES CUATRIMOTOS DE PROPIEDAD ZONA RESERVADA ILLESCAS POBLADORES DE LA ZONA RESULTADOS NEGATIVOS CONTINUARESE INFORMANDO.
291111 MAR-13 CAPIPITA.- DIA 27 Y 28 SE CONTINUO BUSQUEDA DE TRIPULANTE DESAPARECIDO E/P """"PIZARRO"""" SIN MATRICULA, PERSONAL ENCARGADO PUESTO DE CONTROL BAYOVAR CON APOYO EMBARCACION PESQUERA DE LA ZONA, MOVILIDADES PARTICULARES, CUATRIMOTO DE LA ZONA RESERVADA ILLESCAS, FAMILIARES, POBLADORES DE LA ZONA BAYOBAR REALIZARON BUSQUEDA VIA MARITIMA Y TERRESTRE SIGUIENTES ZONAS PLAYA PUNTA AVID, REVENTAZON, PUNTA SHODE, BAHIA NUNURA, PUNTA AGUJA, BAHIA BAYOBAR, CUENTASE RESULTADOS NEGATIVOS SE CONTINUARA INFORMANDO.
311021 MAR-13 CAPIPITA.- DIA 29 Y 30 SE CONTINUO BUAQUEDA VIA TERRESTRE ZONA BAYOVAR, PUNTA AGUJA, BAHIA BAYOVAR, PLAYA BLANCA, ZONA VICHAYO, TRIPULANTE DESAPARECIDO E/P """"PIZARRO"""" SIN MATRICULA, PERSONAL PUESTO DE CONTROL BAYOVAR, CON APOYO FAMILIARES, POBLADORES BAYOVAR, RESULTADOS NEGATIVOS, SE CONTINUARA INFORMANDO.
031955 ABR-13 CAPIPITA.- DIA 01 – 02 Y 03 APARTIR DE 0830 HORAS HASTA 1830 HORAS PERSONAL PUESTO CONTROL BAYOVAR CON APOYO FAMILIARES POBLADORES DE LA ZONA BAYOVAR CONTINUARON BUSQUEDA VIA TERRESTRE TRIPULANTE E/P """"PIZARRO"""" SIN MATRICULA CON APOYO MOVILIDADES PARTICULARES MOTOS – CUATRIMOTOS DE PROPIEDAD ZONA RESERVADA ILLESCAS EN SIGUIENTES ARES ZONA LITORAL BAYOVAR, BAHIA BAYOVAR, BAHIA NUNURA, RESULTADOS NEGATIVOS, SE CONTINUARA INFORMANDO.
121737 ABR-13 JEDICAP-1.- SOLICITA INFORMAR RESULTADOS BUSQUEDA A LA FECHA.
131345 ABR-13 CAPIPITA.- ENCARGADO PUESTO CONTROL BAYOVAR FAMILIARES POBLADORES DE LA ZONA CON APOYO CUATRIMOTOS DE PROPIEDAD ZONA RESERVADA ILLESCAS CONTINUARON BUSQUEDA VIA TERRESTRE TRIPULANTES DESAPARECIDOS E/P """"PIZARRO"""" A LA FECHA RESULTADOS NEGATIVOS, CONTINUARASE INFORMANDO.
241853 ABR-13 CAPIPITA.- POR TIEMPO TRANSCURRIDO BUSQUEDA TRIPULANTE DESAPARECIDO E/P “PIZARRO” SIN  MATRICULA RECOMIENDASE DESACTIVAR RCC.
242143 ABR-13 JEDICAP-1.- AUTORIZADO DESACTIVAR RCC.""
","Fish Catching Vessel","Loss of life,Serious injuries,Total loss of the ship","","","","","7","0","0","1","","","","","","2017-08-25",""
"C0008952","1","NIREAS (IMO 9611905)","NIREAS: SOLAS","LBR","2013-03-20 07:44","Very serious","235060S 1513600E","Gladstone Anchorage, Queensland, Australia","1","1","Machinery damage","On 20 March 2013, an engineer on board the bulk carrier Nireas was fatally injured after being struck by flying debris when the observation window of a main air receiver drainage pot exploded. At the time of the explosion, the ship was at anchor off Gladstone, Queensland, and the engineer was carrying out the routine task of draining water from the pressurised air receiver. ","Bulk Carrier","Loss of life","44128","Lloyd's Register (LR)","82067","Dry bulk - coal","18","0","0","1","0","0","0","0","0","2014-03-21","2015-08-03"
"C0009938","1","VINACOMIN 03 (IMO 9592836)","VINACOMIN 02: Unknown/unspecified, VINACOMIN 03: Unknown/unspecified","VNM","2013-03-20 01:57","Very serious","182900N 1064100E","TONKIN GULF 30 MILES NORTHEAST OF VUNG ANG, VIETNAM ","0","0","Collision","THE VIETNAMESE-FLAGGED BULK CARRIER 'VINACOMIN 03' SANK AFTER COLLISION WITH MV 'VINACOMIN 02' IN THE TONKIN GULF 30 MILES NORTHEAST OF VUNG ANG, VIETNAM IN LAT. 18 29N., LONG. 106 41E., AT 0157 HOURS LT ON 20/03/13.

13 CREW RESCUED IMMEDIATELY BY 'VINACOMIN 02' AND THE 14TH CREW MEMBER WAS RESCUED 3 HOURS LATER. NO INJURIES REPORTED.","Bulk Carrier","Total loss of the ship","1599","","3109","","14","","","[Primary Annex 2 not designated]","[Primary Annex 2 not designated]","[Primary Annex 2 not designated]","[Primary Annex 2 not designated]","[Primary Annex 2 not designated]","[Primary Annex 2 not designated]","",""
"C0009552","1","JPO GEMINI (IMO 9294020)","JPO GEMINI: SOLAS","LBR","2013-03-19 12:10","Serious","044400N 0070200E","Port of Onne Seaport","0","0","Contact","On 19 March 2013 at 12:10hrs (LT) the vessel JPO GEMINI made contact with berth at the Port of Onne Seaport, Nigeria. As a result 40 metric tons of diesel fuel were spilled.","Container Ship (Fully Cellular)","Ship rendered unfit to proceed","25672","Germanischer Lloyd (GL)","33648","General","20","0","0","[Primary Annex 2 not designated]","[Primary Annex 2 not designated]","[Primary Annex 2 not designated]","[Primary Annex 2 not designated]","[Primary Annex 2 not designated]","[Primary Annex 2 not designated]","",""
"C0009338","1","YONG SHENG (IMO 9243813)","YONG SHENG: SOLAS","HKG","2013-03-19 03:27","Very serious","312100N 1213000E","Shanghai","0","0","Fire or explosion","A fire incident happened on board the general cargo vessel “Yong Sheng” (the Vessel) while berthing alongside Berth No.6 of Zhang Hua Bang of Shanghai. The cause of the fire incident was probably due to ignition of the flammable geotextile material inside the lower deck aft cargo compartment by sparks generated from the welding process. A fire watchman could not escape from the lower deck of compartment. The rescue team found his body but was later certified dead.","General Cargo Ship","Loss of life","14357","","19150","","","","","[Primary Annex 2 not designated]","[Primary Annex 2 not designated]","[Primary Annex 2 not designated]","[Primary Annex 2 not designated]","[Primary Annex 2 not designated]","[Primary Annex 2 not designated]","",""
"C0009079","2","CHOU SHAN (IMO 9296963), CMA CGM FLORIDA (IMO 9348704)","CHOU SHAN: Unknown/unspecified, CMA CGM FLORIDA: SOLAS","GBR,PAN","2013-03-19 00:32","Serious","313080N 1245340E","EAST CHINA SEA ","4","0","Collision","Collision between the bulk carrier Chou Shan and  MV CMA CGM FLORIDA, both ships are seriously damage.","Bulk Carrier","Ship remains fit to proceed","91166","American Bureau of Shipping (ABS)","175569","","24","","","","","","","","","2013-09-25",""
"C0009211","1","CS AZALEA (IMO 9446697)","CS AZALEA: SOLAS","PAN","2013-03-17 20:18","Serious","102409N 1202850E","INTERNATIONAL WATER","1","0","Stranding / grounding","“M/V CS AZALEA” laden with 42,010MT of coal in bulk left Muara Satui, Indonesia bound for Taizhou, China on March 14, 2013 with drawing draft F’cle 10.55 and Poop 10.80. There was no particular abnormality at the time of the departure. 
On 19:45 hrs March 17 2013, while sailing at sea of Philippines, the third officer took over the bridge watch with quarter master when sailing 12 Knots. 
Around 19:55 hrs March 17 2013 duty officer(3/O) identified some fishing boats on her head side also some fishing boats around her course line. Therefore 3/O changed her course to starboard side, however he identified again some fishing boats around 20:05 hours. He altered course again to starboard side to avoid some fishing boats, but the vessel got stranded at Queen of Sea bank at the moment around 20:18 hours on March 17, 2013 
The vessel was damaged as below 
1.	 Ballast Tank from Fore Peak Tank to No. 5 Ballast Tank. 
2.	 Engine room Sea & Overboard valve 

The vessel arrived at Zhoushan shipyard for damage repair on March 28, 2013. 
The damaged parts were repaired permanently as below. 
1) Replaced plate Fore Peak & No.1 Port & Stbd Ballast Tank 
2) Replaced plate No.2 Port & Stbd Ballast Tank 
3) Replaced plate No.3 & 4 Port & Stbd Ballast Tank 
4) Replaced plate No.5 Port & Stbd Ballast Tank 
5) Repaired Sea & Overboard Valve
 Class surveyor inspected and confirmed the permanent repair of damage parts at Zhoushan Ship Yard 
","Bulk Carrier","Ship rendered unfit to proceed","32945","Korean Register (KR)","57017","","22","","","[Primary Annex 2 not designated]","[Primary Annex 2 not designated]","[Primary Annex 2 not designated]","[Primary Annex 2 not designated]","[Primary Annex 2 not designated]","[Primary Annex 2 not designated]","2014-03-07",""
"C0008963","1","ENAS H (IMO 7366037)","ENAS H: SOLAS","XVA","2013-03-16 14:00","Very serious","363600N 0361100E","ISKENDERUN-TURKEY","0","0","OCCUPATIONAL ACCIDENT","DURING LOADING OPERATION, CARGO SLING HIT A PERSON WHO WAS RESPONSIBLE FOR COORDINATING THE LOADING OPERATION. THE MAN FELL ONTO THE BERTH AND WAS HEAVILY INJURED, HIS HEAD HITTING THE HARD SURFACE. HE LOST HIS LIFE AS A CONSEQUENCE.","General Cargo Ship","Loss of life","3685","","5482","","13","","","[Primary Annex 2 not designated]","[Primary Annex 2 not designated]","[Primary Annex 2 not designated]","[Primary Annex 2 not designated]","[Primary Annex 2 not designated]","[Primary Annex 2 not designated]","",""
"C0009475","1","Danio (IMO 9218533)","Danio: Unknown/unspecified","ATG","2013-03-16 03:30","Serious","553840N 0013670W","Longstone, Farne Islands, England","1","0","Stranding / grounding","The general cargo ship Danio grounded at Longstone, one of the Farne Islands off the coast 12 of Northumberland, England. The Farne Islands are a nature reserve and one of the 32 marine environmental high-risk areas (MEHRA) around the UK coast. They are also a European special protection area and support a signification tourism industry. The main lighthouse on Inner Farne Island has a range of 24 nautical miles.
The visibility at the time of the accident was good.
Danio made ten calls in the 6 weeks preceding the accident. At the time of grounding, it was on passage from Perth, Scotland to Genk, Belgium and had 1500 tonnes of timber cargo on board along with 27 tonnes of gas oil and 2 tonnes of lubricating oils.
The master and chief officer shared the navigation watches on a 6 hours off basis. In port, the chief officer was responsible from cargo work. The master did not share the cargo work with the chief officer; he dealt with matters on the ship including surveys, inspection and communication with the owners and charterers.  
","General Cargo Ship","","1499","","1797","","","","","[Primary Annex 2 not designated]","[Primary Annex 2 not designated]","[Primary Annex 2 not designated]","[Primary Annex 2 not designated]","[Primary Annex 2 not designated]","[Primary Annex 2 not designated]","2014-10-16",""
"C0009264","1","SCI NHAVA SHEVA (IMO 9290414)","SCI NHAVA SHEVA: SOLAS, SEA CRUISER 1: Unknown/unspecified","LBR","2013-03-15 19:45","Serious","512700N 0030000E","North Sea - Wandelaar, Belgium","0","0","Collision","While under pilotage, vessel SCI NHAVA SHEVA was involved in a collision with SEA CRUISER 1. SEA CRUISER 1 made contact with the SCI NHAVA SHEVA aft of the superstructure.","Container Ship (Fully Cellular)","Ship rendered unfit to proceed","54809","Germanischer Lloyd (GL)","67255","General Cargo in Containers","25","","4","[Primary Annex 2 not designated]","[Primary Annex 2 not designated]","[Primary Annex 2 not designated]","[Primary Annex 2 not designated]","[Primary Annex 2 not designated]","[Primary Annex 2 not designated]","",""
"C0009292","2","SCI NHAVA SHEVA (IMO 9290414), SEA CRUISER 1 (IMO 8817100)","SCI NHAVA SHEVA: Unknown/unspecified, SEA CRUISER 1: SOLAS","LBR,PAN","2013-03-15 18:40","Less serious","512550N 0030000E","BELGIAN WATER","1","0","Collision","
Our vessel Seacruiser 1  IMO8817100 has been involved in a collision with another vessel while departing Zeebrugge. No injuries and no immediate danger to the vessel. The vessel will likely re enter Zeebrugge this morning (16/03/13).  Pls can you arrange attendance to inspect the damage.  The hull has been penetrated around 6M above water line on port side forward in way of focsle.","Vehicles Carrier","Ship remains fit to proceed","7694","Nippon Kaiji Kyokai (NKK)","3184","","15","","","[Primary Annex 2 not designated]","[Primary Annex 2 not designated]","[Primary Annex 2 not designated]","[Primary Annex 2 not designated]","[Primary Annex 2 not designated]","[Primary Annex 2 not designated]","2014-05-15",""
"C0009381","1","NOVA D (IMO 8007078)","NOVA D: SOLAS","PAN","2013-03-15 12:30","Serious","411919N 0312528E","EREGLI PORT, TURKEY","1","0","Stranding / grounding","Istanbul, Mar 15 -- General cargo Nova D. (1716 gt, built 1981), undergoing cargo operations at Eregli port, during unberthing manoeuvres, drifted to shore and ran aground in shallow water area in the port at 1400 today due to prevailing strong south-westerly winds and heavy swells. A tug from Eregli port attended the incident scene in order to provide further assistance. No leaks, pollution and injury was reported due to incident. The vessel remains stationary at the grounding position and the crew are working on in order to attempt refloating under its own power.
","General Cargo Ship","Ship rendered unfit to proceed","1716","Turkish Lloyd (TL)","2319","","10","","","[Primary Annex 2 not designated]","[Primary Annex 2 not designated]","[Primary Annex 2 not designated]","[Primary Annex 2 not designated]","[Primary Annex 2 not designated]","[Primary Annex 2 not designated]","2014-07-08",""
"C0009140","1","CARNIVAL DREAM (IMO 9378474)","CARNIVAL DREAM: SOLAS","PAN","2013-03-13 13:25","Less serious"," ","PORT OF ST MARTEEN","1","0","Machinery damage"," More problems for Miami-based Carnival Cruise Lines after another of the ships develops engine problems mid cruise.
The Carnival Dream, which was on the return leg of a seven day excursion, is now docked in St. Maarten.
U.S. Coast Guard spokeswoman Sabrina Laberdesque said Thursday that Carnival Dream's captain notified the agency of trouble with the ship's propulsion system. The ship's emergency generator, which powers propulsion for ship, has reportedly failed. The Coast Guard said they have been reassured by the ship's captain that their main generator and sewage systems are unaffected by the failure.

A statement from the company acknowledged the problem but emphasized that at no time did it completely lose power.
""The Carnival Dream has a technical issue which our engineering team is currently working on. The ship is at dock in St. Maarten. At no time did the ship lose power but there were periodic inte","Passenger/Cruise","Ship remains fit to proceed","128251","Lloyd's Register (LR)","13815","","970","3646","","[Primary Annex 2 not designated]","[Primary Annex 2 not designated]","[Primary Annex 2 not designated]","[Primary Annex 2 not designated]","[Primary Annex 2 not designated]","[Primary Annex 2 not designated]","2013-11-27",""
"C0009213","2","HIGHLAND GUIDE (IMO 9215074), NCC NAJD (IMO 9299874)","HIGHLAND GUIDE: Unknown/unspecified, NCC NAJD: Unknown/unspecified","PAN,SAU","2013-03-13 02:25","Serious","011298N 1033514E","WEST OPL SINGAPORE ANCHORAGE","1","0","Collision","SI - COLLISION BETWEEN SAUDI ARABIA REGISTERED MT “NCC NAJD"", LIBERIAN REGISTERED MV “HAMMONIA GALLICUM” AND PANAMA REGISTERED MV "" HIGHLAND GUIDE"" AT ABOUT 5.2NM FROM TANJONG PINANG, SINGAPORE, ON 13 MAR 2013.","Platform Supply Ship","Ship rendered unfit to proceed","1959","American Bureau of Shipping (ABS)","3000","","14","","","[Primary Annex 2 not designated]","[Primary Annex 2 not designated]","[Primary Annex 2 not designated]","[Primary Annex 2 not designated]","[Primary Annex 2 not designated]","[Primary Annex 2 not designated]","2014-03-07",""
"C0009474","1","HAMMONIA GALLICUM (IMO 9122394)","HAMMONIA GALLICUM: SOLAS, NCC NAJD: Unknown/unspecified","LBR","2013-03-12 20:42","Less serious","011311N 1033515E","Singapore West OPL","0","0","Collision","On March 12, 2013 at 2042 hours (LT), while safely anchored at the Western OPL anchorage in Singapore, Liberia flagged vessel  HAMMONIA GALLICUM was struck by Saudi Arabia flagged vessel NCC NAJD.","Container Ship (Fully Cellular)","Ship remains fit to proceed","29383","Germanischer Lloyd (GL)","34671","Containers","10","0","0","[Primary Annex 2 not designated]","[Primary Annex 2 not designated]","[Primary Annex 2 not designated]","[Primary Annex 2 not designated]","[Primary Annex 2 not designated]","[Primary Annex 2 not designated]","",""
