Reference,NumberOfShipsInvolved,ShipsInvolved,SOLASStatus,FlagStates,IncidentDateTime,TypeOfCasualty,Coordinates,Location,NumberOfInvestigationReports,NumberOfAnalyses,InitialEvent,SummaryOfEvents,ShipType1,Consequences1,GrossTonnage1,ClassificationSociety1,Deadweight1,Cargo1,CrewOnboard1,PassengersOnboard1,OthersOnboard1,DeadMissingCrew2,DeadMissingPassengers2,DeadMissingOthers3,SeriouslyInjuredCrew2,SeriouslyInjuredPassengers2,SeriouslyInjuredOthers2,InvestationReportDate,AnalysisDate
"C0009908","1","ST. GREGORY THE GREAT (IMO 9042726)","ST. GREGORY THE GREAT: Unknown/unspecified","PHL","2013-06-15 03:00","Very serious","104600N 0094500E","ILOILO STRAIT OFF THE SIETE PICADOS ISLETS 7 MILES NE OF ILOILO CITY, PHILIPPINES ","0","0","Contact","THE FILIPINO-FLAGGED PASSENGER RO-RO SHIP 'ST. GREGORY THE GREAT' STRUCK SUBMERGED OBJECT IN THE ILOILO STRAIT OFF THE SIETE PICADOS ISLETS 7 MILES NE OF ILOILO CITY, PHILIPPINES IN LAT. 10 46N., LONG. 122 40E., AT 0300 HOURS LT ON 15/06/13. ARRIVED AT CHITTAGONG ON 21/01/15 FOR DEMOLITION.

NO INJURIES OR POLLUTION REPORTED. SUSTAINED DAMAGE TO STARBOARD SIDE OF HULL AND TOOK WATER IN ENGINE ROOM. PROCEEDED TO ILOILO CITY AT REDUCED SPEED UNDER ESCORT OF 2 TUGS FOR DIVERS INSPECTION AND PUMPING OUT. ALL PASSENGERS DISEMBARKED AND TRANSFERRED TO OTHER SERVICES. ","Passenger/Ro-Ro Ship (Vehicles)","Total loss of the ship","19468","","3516","","364","","","[Primary Annex 2 not designated]","[Primary Annex 2 not designated]","[Primary Annex 2 not designated]","[Primary Annex 2 not designated]","[Primary Annex 2 not designated]","[Primary Annex 2 not designated]","",""
"C0009013","2","Fri Ocean (IMO 9195690), FRI OCEAN (IMO 9195690)","Fri Ocean: SOLAS, FRI OCEAN: Unknown/unspecified","BHS","2013-06-14 08:02","Serious","563541N 0060056W","Sound of Mull ","1","0","Stranding / grounding","Bahamas registered cargo vessel 'FRI OCEAN' grounded on Mull, in the Sound of Mull approximately two (2) miles south of Tobermory. The vessel was on passage between Corpach Scotland, and Varberg Sweden. The ship had seven (7) crew on board and no injuries or pollution have been reported. At the time of the incident, the vessel was carrying 91 tonnes of diesel oil on board and a cargo of 2,074 tonnes of timber which were reported as stable and well secured. The Master had stated that although the vessel was ballasted down, she regained buoyancy on the evening rising tide. In fear of losing the ship he decided that the safest option for his crew was to allow the vessel to move clear of the shore. During the course of the day a number of salvage companies were mobilised to the area to carry out damage assessments. Class, MAIB and MCA were on scene. 

At this stage the vessel was reported as stable, with all engines fully operational. Temporary repairs were carried out by the crew in reducing water ingress. The ship later re-floated with minor assistance from Tobermory lifeboat and proceeded safely to anchorage at Salen Bay, Sound of Mull at 23:50 BST where the vessel remained overnight. The following morning (15/6), 'FRI OCEAN' proceeded to a second anchorage off Oban to undergo underwater inspection, Class Inspection and Port State Control. During Class inspection of the vessel it was revealed that the emergency fire pump piping had been damaged during the grounding. Damages also reported in the bow thruster compartment along with breaches in the void space and forepeak area. The breaches in the void space below the bow thrust and in the forepeak were controlled by bilge pumps and each compartment was sealed. On completion of temporary repairs that satisfied Class, the vessel sailed to Liverpool for docking and permanent repairs. ","General Cargo Ship","Ship remains fit to proceed","2218","","3640","","7","","","","","","","","","2013-12-10",""
"C0008999","1","DANISH NORTH SEA L5A (-)","DANISH NORTH SEA L5A: Unknown/unspecified","NLD","2013-06-14 07:45","Very serious"," ","100 km north of the city Den Helder, the Netherlands","0","0","Fire or explosion","An air hose snapped during pressure testing, killing two workers and seriously injuring a third, on board teh DANISH NORTH SEA L5A gas platform, located 100 kilometres north of the Dutch city of Den Helder, the Netherlands, at approximately 07:45 am, GMT, on Friday 14 June 2013.

No one employee was evacuated.  The other 13 employees remain on the platform.

The pressure tests, involving the injection of highly pressurized water were being conducted on a heat exchanger.  The L5A platform was out of production and depressurized; causing no leakage of hydrocarbon.

The incident is under investigation by the company and regulators.","Gas Platform","Loss of life","","","","","16","","","[Primary Annex 2 not designated]","[Primary Annex 2 not designated]","[Primary Annex 2 not designated]","[Primary Annex 2 not designated]","[Primary Annex 2 not designated]","[Primary Annex 2 not designated]","",""
"C0012476","1","NISOS MYKONOS (IMO 9208679)","NISOS MYKONOS: Unknown/unspecified","GRC","2013-06-14 01:00","Serious","374330N 0262342E","Coastal waters (within 12 miles)","1","0","Fire or explosion","On the 14th of June 2013, at about 16:00, Ro-Pax ""Nisos Mykonos"" was on route to the island of Samos, carrying 173 passengers and 74 crew, when a fire at the ship's funnel was reported by the ship's captain to the JRRC of Piraeus. The crew began the fire extinguishing procedure at once, while passenger mustering protocol was also carried out on the ship. Eventually the fire was put out by the crew about 2 hours later, burning the inside space of the ship's funnel and causing material damage to her. The engines had to be stopped and the passengers were taken to the nearby island of Samos (port of Karlovasi) by HCG patrol vessel 601 and passenger ship ""Panagia Theotocos"". No injury or pollution was noted .The ship was then towed to the port of Karlovasi by tug boats ""Megalochari"" and ""Vasiliki"", for temporary repairs and then to the port of Keratsini for full repairs. Investigation is carried out by HBMCI and by the evidence gathered so far, the fire started from a failure to the ship's thermal oil piping system.","Passenger / Ro-Ro Cargo Ship","Ship rendered unfit to proceed","8129","RINA Services S.p.A (RINA)","","","74","173","","0","0","0","0","0","0","2019-11-18",""
"C0009909","1","SALACAK (-)","SALACAK: Unknown/unspecified","TUR","2013-06-13 21:00","Very serious"," ","UCKUYULAR, IZMIR, TURKEY ","0","0","","THE TURKISH-FLAGGED PASSENGER RO-RO SHIP 'SALACAK' SUSTAINED TECHNICAL PROBLEMS AND STRUCK THE PIER WHILST BERTHING AT UCKUYULAR, IZMIR, TURKEY AT 2100 HOURS LT ON 10/06/13. SUBSEQUENTLY ARRIVED ALIAGA, TURKEY ON 28/08/14 FOR BREAKING UP.

3 PERSONS SUSTAINED MINOR INJURIES AND WERE TAKEN TO HOSPITAL. NO POLLUTION REPORTED. EXTENT OF DAMAGE UNKNOWN. INSPECTION EFFECTED. ","Passenger / Ro-Ro Cargo Ship","Total loss of the ship","901","","","","","","","[Primary Annex 2 not designated]","[Primary Annex 2 not designated]","[Primary Annex 2 not designated]","[Primary Annex 2 not designated]","[Primary Annex 2 not designated]","[Primary Annex 2 not designated]","",""
"C0010436","1","UNICORN LOGGER (IMO 9438810)","UNICORN LOGGER: SOLAS","PAN","2013-06-13 19:10","Serious","114560N 1241570E","Sambauan Islets ","1","0","Stranding / grounding","MV 'UNICORN LOGGER"" Depart from Sandakan, Malaysia on 11th June 2013 at 0800LT, laden with 1607 pcs / 8,367 m3 of round logs to Kisaru, Japan.

The voyage initially proceeded normally with passage plan passing the Visayas islands in the Philippines and exiting at San Bernardino strait before heading towards Japan. 
During navigation, the vessel encountered numerous fishing vessels and Unicorn Logger alter course to pass clear from the fishing vessels. Due to an evasive action, the vessel  drifted about 2Nm to the stbd of his course Passing shower sets in and visibility reduced to 2-3Nm with force 5 NE'ly winds when the vessel was about to pass Maripipi Islands.
After clearing from the fishing vessels, the OOW did not apply course leeway to return to her intended track but choose to maintain the course to steer anticipating that he will be altering to stbd after passing Maripipi Island. He did not consider that the safe passing distance to the shallow water is already about 1Nm and was too late and MV Unicorn Logger run aground in Sambauan Islets Lat 11-45.69N Long 124-15.71E at 1910LT 13th June 2013.
","General Cargo Ship","Ship rendered unfit to proceed","5691","Nippon Kaiji Kyokai (NKK)","8725","","","","","[Primary Annex 2 not designated]","[Primary Annex 2 not designated]","[Primary Annex 2 not designated]","[Primary Annex 2 not designated]","[Primary Annex 2 not designated]","[Primary Annex 2 not designated]","2016-10-18",""
"C0009093","1","HAZAL (IMO 9335707)","HAZAL: SOLAS","MLT","2013-06-13 02:30","Very serious","410700N 0371600E","PORT OF UNYE","1","1","OCCUPATIONAL ACCIDENT","DURING DISCHARGING OPERATION, BOBCAT IN THE SHIP'S CARGO HOLD HIT A PORT WORKER. THE WORKER WAS INJURED AND LOST HIS LIFE DUE TO HIS INJURIES.","General Cargo Ship","Loss of life","4649","","6500","","","","","[Primary Annex 2 not designated]","[Primary Annex 2 not designated]","[Primary Annex 2 not designated]","[Primary Annex 2 not designated]","[Primary Annex 2 not designated]","[Primary Annex 2 not designated]","2016-02-26","2017-12-04"
"C0009558","1","Dean Leanne (-)","Dean Leanne: Unknown/unspecified","IRL","2013-06-12 17:29","Very serious"," ","In the vicinity of Brownstown Head, Co. Waterford","1","0","Capsizing / listing","The “MFV Dean Leanne”, a 5.91 metre (m) L.O.A. Irish registered, open fishing
vessel departed Dunmore East at 06.53 hrs on the 12th June 2013 with a crew
of three on-board with the intention of re-positioning pots laid in Tramore Bay.
1.2 The vessel was reported missing at 17.29 hrs at which time the emergency
services were tasked.
1.3 At 17.58 hrs first casualty was sighted in the water by Waterford based
helicopter R117.
1.4 The three casualties were recovered by 18.14 hrs, two by the Dunmore East
Lifeboat and one by the Waterford based helicopter R117.
1.5 The vessel was found capsized and partially sunken.","Fish Catching Vessel","Loss of life,Total loss of the ship","","","","","","","","3","","","","","","2015-02-11",""
"C0012681","1","Francois Cecile (-)","Francois Cecile: Unknown/unspecified","FRA","2013-06-12 01:00","Very serious","431543N 0044354E","Coastal waters (within 12 miles)","1","0","","When casting a net a fisherman became trapped and fell overboard and was then pulled down into the water because of the net's weight.  He got twisted in it, taken by the armpit and the neck, about fifteen meters from the ship. The tension of the net pulled it to the bottom while the ship was drifting. The crew tried in vain to assist him. He was recovered dead shortly after.","Fish Catching Vessel","Loss of life","19.11","Bureau Veritas (BV)","","","3","0","0","1","0","0","0","0","0","2020-02-14",""
"C0009562","1","ALMI GALAXY (IMO 9579509)","ALMI GALAXY: SOLAS, SAMUDERA: Unknown/unspecified","LBR","2013-06-11 20:10","Serious","011068N 1033940E","Singapore OPL","0","0","Collision","On 11 July 2013 the vessel ALMI GALAXY was traveling outside the port limits of Singapore to Tanjun Pelepas for the discharge of part of her cargo load when she was struck by the vessel SAMUDERA at 20:10hrs (LT).  ALMI GALAXY and SAMUDERA were both eventually deemed fit to proceed following investigations subsequent to the collision.","Crude/Oil Products Tanker","Ship remains fit to proceed","84216","Lloyd's Register (LR)","157786","Crude Oil","23","0","0","[Primary Annex 2 not designated]","[Primary Annex 2 not designated]","[Primary Annex 2 not designated]","[Primary Annex 2 not designated]","[Primary Annex 2 not designated]","[Primary Annex 2 not designated]","",""
"C0009879","1","MISSISSIPPI STAR (IMO 9527623)","MISSISSIPPI STAR: SOLAS","MLT","2013-06-11 12:06","Serious","543330N 0002754W","Coastal waters <= 12 nm","1","0","Fire or explosion","On 11 June 2013, at about 1206(LT), a fire broke out in the engine-room of Mississippi Star, a Maltese registered tanker, during a ballast passage to Antwerp.  This resulted in the third engineer sustaining severe burn injuries.  The crew members were able to contain the fire using CO2.  The third engineer was airlifted by a UK Coastguard helicopter to a nearby hospital.  Despite receiving prompt medical attention, the crew member succumbed to his injuries. 
 
The safety investigation identified that the fuel oil filter housing was still pressurised when the crew member slackened the bolts of the housing cover.  This resulted in fuel oil spraying out under pressure on to a hot surface of the turbocharger and ignited.","Oil Tanker","Ship rendered unfit to proceed","8581","American Bureau of Shipping (ABS)","13054","","17","0","0","1","0","0","0","0","0","2015-06-10",""
"C0012980","2","North Tug (-), Ocean Princess (IMO 9187899)","North Tug: Unknown/unspecified, Ocean Princess: SOLAS","BMU","2013-06-10 18:00","Very serious"," ","KIRKENES, NORWAY","1","0","Capsizing / listing","On the evening of 10 June 2013, the Accident Investigation Board Norway (AIBN) was notified by
the Joint Rescue Coordination Centre Northern Norway (JRCC-NN) that the workboat North Tug
had capsized and sunk in Kirkenes. The accident had occurred in connection with North Tug
assisting the cruise ship Ocean Princess during departure from the deepwater quay. No persons
were physically injured in connection with the accident. The AIBN decided, in consultation with the
Bermudan accident investigation authority, to conduct a joint investigation of the accident.","Passenger/Cruise","Total loss of the ship","30277","Bureau Veritas (BV)","2700","","","","","[Primary Annex 2 not designated]","[Primary Annex 2 not designated]","[Primary Annex 2 not designated]","[Primary Annex 2 not designated]","[Primary Annex 2 not designated]","[Primary Annex 2 not designated]","2020-07-01",""
"C0009910","1","ASIAN EXPRESS (-)","ASIAN EXPRESS: Unknown/unspecified","MDA","2013-06-09 11:20","Very serious","095600N 0720300E","LACCADIVE SEA 130 MILES NORTHWEST OF MINICOY ISLAND, LAKSHADWEEP, INDIA ","0","0","Engine failure","THE MALDIVIAN-FLAGGED GENERAL CARGO SHIP 'ASIAN EXPRESS' SUSTAINED ENGINE FAILURE IN THE LACCADIVE SEA 130 MILES NORTHWEST OF MINICOY ISLAND, LAKSHADWEEP, INDIA IN LAT. 09 56N., LONG. 072 03E., AT 1120 HOURS LT ON 09/06/13 IN HEAVY WEATHER. SUBSEQUENTLY SANK ON 13/06/13.

TEMPORARY REPAIRS EFFECTED AND CONTINUED ON VOYAGE BUT ENGINE FAILED AGAIN IN LAT. 08 59N., LONG. 072 26E., AT 2340 HOURS LT ON 10/06/13. DEVELOPED 4 METRE CRACK IN STARBOARD SIDE OF HULL BELOW THE WATERLINE AND TOOK WATER. ICGS TRAINING VESSEL 'VARUNA' PROCEEDED TO ASSIST AND RESCUED ALL 22 PERSONS ON BOARD ON 12/06/13 AND TOOK THEM TO KOCHI, INDIA. SUBSEQUENTLY SANK AT 0457 HOURS LT ON 13/06/13 IN LAT. 09 07N., LONG. 073 19E. ","General Cargo Ship","Total loss of the ship","5955","","7085","","","","","[Primary Annex 2 not designated]","[Primary Annex 2 not designated]","[Primary Annex 2 not designated]","[Primary Annex 2 not designated]","[Primary Annex 2 not designated]","[Primary Annex 2 not designated]","",""
"C0009559","1","RHL FIDELITAS (IMO 9426805)","RHL FIDELITAS: SOLAS","LBR","2013-06-08 16:20","Serious","012690N 1042740E","Traffic Seperation Seaway, Singapore Strait","0","0","Collision","On 8 June 2013 the vessel RHL FIDELITAS was traveling the traffic separation scheme of the Singapore Strait when it collided with the vessel NYK MINO at 16:20hrs (LT).  The ship was deemed fit to continue to the port of Singapore for repairs without substantial assistance required.","Container Ship","Ship remains fit to proceed","54182","Germanischer Lloyd (GL)","62920","General","21","0","0","[Primary Annex 2 not designated]","[Primary Annex 2 not designated]","[Primary Annex 2 not designated]","[Primary Annex 2 not designated]","[Primary Annex 2 not designated]","[Primary Annex 2 not designated]","",""
"C0009934","1","THEODOROS MARIA Z (IMO 8969082)","THEODOROS MARIA Z: Unknown/unspecified","BLZ","2013-06-07 00:00","Very serious","041400N 0063700W","3 MILES SOUTH OF SAN PEDRO, IVORY COAST","0","0","","CAPSIZED IN THE GULF OF GUINEA 3 MILES SOUTH OF SAN PEDRO, IVORY COAST IN LAT. 04 14N., LONG. 006 37W., AM ON 06/07/13 IN HEAVY SWELL.
15 PERSONS RESCUED AND TAKEN TO SAN PEDRO. NO INJURIES REPORTED. 1 PERSON DEAD. UPTURNED HULL SUBSEQUENTLY DRIFTED ASHORE NEAR SAN PEDRO. 4000 LITRES OF BUNKER FUEL REMOVED AND WRECK DISMANTLED IN SITU. CAUSE OF CAPSIZE REPORTED TO BE PROBABLE SHIFT OF CARGO IN HEAVY SWELL.","Passenger Ship","Loss of life,Total loss of the ship","479","","","","","","","1","","","","","","",""
"C0009335","1","GODAFOSS (IMO 9086796)","GODAFOSS: SOLAS","ATG","2013-06-06 22:00","Less serious","555560N 0141700E","Zatoka Pomorska, entrance channel to port of Swinoujscie ","1","0","Stranding / grounding","M/v Godafoss after embarking port pilot on board headed toward entrance channel of port of Swinoujscie on 03rd July 2013. At 16:50 ship passed the head of central breakwater. Around 16:52 when the ship's bow was approaching buoy ""B"" ship's captain wanted to keep ship at the central line of fairway, therefore he performed few consecutive manoeuvers with the wheel and than with main engine and in the end  he used the bow thruster. Despite those manoeuers the ship deviated east from central line of the fairway. Finally at 16:54 ship grounded with her bow on the slope of the central breakwater between groins no. 4 and no.5.
Crew took soundings around the ship and of the bow ballast tanks. No leak was found so, it was decided to get back the ship floated independently. The result of main engine and wheel manoeuvers was positive. The ship was refloated at 17:41 and proceeded toward the berth. At 18:10 ship moored stb side at Nabrzeże Gornikow berth in port of Swinoujscie.","Container Ship (Fully Cellular)","Ship remains fit to proceed","14664","DNV AS (DNV)","17042","containers","13","0","1","[Primary Annex 2 not designated]","[Primary Annex 2 not designated]","[Primary Annex 2 not designated]","[Primary Annex 2 not designated]","[Primary Annex 2 not designated]","[Primary Annex 2 not designated]","2014-06-25",""
"C0009911","1","HEMISFERIO SUL (IMO 8812071)","HEMISFERIO SUL: Unknown/unspecified","PRT","2013-06-06 07:44","Very serious","345900N 0390800W","NORTH ATLANTIC OCEAN 805 MILES WEST OF SAO MIGUEL ISLAND, AZORES, PORTUGAL ","0","0","Fire or explosion","THE PORTUGUESE-FLAGGED STERN TRAWLER 'HEMISFERIO SUL' CAUGHT FIRE AND SUBSEQUENTLY CAPSIZED IN THE NORTH ATLANTIC OCEAN 805 MILES WEST OF SAO MIGUEL ISLAND, AZORES, PORTUGAL IN LAT. 34 59N., LONG. 039 08W., AT 0744 HOURS LT ON 06/06/13.

NO POLLUTION OR INJURIES REPORTED. VESSEL REPORTED TO HAVE SANK AFTER FIRE WAS BURNT OUT. NEARBY FV 'MARDANI' RESCUED THE 12 CREW ON BOARD AND PROCEEDED TO HORTA, FAIAL ISLAND, AZORES, PORTUGAL.","Stern Trawler","Total loss of the ship","252","","210","","12","","","[Primary Annex 2 not designated]","[Primary Annex 2 not designated]","[Primary Annex 2 not designated]","[Primary Annex 2 not designated]","[Primary Annex 2 not designated]","[Primary Annex 2 not designated]","",""
"C0009514","1","PERLA (IMO 8405842)","PERLA: SOLAS","LBR","2013-06-05 09:30","Serious","044110N 0544820E","Arabian Sea","0","0","Fire or explosion","At approximately 06:30 hours (LT) on 05 June 2013, Liberian flagged Oil/Chemical tanker ship M/V PERLA experienced a fire which started in the engine room. The fire was ultimately extinguished successfully via use of the CO2 system. There were no incidents of environmental pollution but there were damages to the vessel and serious injuries to four of the persons onboard.","Chemical/Products Tanker","Serious injuries,Ship rendered unfit to proceed","30831","Lloyd's Register (LR)","48577","Chemical/Oil","24","0","8","[Primary Annex 2 not designated]","[Primary Annex 2 not designated]","[Primary Annex 2 not designated]","[Primary Annex 2 not designated]","[Primary Annex 2 not designated]","[Primary Annex 2 not designated]","",""
"C0012401","1","MAR BRAVA DOS (-)","MAR BRAVA DOS: Unknown/unspecified","ESP","2013-06-05 01:00","Very serious","423595N 0035449E","Open sea","1","0","Fire or explosion","Fishermen set the fishing long lines and they fell asleep. Suddenly the skipper woke up because he smelt like smoke. He went to the engine room and realised that there was fire. Fishermen left the boat and were rescued by a Spanish fishing vessel. Later they were evacuated to the hospital by aFrench helicopter.","Fish Catching Vessel","Pollution,Ship rendered unfit to proceed,Total loss of the ship","37.51","","","Fish in bulk","3","0","0","","","","","","","2019-10-25",""
"C0009354","1","Tidesund (IMO 9419216)","Tidesund: Unknown/unspecified","NOR","2013-06-04 10:25","Less serious","622342N 0061000E","Internal waters - Port area","0","0","Contact","Passenger ferry  allided with quay at Sulesund. Some dolphins on quay damaged. Only cosmetic damage on the vessel. After an assessment made by the crew the vessel continued on route.","Passenger / Ro-Ro Cargo Ship","Ship remains fit to proceed","2979","","","","","","","","","","","","","",""
"C0009919","1","MATTHEW I (IMO 6417011)","MATTHEW I: Unknown/unspecified","XVA","2013-06-04 00:00","Very serious"," ","CARIBBEAN SEA NORTH OF ARUBA ","0","0","Engine problems","THE TANZANIAN-FLAGGED GENERAL CARGO SHIP 'MATTHEW I' SUSTAINED MAIN ENGINE PROBLEMS, CAUGHT FIRE AND SUBSEQUENTLY SANK IN THE CARIBBEAN SEA NORTH OF ARUBA ON 04/06/13 IN GOOD WEATHER.

ALL 10 CREW ABANDONED SHIP TO LIFERAFTS AND RESCUED BY OPV HNLMS 'HOLLAND'. NO INJURIES REPORTED. FIRE FIGHTING ATTEMPTS BY HNLMS 'HOLLAND' WERE UNSUCCESSFUL AND SUBSEQUENTLY SANK LATER THE SAME EVENING. RESCUED CREW TRANSFERRED TO USCG VESSEL.","General Cargo Ship","Total loss of the ship","659","","760","","10","","","[Primary Annex 2 not designated]","[Primary Annex 2 not designated]","[Primary Annex 2 not designated]","[Primary Annex 2 not designated]","[Primary Annex 2 not designated]","[Primary Annex 2 not designated]","",""
"C0010927","1","POR DEUS AJUDADO (-)","POR DEUS AJUDADO: Unknown/unspecified","PRT","2013-06-03 13:15","Very serious","404856N 0084310W","Coastal waters <= 12 nm","2","0","Capsizing / listing","By 13:15 of 03JUL2013, the vessel listed to starboard and  while was hauling trammel nets at 1.25 mn from the coast . It was still to be hauled about 384 m of a total of 5000 m. Eventually the vessel sank. 

6 crew members were shipwrecked, and 5 of them were rescued with the assistance of another fishing vessel while 1 was missing. This one could not swim. 

The crew wore no lifesaving equipment or any other emergency flotation vest. 

Later the vessel was recovered and put into the port of Aveiro.

It was detected a damaged tube (leaking water from its inside to the engine room) that makes part of the refrigeration system of the engine. According to the statements of the survivors , the vessel had an alarm of flooding in the engine room, which was not activated ( at least in the audible mode). 

The vessel was 2 years old and sailing at a speed of 2 kts .","Fish Catching Vessel","Ship rendered unfit to proceed","13.18","","","Solid cargo - Fish in bulk","6","","","1","","","","","","2018-05-25",""
"C0010051","2","MANTOUDI (IMO 6519326), SEABOURN SPIRIT (IMO 8807997)","MANTOUDI: Unknown/unspecified, SEABOURN SPIRIT: Unknown/unspecified","BHS,GRC","2013-06-01 08:50","Serious","375617N 0233813E","Internal waters - Port area","2","0","Damages to ship or equipment","M/T MANDOUDI lost control and hit the dock while manoeuvering in Piraeus port to get alongside to cruise ship SEABOURNE SPIRIT to deliver bunkers. M/T MANDOUDI sustained hull damages (holes ad plating deformations) to the bow and fore peak tank.
SEABOURNE SPIRIT suffered minor scratces to her side above SWL.","Oil Tanker","Ship rendered unfit to proceed","452.76","","599","","5","0","","","","","","","","2015-08-31",""
"C0009525","1","WILSON LEITH (IMO 9150509)","WILSON LEITH: Unknown/unspecified","MLT","2013-05-31 22:32","Serious","533200N 0001300E","Coastal waters <= 12 nm","1","0","Damages to ship or equipment","At 2230(UTC) on 31 May 2013, Wilson Leith arrived off Spurn Point, UK.  A pilot boat came alongside to pick up the pilot.  Soon after the pilot stepped on the pilot ladder, the side ropes parted.  The pilot fell on the pilot boat, injuring his right foot and ankle. 

Stereomicroscopy of rope filaments sampled from near the failed ends showed signs of abrasion damage.","General Cargo Ship","Serious injuries,Ship remains fit to proceed","2446","Bureau Veritas (BV)","3695","","8","0","1","0","0","0","0","0","1","2015-01-13",""
"C0009920","1","LINTAS BAHARI UTAMA (IMO 7607259)","LINTAS BAHARI UTAMA: Unknown/unspecified, LINTAS BENGKULU: Unknown/unspecified","IDN","2013-05-31 21:10","Very serious","060300S 1065200E","TANJUNG PRIOK, INDONESIA ","0","0","Collision","IN COLLISION WITH MV 'LINTAS BENGKULU', DEVELOPED LIST AND SUBSEQUENTLY SANK IN THE APPROACHES OF TANJUNG PRIOK, INDONESIA WHILST DEPARTING TERMINAL IN LAT. 06 03S., LONG. 106 52E., AT 2110 HOURS LT ON 31/05/13.

REPORTED 14 CREW RESCUED AND 1 CREW MEMBER MISSING. A NUMBER OF VESSELS FROM THE NAVY, MARINE POLICE AND LOCAL AUTHORITIES ASSISTED IN RESCUING OF CREW. OIL BOOMS LAID TO CONTAIN SPILLED OIL. WRECK REMOVAL TO BE SCHEDULED. ","General Cargo Ship","Loss of life,Pollution,Total loss of the ship","1705","","830","","","","","1","","","","","","",""
