Reference,NumberOfShipsInvolved,ShipsInvolved,SOLASStatus,FlagStates,IncidentDateTime,TypeOfCasualty,Coordinates,Location,NumberOfInvestigationReports,NumberOfAnalyses,InitialEvent,SummaryOfEvents,ShipType1,Consequences1,GrossTonnage1,ClassificationSociety1,Deadweight1,Cargo1,CrewOnboard1,PassengersOnboard1,OthersOnboard1,DeadMissingCrew2,DeadMissingPassengers2,DeadMissingOthers3,SeriouslyInjuredCrew2,SeriouslyInjuredPassengers2,SeriouslyInjuredOthers2,InvestationReportDate,AnalysisDate
"C0007697","2","CIVRA (IMO 9212773), TASMANIE (-)","CIVRA: Unknown/unspecified, TASMANIE: Unknown/unspecified","","2009-10-15 07:41","Very serious"," ","Seine, at Aizier (Eure), France","1","0","Collision","Le 15 Octobre 2009, en Seine, peu avant l’aube par visibilité réduite, l’automoteur Tasmanie faisant route vers Rouen avec pilote fluvial à bord, a une avarie de barre alors qu’il se trouve à proximité d’Aizier (Km 323). Bien que la barre soit rapidement commutée en commande manuelle et que le bateau retrouve sa capacité de manœuvre, il touche la berge sud de l’avant bâbord et pivote cap vers l’aval. Puis, sous l’effet du courant  de flot, le bateau décolle du bord et dérive vers la berge nord. Le pilote et le patron du Tasmanie décident de rallier Caudebec en faisant éviter le bateau vers l’amont.

Au même moment, le cargo turc Civra, pilote maritime à bord, cap vers l’aval, se trouve également à proximité d’Aizier.

Malgré les contacts VHF et des manœuvres de dernière minute, la collision se produit à 07 :41 heures, le Civra ayant stoppé sa machine et cassé son erre.

Le choc s’est produit entre le bulbe du Civra et le bordé tribord du compartiment moteur du Tasmanie ; une importante voie d’eau se déclare, faisant craindre à son équipage un naufrage rapide. Le pilote du Tasmanie lance alors un Mayday par VHF, tout en poursuivant sa manœuvre vers la berge nord. Le pilote maritime propose l’assistance du canot de sauvetage du Civra ; le pilote du Tasmanie annonce qu’il contrôle la situation et le bateau est échoué et mouillé, hors de tout danger,  à 25 m de la berge où il coulera peu après.

Les secours sont coordonnés par RPC. Un barrage antipollution est installé à titre préventif autour de l’épave.

A 10 :00 heures, le Civra accoste à Radicatel pour inspection de sa coque à la demande de RPC.
","Self-propelled","Total loss of the ship","","RINA Services S.p.A (RINA)","","","2","","","[Primary Annex 2 not designated]","[Primary Annex 2 not designated]","[Primary Annex 2 not designated]","[Primary Annex 2 not designated]","[Primary Annex 2 not designated]","[Primary Annex 2 not designated]","2010-04-06",""
"C0007709","1","LUTIN DES MERS (-)","LUTIN DES MERS: Unknown/unspecified","","2009-10-14 17:40","Very serious"," ","near Plateau de Rochebonne","1","0","Man overboard","Le 14 Octobre 2009 en fin d’après-midi, le Lutin Des Mers se trouve  à 18 miles dans l’Ouest de la pointe des Baleines et file une nappe de filets. Un matelot, occupé sur les bacs à filets, est croché par une jambe et passe par-dessus bord.

Bien que le patron, averti par le cri de la victime, ait stoppé immédiatement, les filets continuent de partir à l’eau avant d’être bloqués, entraînant la victime sous l’eau par leur poids. Le patron prévient le CROSS Etel. Le Lutin Des Mers se trouvant avec son hélice engagée dans ses filets, un autre fileyeur vient l’assister pour relever ceux-ci et dégager la victime, trouvée entrainée par un intermédiaire et décédée. 
","Fish Catching Vessel","Loss of life","73.69","","","","6","","","[Primary Annex 2 not designated]","[Primary Annex 2 not designated]","[Primary Annex 2 not designated]","[Primary Annex 2 not designated]","[Primary Annex 2 not designated]","[Primary Annex 2 not designated]","2010-04-08",""
"C0007534","2","9 HANGIL (-), JH YOUNG (IMO 8914934)","9 HANGIL: Unknown/unspecified, JH YOUNG: Unknown/unspecified","KOR,ZZZ","2009-10-14 14:00","Very serious","355400N 1293800E","Near the Pohang port","0","0","Collision","JH Young, general cargo vessel departed from China and proceed to Pohang in korea.
9 HANGIL, the fishing vessel was engaged in fishery work.
Both vessel collided and the fishing vessel sunken.
As a result, 3 crew was dead and 1 crew was missing.   ","GENERAL CARGO","","5556","","6901","","","","","[Primary Annex 2 not designated]","[Primary Annex 2 not designated]","[Primary Annex 2 not designated]","[Primary Annex 2 not designated]","[Primary Annex 2 not designated]","[Primary Annex 2 not designated]","",""
"C0008001","1","FLAG INVESTORS (IMO 6714017)","FLAG INVESTORS: SOLAS","PAN","2009-10-12 07:48","Very serious"," ","ADABIYA PORT- EGYPT","1","1","Fire or explosion","The MV FLAG INVESTORS is a cement carrier and has a factory onboard with the capacity of bag the cement that carries onboard for discharging.  For this reason, the complement of the crew was of 41 persons, which included deck and engine crew and personnel for the work on the factory.  
The vessel arrived to Adabiya Anchorage, Egypt on September 17th, 2009 bound from Karachi, Pakistan loaded with approximately 20,692 Tons of Cement.  The vessel commenced discharge of cargo on September 25th, 2009 at a rate of approximately 1,000 tons per day.  On October 10th, 2009 between 1800hrs to 1945hrs the vessel shifted by ropes 100m ahead on the same berth.  The present position allowed two conveyor belts out only due to shore cranes with an estimated time for completion of cargo for October 14th, 2009.
On the day of the incident the drafts of the vessel were 4.52m fwd and 6.91m aft and had approximately, 312mt of IFO, 89mt of MGO, 8,000 ltrs of LO and 341mt of Fresh Water onboard.

On October 12th, 2009 at approx. 0748lt (+4GMT) during cargo operations heavy smoke was spotted coming out from starboard side on the upper deck.    The weather at the time of the incident was clear skies with northerly winds of approximately force of 2 to 3 on the Beaufort scale.  At the moment of the incident the vessel was performing cargo operations alongside the berth at Port of Adabiya, Egypt.  The vessel had discharging cement and it was berthed port side to the berth. During cargo operations, the crew perform watch every 6 hours. The upper deck accommodates 27 persons and the watch personnel of the 12 to 6 watch just had started their rest period at the moment the fire started. 
The Captain was on his cabin and was alerted of the fire by the Chief Mate that went knocking on different doors to alert the Crew.  Approximately at 0750, the Captain ran to the bridge and sounded the general Alarm immediately which alerted the entire ship.  Other crew members went inside the main deck and other decks knocking at the doors of the different crew in order to alert them of the situation
","Bulk Carrier","Loss of life,Ship rendered unfit to proceed","16837","DNV AS (DNV)","27616","","41","","","1","","","","","","2010-12-23","2012-04-25"
"C0007541","1","SAGA RUBY (IMO 7214715)","SAGA RUBY: SOLAS","GBR","2009-10-10 07:15","Serious"," ","New York","0","0","Contact","Saga Ruby planned to berth port side alongside (bows in) number 88 berth, New York. The berth is constructed at right angles to the flow of the river. On this occasion the vessel was entering on an ebb tide and was planning on drifting down with the tide as she turned to starboard.  A river pilot was embarked and had just handed over to a berthing pilot about 15 minutes before the incident occurred.  The intention was to steam up to the end of the pier, stop, commence the turn to starboard and pivot the stem around the end of the pier using the bow thrust and a tug standing by on the starboard quarter to push up as required.  The pilot and the staff captain were positioned on the starboard bridge wing, distances were being called by the officer stationed on the forecastle.  Initially the focsle officer reported the stem to be swinging clear by about 20m and the rate of turn increased, however the second call advised that the stem would pass clear by about 7m, the message did not prompt the pilot to take any action.  A little while later the pilot ordered dead slow astern on the starboard engine.  The focsle officer then advised that the stem would not swing clear, the pilot took no action and the master then ordered half astern followed by full astern.  The stem made contact with the end of pier causing  damage to the jetty and extensive damage to the vessels stem. Repairs were undertaken in Bayonne, and 3m x 0.5m of 32mm steel plate was required about 2m above the waterline.  All deck officers and the focsle officer were tested for alcohol, and results were zero.","[Primary Annex 1 not designated]","[Primary Annex 1 not designated]","[Primary Annex 1 not designated]","[Primary Annex 1 not designated]","[Primary Annex 1 not designated]","[Primary Annex 1 not designated]","[Primary Annex 1 not designated]","[Primary Annex 1 not designated]","[Primary Annex 1 not designated]","","","","","","","",""
"C0007866","1","OLIVIA JEAN (IMO 7907867)","OLIVIA JEAN: Unknown/unspecified","GBR","2009-10-10 00:00","Serious","503000N 0003000E","17 nm SSE of Beachy Head in the English Channel","1","0","Injury to a crewman","On 10 October 2009, a fisherman was injured by a falling bridle chain on board the fishing ship Olivia Jean when the port side main trawl wire parted as the trawl beam was lifted inboard. The fisherman sustained chest injuries and was airlifted to hospital.","","Serious injuries","242","","","","9","","","[Primary Annex 2 not designated]","[Primary Annex 2 not designated]","[Primary Annex 2 not designated]","[Primary Annex 2 not designated]","[Primary Annex 2 not designated]","[Primary Annex 2 not designated]","2010-09-02",""
"C0007826","1"," CAPRICE 8 (-)"," CAPRICE 8: Unknown/unspecified","","2009-10-09 17:00","Serious"," ","vicinity of Mountaineer Rock off Ryan’s Point on Lough Derg, Co. Tipperary","1","1","Grounding and subsequent sinking","On 9 October 2009, a Caprice class Emerald Star Line charter boat ran aground on rocks in the vicinity of Mountaineer Rock off Ryan’s Point on Lough Derg, Co. Tipperary. The four persons on board were taken off by the Portumna Fire and Rescue RIB and ferried across the lake to Williamstown Harbour. The ship was noted to have been severely holed. The ship was pulled off the rocks and subsequently sank while under tow. There were no fatalities and no pollution associated with this incident.","Yacht","Ship rendered unfit to proceed","","","","","3","","","[Primary Annex 2 not designated]","[Primary Annex 2 not designated]","[Primary Annex 2 not designated]","[Primary Annex 2 not designated]","[Primary Annex 2 not designated]","[Primary Annex 2 not designated]","2010-07-14","2011-03-04"
"C0007625","2","CHANG QING YOU 18 (-), FU YU (IMO 8520551)","CHANG QING YOU 18: Unknown/unspecified, FU YU: Unknown/unspecified","CHN,TUV","2009-10-09 02:15","Very serious","284980N 1220220E","Jiaojiang, China","1","1","Collision","The Fu Yu, a Tuvalu flag general cargo ship, was engaged on a voyage carrying scrap metal from Yokohama, Japan, to Hai Meng, China.

The ship was proceeding to Hai  Meng Port. The Second officer took over at 11:40 lt on 8 October 2009 and the able-seaman on duty was at the helm. The ship was steering to the anchorage with the course southwest-by-south.

The China flag oil tanker Chang Qing You 18 was engaged on a passage from the Port of Bayuquan, China, to Fuzhou, China. In the evening of 9 October 2009, the ship was proceeding southwest bound towards its destination, Fuzhou port. Her course was southwest-by-south.

At about 02:15 Lt the Chang Qing You 18 collided with the Fu Yu portside between engine room and cargo hold. The bow of the Chang Qing You 18 penetrated the portside of the Fu Yu in way of cargo hold and engine room accommodation area. The Chief engineer was injured and died. No oil pollution resulted from the collision.

The Fu Yu sustained heavy damage and fortunately there was no water ingress into the cargo hold and portside water ballast tanks and engine room. The ship's side of port side sustained heavy damage and the frame inside of cargo hold and engine room deformed. The Chang Qing You 18 sustained damages to her forecastle, forepeak tank…

The Chang Qing You 18 was granted authorization to proceed to Daxie Island to discharge cargo of oil then proceed to Zhoushan LianMeng shipyard for repairs. The Fu Yu anchored at JiaoJiang anchorage for permanent repairs. 
","General Cargo","Loss of life","1845","ISClass","2054","","9","","","1","","","","","","2010-02-02","2011-03-04"
"C0007617","1","TWB MARINER I (-)","TWB MARINER I: Unknown/unspecified","BRA","2009-10-06 08:30","Very serious","252940S 0482930W","anchorage area no 6 of the Port of Paranaguá (DHN chart 1822)","1","1","Shipwreck","Shipwreck of the Brazilian Flag Tug TWB MARINER I occurred around 08.30 hours on 06 October 2009, in the anchorage area no 6 of the Port of Paranaguá (DHN chart 1822) in the position Latitude 25o 29.45´S and Longitude 048o 29.35´W, during the supply of bunkers to the merchant vessel ATLANTIC MUSE, by the Barge TWB I. The sinking of the Tugboat TWB Mariner I did not cause any damage amongst its crewmembers nor on other crewmembers of the vessels involved in the task of transfer of fuel being carried out.  The sinking of the tugboat TWB Mariner I produced around one hundred (100) litres approximately of diesel oil spilled, which may be considered a small amount.","","Ship rendered unfit to proceed","30","","17.5","","3","0","0","[Primary Annex 2 not designated]","[Primary Annex 2 not designated]","[Primary Annex 2 not designated]","[Primary Annex 2 not designated]","[Primary Annex 2 not designated]","[Primary Annex 2 not designated]","2010-01-27","2012-04-25"
"C0007514","1","ILUUNA (-)","ILUUNA: Unknown/unspecified","GRL","2009-10-05 17:10","Very serious","630800N 0504000W","Qeqertarsuatsiq, Greenland west coast","0","0","Fire or explosion","A Greenland flagged fishing vessel of 72.67 G.R.T. was re-rigged from trawl into seine fishery and departed from Narsaq for at test voyage.

During passage towards the fishing grounds a fire broke out in the vessel's accommodation, where no persons were staying at that time.
The skipper was in the whell house andt two other persons on board were working on deck preparing fishing gear etc.

The attempted to fight the fire by the use of portable fire extinguishers, but they had to give up, because they were sisplaced by heavy smoke.

The skipper did not manage to send a signal of destress, because he was displaced from the wheel house by smoke.

The fishermen went into the dinghy bringing with tehm warm clothing a can with spare petrol for the outboard motor. They stayed in the vicinity of the burning vessel, until they were rescued by a motor boat that was approac hing after having observed smoke and fire from fishing vessel.

The fishing vessel burned out and sank.","","Total loss of the ship","72","[No class]","","","3","0","0","0","0","0","0","0","0","",""
"C0007661","2","DA VIKEN II (-), P'TIT CELTE (-)","DA VIKEN II: Unknown/unspecified, P'TIT CELTE: Unknown/unspecified","","2009-10-05 08:14","Very serious","484781N 0023779W","Bay of Saint Brieuc","1","0","collision and subsequent sinking","Le lundi 05 octobre 2009 vers 06 :15 heures, les navires de pêche Da Viken II et P’tit Celte quittent le port de Saint-Quay-Portrieux pour rejoindre leur lieu de pêche en Baie de Saint-Brieuc.

Les deux navires sont armés à la coquille Saint-Jacques. L’ouverture de la campagne 2009/2010 débute ce même jour à 08 :00 heures pour ce qui concerne la zone dite du large.

Arrivés sur le lieu de pêche, les deux navires mettent à l’eau leurs dragues, en vue de réaliser un premier trait par 40 mètres de fond. Le Da Viken II  et le P’tit Celte, distant d’une quarantaine de mètres suivent une route parallèle, cap à l’Est, à la vitesse de 6 à 7 nœuds.   Le P’tit Celte à filé 120 mètre de funes. Le Da Viken II, quant à lui, à filé 120 mètres environ à bâbord. La fune bâbord, durant son filage, s’est enroulée en partie autour du volant du treuil avant de se coincer au tambour.

Dans ces conditions, le câble bâbord étant mou, le navire vient sur la droite sous l’effet de la traction s’exerçant sur la seule fune tribord.  La collision avec le P’tit Celte ne peut être évitée, d’autant qu’aucun des équipages ne fait de veille  passerelle et ne dispose à proximité immédiate,  ni des commandes de la propulsion, ni de celles de l’appareil à gouverner.
","Fish Catching Vessel","Total loss of the ship","","","","","2","","","[Primary Annex 2 not designated]","[Primary Annex 2 not designated]","[Primary Annex 2 not designated]","[Primary Annex 2 not designated]","[Primary Annex 2 not designated]","[Primary Annex 2 not designated]","2010-03-15",""
"C0008006","1","SILVER SEA (IMO 8107608)","SILVER SEA: SOLAS","PAN","2009-10-04 13:00","Very serious","231500N 1181100E","OPEN SEA","1","1","Capsizing / listing","On 4th October 2009 the Panamanian Feeder Container Vessel sank in open sea after taking in water into its cargo hold. The sinking occurred in heavy sea and in clear sky conditions in the afternoon at about 16.00 hours. Three survivors were found and rescued. The rest of the remaining 11 crew members were unaccounted for and presumed dead. Over two months later their bodies had still not been found. The Master, a Myanmar National of the ship was one of the three survivors. He was picked up by the Xiamen – Shantou MSA Rescue vessel on the next day (5th October )following  the sinking of his ship. After the rescue, he was housed in the Port of Shantou. The other two crew members (Indonesians, one AB and the other Oiler) were rescued by helicopter from the Coast Guard Administration. 

The vessel sank in position 23º 02.2’ N 118º 08.11E. The cause of the sinking was due to the ingress of sea water into the cargo hold. The ship’s portable pumps failed and could not cope with the ingress of water in the hold. The vessel subsequently listed heavily to port and a freak wave hit her on the starboard side causing her to roll further to port, breaking the deck containers and some fell into the sea, before she subsequently sank. 
The report of the incident is attached
","Container Ship","Loss of life,Total loss of the ship","1375","Panama Bureau of Shipping (PBS)","2432","","14","","","11","","","3","","","2010-12-27","2012-04-25"
"C0007544","1","MAESTRO SUN (IMO 8401133)","MAESTRO SUN: SOLAS","MHL","2009-10-04 04:29","Serious","561700N 0070600E","North Sea","0","0","Machinery damage","On 14th October 2009 in very bad weather the RO/RO cargo vessel MAESTRO SUN experienced technical breakdown of the steering gear while transiting the North Sea  south-bound. Due to the breakdown the vessel lost steering, and drifted towards the Danish coastline. Approximately four nm from the Danish coastline the vessels two anchors took hold. It was decided to evacuate part of the crew, and eight crew members were taken off by helicopter. One day later the weather and sea conditions had improved, and the vessel was taken under tow to a shipyard for repairs.","RORO CARGO","Ship rendered unfit to proceed","15375","Lloyd's Register (LR)","9200","Ballast","25","0","0","0","0","0","0","0","0","",""
"C0007766","3","EEMS TRADER (IMO 9173185), SAGITAIRE (-), SAGITTAIRE (-)","EEMS TRADER: Unknown/unspecified, SAGITAIRE: Unknown/unspecified, SAGITTAIRE: Unknown/unspecified","ATG,FRA","2009-10-03 12:30","Less serious","491800N 0044100W","West of English Channel","1","0","Collision","L e samedi 03 Octobre à 12 :30, le chalutier Sagittaire battant pavillon français, est en pêche dans le 347° du phare de l’île Vierge à 40.6 milles et navigue à vitesse en suivant une route fond  au Nord-Ouest. L’équipage est au repos hormis le patron, qui assure seul le quart à la passerelle depuis 07 :00 heures.
Am même moment, le cargo EEMS Trader, battant pavillon  Antigua et Barbuda, suit une route sur le fond au 239° à vitesse moyenne de 09 nœuds vers le dispositif de séparation de trafic d’Ouessant. Il se trouve au Nord-Est du Sagittaire à 1.8 mille. Il transport une cargaison de 2797 tonnes de rouleaux d’acier (steel coils). Le second capitaine est de quart à la passerelle de puis 12:00 heures, pour une durée de six heures.

A 12 :42 heures, les deux navires entrent en collision, l’étrave du EEMS Trader abordant le Sagittaire au niveau du pont couvert sur l’avant du travers tribord du chalutier. Les deux navires restent sur Zone. Le patron du Sagittaire prévient rapidement le CROSS Corsen de la collision. Les capitaines des deux navires annoncent qu’aucune victime n’est à déplorer et que les dommages subis ne remettent pas en cause la sécurité à bord. Aucune pollution n’est à signaler. Ils reprennent leurs routes respectives vers 13 :20 heures. 

","GENERAL CARGO","Ship remains fit to proceed","2056","Bureau Veritas (BV)","2953","","6","","","","","","","","","2010-05-24",""
"C0007599","1","VILLUM CLAUSEN (IMO 9216250)","VILLUM CLAUSEN: Unknown/unspecified","XDA","2009-10-03 09:50","Serious","550590N 0144160E","Rønne Harbour","2","0","Contact","On 3rd October 2009 the ro-ro ferry VILLUM CLAUSEN was at Rønne harbour.
During manoeuvring to berth the ship, a headfast became attached to a bollard ashore, which was very tight. The master could subsequently not manoeuvre the stern to the quay, and instead hit the quay with the bow at approximately 09.50. This resulted in making a hole in the forward mooring deck to the starboard, a bulge in the corner of the bonnet;  a minor crack in the forepeak, and the starboard bulb was broken off. No passengers or crew members were injured at the time, alhtough a seaman was subsequently absent owing to illness.

The wind came from a SSE direction with a speed of 15 m / s and was increasing. It was planned that VILLUM CLAUSEN was to be laid up at berth 10 the rest of the day, due to voyage restrictions and that POVL ANKER was to replace the crossing.
","[Primary Annex 1 not designated]","[Primary Annex 1 not designated]","[Primary Annex 1 not designated]","[Primary Annex 1 not designated]","[Primary Annex 1 not designated]","[Primary Annex 1 not designated]","[Primary Annex 1 not designated]","[Primary Annex 1 not designated]","[Primary Annex 1 not designated]","0","0","0","0","0","0","2010-01-18",""
"C0007800","1","ARCTIC SKY (IMO 9111242)","ARCTIC SKY: SOLAS","LBR","2009-10-02 03:26","Serious","601633N 0185468E","Sondra Kvarken, Gulf of Bothnia, Baltic Sea","0","0","Stranding / grounding","On October 2, 2009 at approximately 0326 hrs (LT), the vessel touched ground. Upon impact, the Master came to the bridge, ordered the vessel Dead Slow Ahead and a change of course to deeper, safer waters to drop anchor. Following the incident, the Second Officer, who was supposed to be on watch, was found in his cabin asleep on the sofa, smelling of alcohol.","GENERAL CARGO","","7249","","7239","","","","","","","","","","","",""
"C0007659","1","PETRA FRONTIER (IMO 9509190)","PETRA FRONTIER: Unknown/unspecified","MHL","2009-09-28 05:30","Less serious","114600S 1290600E","At sea, off Darwin, NT","1","0","Fire or explosion","The ship suffered a fire in its steering flat while enroute to Darwin. The ship was disabled as a result.","TUG/SUPPLY SHIP (O.R.S.V.)","Ship remains fit to proceed","1706","American Bureau of Shipping (ABS)","1753","Nil","11","","","","","","","","","2011-01-10",""
