Reference,NumberOfShipsInvolved,ShipsInvolved,SOLASStatus,FlagStates,IncidentDateTime,TypeOfCasualty,Coordinates,Location,NumberOfInvestigationReports,NumberOfAnalyses,InitialEvent,SummaryOfEvents,ShipType1,Consequences1,GrossTonnage1,ClassificationSociety1,Deadweight1,Cargo1,CrewOnboard1,PassengersOnboard1,OthersOnboard1,DeadMissingCrew2,DeadMissingPassengers2,DeadMissingOthers3,SeriouslyInjuredCrew2,SeriouslyInjuredPassengers2,SeriouslyInjuredOthers2,InvestationReportDate,AnalysisDate
"C0012787","1","FAY (IMO 9827619)","FAY: Unknown/unspecified","NOR","2019-12-28 13:00","Very serious","712523N 0262114E","Nordkapp","0","0","Machinery damage","The ship sustained generator failure, subsequently took water, developed listing to portside and sank in the Barents Sea, 21 miles NE of Nordkapp, Troms Og Finnmark, Norway on LAT. 71 25' 23""N, LONG. 026 21' 14""E on 28 December 2019 PM in heavy weather.
All 12 crew abandoned the ship to 2 life rafts. JRCC Northern Norway despatched a Norwegian Air Force Sea King helicopter to the scene and airlifted the crew to Honningsvag, Norway for medical checks. There were no injuries reported and an investigation was effected.
","Fishing Vessel","Total loss of the ship","439","","","","12","","","[Primary Annex 2 not designated]","[Primary Annex 2 not designated]","[Primary Annex 2 not designated]","[Primary Annex 2 not designated]","[Primary Annex 2 not designated]","[Primary Annex 2 not designated]","",""
"C0012601","1","NODUS (IMO 9497464)","NODUS: SOLAS","LBR","2019-12-27 14:20","Very serious","411450N 0290070E","Turleli Anchorage, Turkey","1","0","Accidents with life-saving appliances","On December 27, 2019 about 1420 LT, Position Lat 41-14.5N Long 029-00.7 E, while the vessel anchored at Turkeli anchorage, Turkey, the vessel superintendent who was trying to board the vessel from service boat via Pilot ladder had slipped and fallen overboard into the water at 1425 LT. The crew and the service boat had thrown the lifebuoy to the man in the water and the person in the water had got hold on to one lifebuoy for a while, then later released, no longer swimming and submerged into the water.
The vessel and service boat crews failed to recover him. The coast guard was informed and recovered the person in the water at 1515 LT and taken him to the hospital. The vessel superintendent was declared dead at 1715 LT.      
","General Cargo Ship","Loss of life","22064","Korea Classification Society (KCS)","33422","","20","","","[Primary Annex 2 not designated]","[Primary Annex 2 not designated]","[Primary Annex 2 not designated]","[Primary Annex 2 not designated]","[Primary Annex 2 not designated]","[Primary Annex 2 not designated]","2021-07-09",""
"C0012568","1","EVANGELIA (IMO 9221798)","EVANGELIA: SOLAS","LBR","2019-12-24 16:34","Very serious","012810N 1191580E","At Sea","1","0","Fire or explosion","On December 24, 2019, about 1634 LT, Position Lat 01-28.1 N Long 119-15.8 E, during the vessel passage from Bunati, Indonesia to Xiamen, China the 2nd.Engineer (2/E) and the Able Seafarer (AB) who were burnt due to an explosion of paint thinner drums and suffered 2nd. degree and 1st. degree burns. Master provided first aid and vessel diverted to Puerto Prinsesa, Palawan, Philippines. On December 25,2019 at 0102 LT , the AB died from his burn injuries. Injured 2/E disembarked on December 26,2019 at 1430 LT at Puerto Prinsesa, Palawan, Philippines.","Bulk Carrier","Loss of life,Serious injuries","38878","DNV GL AS (DNVGL)","74381","","","","","[Primary Annex 2 not designated]","[Primary Annex 2 not designated]","[Primary Annex 2 not designated]","[Primary Annex 2 not designated]","[Primary Annex 2 not designated]","[Primary Annex 2 not designated]","2021-06-25",""
"C0012850","1","ANDIAMO (IMO 9446233)","ANDIAMO: Unknown/unspecified","MHL","2019-12-18 19:30","Unspecified","254707N 0801047W","Watson Island, Miami, Florida, United States","0","0","Fire or explosion","The ship caught fire whilst moored at the Island Gardens Marina at Watson Island, Miami, Florida, United State on LAT. 25 47'07""N, LONG. 080 10'47""W at 1930 hours local time (UTC-5) on 18 December 2019. 

All of the crew was evacuated ashore. There was no injuries reported. The blaze was brought under control by local fire service using fire fighting boats 2 hours later but the ship sustained severe damage, capsized on to her starboard side and sank at the berth. Anti pollution barriers was deployed and clean up operation was effected. The wreck was righted and removed with assistance from a floating crane in early January 2020.","Yacht","Pollution,Total loss of the ship","299","American Bureau of Shipping (ABS)","66","","","","","[Primary Annex 2 not designated]","[Primary Annex 2 not designated]","[Primary Annex 2 not designated]","[Primary Annex 2 not designated]","[Primary Annex 2 not designated]","[Primary Annex 2 not designated]","",""
"C0012927","1","EMMALIE (-)","EMMALIE: Unknown/unspecified","DNK","2019-12-12 00:00","Very serious","573220N 0083830E","Open sea","2","0","Fire or explosion","A fire developed in the wheelhouse while the skipper was tending to a problem in the machine room. When he came out of the machine room, the wheel house was engulfed in flames. The crew mustered on the deck, prepared a life raft and donned their emergency suits, but were unable to call mayday as the radio was located in the wheelhouse. They decided to stay for as long as possible on board. Another fishing vessel spottet the burning ship and called for help. The crew was evacuated from the ship by helicopter. When the fire eventually was extinguished, the ship was towed to port.","Fish Catching Vessel","Ship rendered unfit to proceed","234","","","","3","0","","0","0","0","0","0","0","2020-05-19",""
"C0012816","1","SHINPO 16 (IMO 8114467)","SHINPO 16: Unknown/unspecified","IDN","2019-12-10 17:40","Very serious","082200S 1232400E","Jetty Atlewoleba, Lembata, Indonesia","0","0","Collision","The ship was in collision with the manoeuvring MV 'MAJU 8' whilst berth alongside the Jetty Atlewoleba, Lembata, Indonesia at 1740 hours local time (UTC+8) on 10 December 2019 in good weather.

The ship sustained severe damage to the starboard forward below the waterline and took water. All crew evacuated ashore prior to the ship capsizing on to her starboard side and sinking alonside the jetty. There were no injuries reported. Surveys were conducted prior to wreck removal.","General Cargo Ship","Total loss of the ship","1137","Biro Klasifikasi Indonesia","1100","","","","","[Primary Annex 2 not designated]","[Primary Annex 2 not designated]","[Primary Annex 2 not designated]","[Primary Annex 2 not designated]","[Primary Annex 2 not designated]","[Primary Annex 2 not designated]","",""
"C0012773","1","SVANEN (-)","SVANEN: Unknown/unspecified","DNK","2019-12-10 00:00","Serious","560941N 0101288E","Port","2","0","Damages to ship or equipment","Copy from Google translate... THE SWAN (Figure 1) was a passenger vessel that usually sailed with passengers on the Mariager Inlet. In December 2019, the ship was chartered for a port in December for a period in December with passengers in the Port of Aarhus. The ship's crew consisted of the ship's master, a boatman and a cafe employee. On the evening of December 10, 2019, the ship sailed one harbor cruise with 47 passengers on board. Wind was blowing from the south, the air temperature was 4-5 C and the water temperature was 7-8 C. Kl. At 18.25 the Swan arrived at his berth at Hack Kampmanns Plads in the Port of Aarhus, where passengers were to disembark. While passengers were leaving, suddenly there was a gust of wind which caused the ship to drift so far over that the gangway slid off the ship and into the water. Three passengers, who were on the gangway, fell into the water. The crew launched the ship's readiness for overburden and phoned 112. Name: SWAN Ship type: Passenger ship Nationality / flag: Denmark Home Port: Hobro Cold signal: OXQT Year Built: 1994 Shipyard / no .: Hvide Sande Skibs- og B Boatbuilding A / S Class Company: Unclassified Length overall: 19.90 m Width everywhere: 5.01 m Draft: 1.70 m Gross tonnage: 60.6 Machinery: 125 kW Hull material: Steel The quay was 1.7 m high and therefore the overboard passengers could not get up by their own power. People on the quay threw lifeguards with a attached line down to them overboard passengers. Two of the fallen men grabbed the lifeline and stayed pulled over to a rescue ladder that was in front of the ship (Figure 2). After approx. 5 minutes in the water, two of the people in need came up to the rescue ladder with the help of people on the quay. Meanwhile, the ship's cafe employee grabbed the third overboard and tried to pull her up onto the ship. It soon became clear that this was not possible. Therefore, the ship became hoist boom rigged and a rescue harness lowered. The distressed man managed to put on the rescue harness, but she slipped out of the harness as the ship's driver tried to lift her out of the water with the hoist boom. The distressed person was quickly rebuffed in the cold water and had difficulty staying up. The cafe employee therefore jumped into the water and the distressed man reached over to the rescue ladder. The distressed person was then rebuked that it was not possible for her to get up the ladder with her own help. The boatman, who was on shore when the gangway bridge fell into the water, therefore crawled down the ladder in the water and helped the distressed person in collaboration with the cafe employee. The distressed at that time person had been in the water for approx. 10 minutes. The land-based emergency, which was requested via 112, arrived at the ship after the distressed had been rescued.","Passenger Ship","Ship remains fit to proceed","60.6","","","","3","47","","0","0","0","0","0","0","2020-03-25",""
"C0013064","1","Conception  (-)","Conception : Unknown/unspecified","USA","2019-12-02 03:00","Very serious","340200N 1194400W","Coast of Santa Cruz Island, California, United States","0","0","Fire and Sinking","MV Conception,  while moored near Santa Cruz Island, California, United States had a fire broke out in the early hour of the morning on 02 December 2019. At the time, it had been hosting a diving expedition over the Labour Day holiday weekend.

The fire began in a middle deck area where lithium-ion batteries were being charged. At the time of the fire, of the 39 people on board, 33 passengers and a crew member were sleeping below deck and lost their lives. five crew member survived by jumping overboard. ","Passenger Ship","Loss of life,Total loss of the ship","","","","","","","","[Primary Annex 2 not designated]","[Primary Annex 2 not designated]","[Primary Annex 2 not designated]","[Primary Annex 2 not designated]","[Primary Annex 2 not designated]","[Primary Annex 2 not designated]","",""
"C0012946","1","NORDANA SOPHIE (IMO 9205562)","NORDANA SOPHIE: SOLAS","THA","2019-11-28 20:43","Serious","180797N 1062940E","Ha Tinh seaport waters, Vietnam, in anchorage area of Son Duong port, 1.83 NM from Son Duong island,","1","0","Stranding / grounding","On 28/11/2019 at 19.45 UTC, the ship was dragging anchor near Hon Chim island, Vietnam, therefore, Captain decided to heave up anchor and shifting to another location to ensure safety. Unfortunately, the weather conditions deteriorate combined with strong currents leading to ship collide the underwater rocks which surrounding the island. At 20.43 UTC, Vessel ran aground and listed. Ha Tinh seaport provided tugboats to transfer 13 crewmembers safely. Five crews remained on board to maintain the ship. At 01.50 UTC ship becomes more listed due to seawater flooding, so, crew contact Ha Tinh port authorites for rescued and abandoned ship. At 06.15 UTC, NORDANA SOPHIE completely sunk at position 18 07'58"" N 106 26'40"" E in the waters of Ha Tinh seaport. All crew were safe. No goods on board. Environmental damage not determined.","General Cargo Ship","Total loss of the ship","7659","Nippon Kaiji Kyokai (NKK)","8976","-","18","","","[Primary Annex 2 not designated]","[Primary Annex 2 not designated]","[Primary Annex 2 not designated]","[Primary Annex 2 not designated]","[Primary Annex 2 not designated]","[Primary Annex 2 not designated]","2020-09-25",""
"C0012811","1","LUMMETJE (IMO 8432613)","LUMMETJE: Unknown/unspecified","NLD","2019-11-28 05:45","Very serious","525959N 0043612E","North Sea 7 miles NW of Den Helder, Netherland","0","0","Capsizing / listing","The ship sank in the North Sea, 7 miles NW of Den Helder, Netherlands at LAT. 52 59'59""N, LONG. 004 36'12""E at 0545 hours local time (UTC+1) ON 28 November 2019 in heavy weather.

The Coast Gaurd received an EPIRB signal, hence initiated SAR operation using Netherlands Navy mine hunter 'MAKKUM', nearby fishing vessels, helicopters, KNRM lifeboats and other vessels. There were empty life raft, life jacket and other debris found at the scene, but no trace of the 2 crew from the vessel. 2 Crew from the KNRM lifeboat sustained injuries during the operation. The bodies of the missing crew from the sunken vessel was later recovered. ","Fishing Vessel","Loss of life,Total loss of the ship","48","","","","2","","","[Primary Annex 2 not designated]","[Primary Annex 2 not designated]","[Primary Annex 2 not designated]","[Primary Annex 2 not designated]","[Primary Annex 2 not designated]","[Primary Annex 2 not designated]","",""
"C0012815","1","ILHAN YILMAZ 5 (IMO 9892638)","ILHAN YILMAZ 5: Unknown/unspecified","TUR","2019-11-27 13:00","Very serious","204000N 0165900W","Nouadhibou, Mauritania","0","0","Capsizing / listing","The ship sank within Mauritanian territorial waters in the North Atlantic Ocean off Nouadhibou, Mauritania early PM on 27 November 2019 in good weather. 

The ship was proceeding to Nouadhibou to discharge of her catch at the time of the incident. All crew were rescued by local Coast Guard. No injuries were reported.","Fishing Vessel","Total loss of the ship","397","","","","","","","[Primary Annex 2 not designated]","[Primary Annex 2 not designated]","[Primary Annex 2 not designated]","[Primary Annex 2 not designated]","[Primary Annex 2 not designated]","[Primary Annex 2 not designated]","",""
"C0012572","1","QUEEN HIND (IMO 7920675)","QUEEN HIND: SOLAS","PLW","2019-11-24 11:29","Very serious","441900N 0284000E","Midia, Constanta, Romania","2","1","Capsizing / listing","At 11:34 , the vessel M/V QUEEN HIND, capsized on the edge of fairway channel of Port of Midia, Constanta, Romania.  The vessel was outbound Port of Mida, with pilot on board, loaded with 14600 sheeps.  The vessel maneuver commenced with two tugs as per Master request, secured fore and aft at 1030 hrs.  While pulled by tugs the vessel developed a heeling of abt 3 - 4 degrees to port side.  After the tugs let go of the vessel, the vessel commenced to heel again, even after the vessel's heeling, the Master and Pilot continued to go forward, at a speed of 4 to 4.2 knots. The vessel continued to heel, after reaching about 50 - 60 degrees to starboard the Master called for vessel's abandonment.
All crew has been rescued.","Livestock Carrier","Total loss of the ship","3785","","2113","Livestock","12","","","[Primary Annex 2 not designated]","[Primary Annex 2 not designated]","[Primary Annex 2 not designated]","[Primary Annex 2 not designated]","[Primary Annex 2 not designated]","[Primary Annex 2 not designated]","2020-10-20","2021-04-12"
"C0012809","1","MITRA SEJAHTERA IX (IMO 3561720)","MITRA SEJAHTERA IX: Unknown/unspecified","IDN","2019-11-23 07:00","Very serious","055650S 1183400E","Java Sea","0","0","Capsizing / listing","The ship took water, developed listing and sank in the Java Sea, 80 miles SW of Makassar, Sulawesi Selatan, Indonesia at LAT. 05 56'50""S, LONG. 118 34'00""E at 0700 hours local time (UTC+8) ON 23 November 2019. 

Nearby MVs 'SINAR HARAPAN 78', 'MENTARI NUSANTARA' and 'MUTIARA INDAH' the proceeded to assist. All 15 crew were rescued and taken to Makassar, Indonesia. No injuries were reported. A number of deck containers fell into the sea when the ship sank. A local shipping warning was issued. ","General Cargo Ship","Total loss of the ship","717","Biro Klasifikasi Indonesia","","","15","","","[Primary Annex 2 not designated]","[Primary Annex 2 not designated]","[Primary Annex 2 not designated]","[Primary Annex 2 not designated]","[Primary Annex 2 not designated]","[Primary Annex 2 not designated]","",""
"C0012814","1","BLUE STAR (IMO 9527764)","BLUE STAR: Unknown/unspecified","MLT","2019-11-22 22:00","Serious","432527N 0081540W","Punta Miranda, Ares, Spain","0","0","Fire or explosion","The ship caught fire in the engine room, and was diabled and stranded on the rocky coastline of Ria de Betanzo, Punta Miranda, Are, Spain at LAT. 43 25'27""N, LONG. 008 15'40"" late evening on 22 November 2019 in heavy weather.

The blaze was extinguished by crew. A Salvament Maritimo H-225 helicopter attended the scene. Initial refloating attempts by tugs were unsuccessful. The removal of bunker fuel was effected. A 5 square metre oil slick was observed in the sea, and anti pollution measures were effected. The ship was refloated at 0230 hours  local time on 10 December 2019 with the assistance from the tug 'BOKA PEGASUS' and was towed to Ferrol, Spain for temporary repairs. The ship sustained damage to the hull and propeller, and was subsequently sold for recycling in Turkey. ","Chemical/Products Tanker","Pollution","7386","RINA Services S.p.A (RINA)","9438","","","","","[Primary Annex 2 not designated]","[Primary Annex 2 not designated]","[Primary Annex 2 not designated]","[Primary Annex 2 not designated]","[Primary Annex 2 not designated]","[Primary Annex 2 not designated]","",""
"C0012813","1","ORE SUDBURY (IMO 9000986)","ORE SUDBURY: Unknown/unspecified","LBR","2019-11-22 05:00","Serious","231047S 0435942W","Rio de Janeiro, Brazil","0","0","Fire or explosion","The ship caught fire on no. 3 deck in crew accommodation whilst moored in the South Atlantic Ocean 12 miles SE of Guaiba Island Terminal, Rio de Janeiro, Brazil at LAT. 23 10'47""S, LONG. 043 59'42 W early morning on 22 November 2019.

The blaze was extinguished by the crew, but the master died during the fire. The ship sustained serious damage and was subsequently sold for recycling. The ship departed the anchorage on 11 January 2020 in tow of tug 'FAIRMOUNT GLACIER' bound Chattogram, Bangladesh.","Ore Carrier","Loss of life","154552","DNV GL AS (DNVGL)","285771","","","","","[Primary Annex 2 not designated]","[Primary Annex 2 not designated]","[Primary Annex 2 not designated]","[Primary Annex 2 not designated]","[Primary Annex 2 not designated]","[Primary Annex 2 not designated]","",""
"C0013059","1","ALMA (IMO 9231676)","ALMA: Unknown/unspecified","MLT","2019-11-22 00:00","Very serious","473810N 0085179W","Open sea","1","0","","On 22 November 2019, Alma was experiencing heavy weather conditions, while in the Atlantic Ocean on a voyage from Rouen, France, to Cuba. In the evening of the same day, while the bosun was on deck A of the accommodation, he heard something falling, coming from the vicinity of the accommodation stairway. On looking down the stairway, the bosun found the electrical engineer lying on his back near the bottom of the stairway on the poop deck. The electrical engineer seemed unconscious, The bridge and the master were eventually informed. The vessel was diverted back towards Brest, France. In the early hours of the next day, the condition of the electrical engineer deteriorated and efforts to resuscitate him were unsuccessful. The safety investigation did not exclude the possibility that the crew member either lost his stepping or balance due the rolling and pitching motions of the vessel.","Bulk Dry (general, ore) Carrier","Loss of life,Ship remains fit to proceed","17697","American Bureau of Shipping (ABS)","","Dry bulk","19","0","0","1","0","0","0","0","0","2020-11-24",""
"C0012780","1","GENTING DREAM (IMO 9733105)","GENTING DREAM: Unknown/unspecified","BHS","2019-11-18 17:35","Serious"," ","Langkawi, Malaysia","1","0","Passenger Drowning","Passenger entered a deep section of the pool and started to struggle, after a few minutes a crew member pulled him out of the water and commenced CPR. passenger was pronounced deceased an hour later by the vessels doctor. ","Passenger/Cruise","Loss of life","150695","","15370","","1844","3725","","[Primary Annex 2 not designated]","[Primary Annex 2 not designated]","[Primary Annex 2 not designated]","[Primary Annex 2 not designated]","[Primary Annex 2 not designated]","[Primary Annex 2 not designated]","2020-05-27",""
"C0012518","1","ORANGE PHOENIX (IMO 9700835)","ORANGE PHOENIX: SOLAS","PAN","2019-11-16 11:20","Very serious"," ","Around 3km off to the west-northwest of the Wakayama-honko Offshore South Breakwater Lighthouse, Jap","1","0","Fatal accident falling on the deck during operation around a lifeboat set up 5 meters high of deck.","A Third Navigation Officer who was operating around a lifeboat set up 5 meters high of deck died from falling on the deck when the ship was anchored off to Wakayama Port on 16 November, 2019.","Bulk Carrier","Loss of life","107229","Nippon Kaiji Kyokai (NKK)","207529","","21","","","[Primary Annex 2 not designated]","[Primary Annex 2 not designated]","[Primary Annex 2 not designated]","[Primary Annex 2 not designated]","[Primary Annex 2 not designated]","[Primary Annex 2 not designated]","2021-06-24",""
"C0012810","1","CHERAMIE BO-TRUC No. 22 (IMO 7621865)","CHERAMIE BO-TRUC No. 22: Unknown/unspecified, MARIYA MORAN: Unknown/unspecified","USA","2019-11-14 04:18","Very serious","294100N 0935006W","Sabine River","0","0","Collision","The ship was in collision with tug 'MARIYA MORAN' at the mouth of the Sabine River off Texas Point, 3 miles SE of Sabine, Texas, United States at LAT. 29 41'00""N, LONG. 093 50'06""W at 0418 hours local time (UTC+6) ON 14 November 2019. The ship sustained damage to a bunker fuel tank, and approximately 13,600 litres of fuel oil leaked into the river. The Coast Guard and Environmental Safety and Health Personnel attended the scene and oil boom was deployed. No injuries were reported. The ship was subsequently returned to Baine, Texas for inspection and repairs. ","Platform Supply Ship","Pollution","195","","500","","","","","[Primary Annex 2 not designated]","[Primary Annex 2 not designated]","[Primary Annex 2 not designated]","[Primary Annex 2 not designated]","[Primary Annex 2 not designated]","[Primary Annex 2 not designated]","",""
"C0012808","1","DIVINA DEL MAR (IMO 2828303)","DIVINA DEL MAR: Unknown/unspecified","ESP","2019-11-12 04:20","Very serious","424207N 0090146W","Punta da Focha","0","0","Machinery damage","The fishing vessel sustained mechanical failure and stranded on a reef at Punta da Focha, Porto do Son, Spain at LAT. 42 42'07""N, LONG. 009 01'46""W at 0420 hours local time (UTC+1) on 12 November 2019 in heavy weather. 

All 9 crew of the fishing vessel jumped overboard. One crew died after being dashed on the rocks, 3 swam to shore and 5 were rescued by nearby fishermen. 6 of the surviving crew were later transferred to a hospital in Portosin, Spain for medical attention. Salvamento Maritimo despatched rescue vessels and a H-225 helicopter to attend the scene. The body of the deceased crew member was later recovered from the scene. ","Fishing Vessel","Loss of life","87","[No class]","","","9","","","[Primary Annex 2 not designated]","[Primary Annex 2 not designated]","[Primary Annex 2 not designated]","[Primary Annex 2 not designated]","[Primary Annex 2 not designated]","[Primary Annex 2 not designated]","",""
"C0012560","1","BIN HIYEE-2 (IMO 8956841)","BIN HIYEE-2: Non-SOLAS","ARE","2019-11-10 09:55","Less serious"," ","Abu Dhabi","0","0","Stranding / grounding","@09:55 on 10th.of November and Due to bad weather robs of the vessel was damaged , while the ship was under maintenance .
Vessel lost control and she bumped into floating bridge in saddiat island - Abu Dhabi and the main bridge which connects the island and abu dhabi.
manor loses and damages occurred to the floating bridge.","Landing Craft","Ship remains fit to proceed","393","Bureau Veritas (BV)","463","landing craft","2","","","[Primary Annex 2 not designated]","[Primary Annex 2 not designated]","[Primary Annex 2 not designated]","[Primary Annex 2 not designated]","[Primary Annex 2 not designated]","[Primary Annex 2 not designated]","",""
"C0012817","1","PLAIA DE ESTEIRO (IMO 8734774)","PLAIA DE ESTEIRO: Unknown/unspecified","ESP","2019-11-09 05:00","Serious","422418N 0084107W","Puerto de Marin, Spain","0","0","Fire or explosion","The ship caugh fire whilst undergoing repairs at the Astilleros Placeres SL Shipyard in Puerto de Marin, Spain at LAT. 42 24'18""N, LONG. 008 41'07""W early mroning on 9 November 2019.

The local fire rescue team and tug 'SAR Gavia' attended the scene and extinguished the blaze by 1220 hours local time (UTC+1) later on the same day. Oil booms were laid as a precautionary meausre. There were no injuries reported. The ship was completely burnt out and an investigation was effected.","Fishing Vessel","Total loss of the ship","217","","","","","","","[Primary Annex 2 not designated]","[Primary Annex 2 not designated]","[Primary Annex 2 not designated]","[Primary Annex 2 not designated]","[Primary Annex 2 not designated]","[Primary Annex 2 not designated]","",""
