Reference,NumberOfShipsInvolved,ShipsInvolved,SOLASStatus,FlagStates,IncidentDateTime,TypeOfCasualty,Coordinates,Location,NumberOfInvestigationReports,NumberOfAnalyses,InitialEvent,SummaryOfEvents,ShipType1,Consequences1,GrossTonnage1,ClassificationSociety1,Deadweight1,Cargo1,CrewOnboard1,PassengersOnboard1,OthersOnboard1,DeadMissingCrew2,DeadMissingPassengers2,DeadMissingOthers3,SeriouslyInjuredCrew2,SeriouslyInjuredPassengers2,SeriouslyInjuredOthers2,InvestationReportDate,AnalysisDate
"C0012275","1","HELSINKI BRIDGE (IMO 9588081)","HELSINKI BRIDGE: SOLAS","PAN","2019-02-24 00:30","Serious","240300N 0701840W","OPEN SEA","1","0","Containers collapsed and washed overboard in bad weather.","At around 0030 hrs on 26th the second officer observed that the containers in bay 78 had collapsed and he informed the Master who was on the Navigation Bridge. At this moment, due to darkness it could not be ascertained if any containers had gone overboard. The engine room was informed, the chief engineer along with the 2nd engineer made rounds of steering room, engine room, checked shipside in way of the engine room, sounded all tanks, found all in order along with all parameters. As a precaution crew were advised not to go on deck and charterers, managers, agents were informed of the situation.

At the time of the incident she was in the North Atlantic Ocean, in position Lat 38º 24.3’N  Long 070º 18.4’W, heading a true Course of 215º(T), engines on Full Ahead but reduced RPM, on Heavy Oil (ULSFO),  making good a speed of about 11 knots. Bay 78, which collapsed, had a total of 126 empties, all 40’, weighing 462.1 MT. 
Weather conditions at the time of the incident were overcast sky, barometer pressure 1021.5 mb, temperature 8º C i.e. 46º F, visibility of about 5 miles, very rough seas and high swell, Gale winds with force 8 on the Beaufort scale i.e about 40 Knots, from WNW direction, vessel was rolling, pitching, pounding and yawing heavily.

In the morning at around 1000hrs, when the weather had considerably improved, the Master along with Chief Engineer and Chief Officer approached bay 78 to ascertain the situation. No major damage was observed, the crew were advised to refrain from bay 78  to prevent any incident. Crew checked and tightened the lashings from forward till bay 74 and the vessel proceed to Wilmington where she arrived at and ended her sea passage at 1400hrs, dropped anchor at 1648hrs on 27th February’19.
","Container Ship (Fully Cellular)","Ship remains fit to proceed","96801","Nippon Kaiji Kyokai (NKK)","96980","","25","3","","[Primary Annex 2 not designated]","[Primary Annex 2 not designated]","[Primary Annex 2 not designated]","[Primary Annex 2 not designated]","[Primary Annex 2 not designated]","[Primary Annex 2 not designated]","2019-09-24",""
"C0012576","2","RABA (IMO 8415172), WORLD BORA (IMO 9684304)","RABA: Unknown/unspecified, WORLD BORA: Unknown/unspecified","CYP,DNK","2019-02-19 00:00","Serious","543334N 0134200E","Open sea","1","0","Collision","World Marine Offshore, has called and informed about collision at. 07.41 between the company's high speed craft WORLD BORA (MO: 9684304, Call Sign: OWJW2, DIS, Gross Tonnage: 352, Deadweight: 95 t, Year Built: 2014) and coaster in the southern Baltic Sea at Sassnitz. WORLD BORA hit the coaster hard with a speed of 17 knots, but has no hole in the hull. Don't know about damage to the coaster. Several injuries on board (leg fractures, etc.) on WORLD BORA. There were 4 crew members and an unknown number of pax on board (max. 24). WORLD BORA has even sailed into the port of Mukran in Germany. The company's technicians go to the ship to assist (6h drive). Both Vessel could under own power sail to Sassnitz in Germany for inspection. The Crew and the technicians was brought to the local hospitals for treatment.","Other Activities Ships","Ship rendered unfit to proceed","352","[Other]","95","","4","0","","0","0","0","0","0","0","2020-01-24",""
"C0012461","1","BREIZH NEVEZ 1 (IMO 9835252)","BREIZH NEVEZ 1: Unknown/unspecified","FRA","2019-02-19 00:00","Serious","474263N 0032216W","Canal","2","0","Stranding / grounding","On the morning of 19 February 2019 the BREIZH NEVEZ 1 departed Groix for Lorient for the first crossing of the day. A thick fog invades the channel and the bay of Lorient and makes visibility null when approaching the ship in the passage of the Citadel. The BREIZH NEVEZ 1 is shifted to starboard by a strong current and navigates to the right of the channel access to the harbor of Port Louis. In the seconds that follow, the ship comes to the walls of the Citadel of Port Louis. To disengage, the wheel is set to the left but the ship is taken back by the current and ground on the Jument. The ship flooded, he drop anchor in a safer area to tranship its passengers on another ship. The passengers are evacuated and the ship is brought to a dock, assisted by a tug and a pilot.","Passenger / Ro-Ro Cargo Ship","Ship rendered unfit to proceed","1104","","156","","","0","","0","0","0","0","0","0","2019-10-30",""
"C0012883","1","ANKOVELD (IMO 8334897)","ANKOVELD: Unknown/unspecified","ZAF","2019-02-16 06:10","Very serious","323120S 0172500E","South Atlantic Ocean, 32 miles NW of Cape St. Martin, Saldanha Bay, South Africa","0","0","Foundering","The ship took water in engine room capsized and sank in the South Atlantic Ocean, 32 miles NW of Capt St. Martin, Saldanha Bay, South Africa in LAT. 32 31'20""S, LONG. 017 25'0""E at 0610 hours local time (UTC+2) on 16 February 2019.

All 10 crew abandaoned ship to liferafts and were rescued by nearby FV 'ATLANTIC LEADER' and taken to Laingville, South Africa. There was no injuries reported. ","Fishing Vessel","Total loss of the ship","124","[No class]","","","10","","","[Primary Annex 2 not designated]","[Primary Annex 2 not designated]","[Primary Annex 2 not designated]","[Primary Annex 2 not designated]","[Primary Annex 2 not designated]","[Primary Annex 2 not designated]","",""
"C0013014","2","HIJAU SAMUDRA (IMO 9101560), IBERIAN EXPRESS (IMO 9405100)","HIJAU SAMUDRA: Unknown/unspecified, IBERIAN EXPRESS: Unknown/unspecified","GIB,IDN","2019-02-16 00:00","Serious","035057N 0984437E","Coastal waters (within 12 miles)","1","0","Collision","On 16 February 2019 at 0321.LT m.v. ""IBERIAN EXPRESS"" was outbound from BELAWAN, INDONESIA under pilotage and following an agreement to pass port to port the other vessel m.v. HIJAU SAMUDRA (in-bound) came into contact with Iberian Express thereby causing damage to our vessel from port side bay 34 to stern, poop deck of our vessel. Vessel has dropped anchor at sea and carried out damage assessment of contact then informed local agent at Belawan.","Container Ship","Ship remains fit to proceed","9957","","13760","","","0","","0","0","0","0","0","0","2020-09-21",""
"C0011137","1","LETOILE (-)","LETOILE: Non-SOLAS","FRA","2019-02-14 19:15","Less serious"," ","70 miles from West Farasan Island- Red Sea","0","0","Medical emergency for a crew member","On the 14/02/2019 at 1915 local time it was reported to the MRCC of Jeddah in Saudi arabia by the French GRLS NEZMRCC that the Yacht named LETOILE sent a distress signal to rescue a crew member who has an emergency medical issue. The crew member was evacuated by a Saudi Royal Navy Helicopter to the Prince Mohammed bin Nasser Hospital. He was taken care of by a medical team and his health condition was cured. The yacht was assisted to berth in Jazan Port on 16/02/2019 at 0813. ","","","","","","","","","","[Primary Annex 2 not designated]","[Primary Annex 2 not designated]","[Primary Annex 2 not designated]","[Primary Annex 2 not designated]","[Primary Annex 2 not designated]","[Primary Annex 2 not designated]","",""
"C0012934","1","JS NANTONG (IMO 9463009)","JS NANTONG: SOLAS","KOR","2019-02-14 16:15","Very serious","321100N 1185400E","Qingjian terminal ","1","0","Fire or explosion","1.1 At 15:00 on February 8, 2019, the JS Nantong departed the Port of Daesan, South Korea, with a crew of 16 members, including the captain, carrying asphalt (4,082 tons) and headed for the Port of Nanjing, China.   
1.2 At 18:45 on February 13, 2019, (local time from here forward, unless otherwise specified), the ship berthed at a pier of the Qingjian Terminal in the Port of Nanjing. From 21:30 that evening until the breakout of the fire, the crew worked on unloading asphalt. 
1.3 At 16:15 on February 14, 2019, the captain heard the fire alarm sounding onboard. He hurriedly climbed to the bridge and witnessed black smoke rising from the funnel. 
1.4 The captain immediately informed the crew of the fire and commanded them to assemble into a fire emergency team. 
1.5 The chief engineer, who had been repairing, with the third engineer, the expansion tank in the thermal oil heating system near the engine zone on the upper deck, also witnessed black smoke billowing out from under the engine room. 
1.6 The chief engineer pushed the remote emergency stop button to stop the engine room ventilator, various fuel oil pumps, and the thermal oil heating system from operating. He also turned off the various valves on the fuel oil tanks.  
1.7 There were four crew members inside the engine room at the time: the ship’s second engineer, Oiler B, first engineer, and Oiler C.  
1.8 Three of these crew members, excluding the second engineer, escaped the engine room safely and immediately after the fire began. 
1.9 Because the captain had received a report that the second engineer was still in the engine room, he did not use the fixed carbon dioxide firefighting system. 
1.10 The firefighting task force could not enter the engine room, despite wearing firefighting gear, due to the heat and the black smoke. They closed the engine room off and continued spraying seawater around it, waiting on the deck by the stern. 
1.11 As the smoke began to dissipate, the task force entered the engine room to check that there were no remaining flames. They discovered the second engineer, unconscious and out of his work clothes, in the front of the bottommost floor on the portside of the engine room at 17:10. 
1.12 The fire claimed the life of the second engineer, in addition to consuming the fluorescent light bulbs, the oily water separator, the lubricant cleaner, and the control panel for the main engine near the fuel oil overflow tank heating line.
","Asphalt/Bitumen Tanker","Loss of life","3691","","4999","","","","","[Primary Annex 2 not designated]","[Primary Annex 2 not designated]","[Primary Annex 2 not designated]","[Primary Annex 2 not designated]","[Primary Annex 2 not designated]","[Primary Annex 2 not designated]","2020-06-29",""
"C0012804","1","Ocean Cooper 2 (-)","Ocean Cooper 2: Non-SOLAS","DMA","2019-02-14 07:15","Very serious","012020N 1042138E","Singapore Strait TSS Westbound lane","1","0","Sinking","In the early hours of 14 February 2019, a supply vessel while enroute to supply stores to a bulk carrier outside port limits, sank in the westbound lane of the Singapore Strait in Singapore territorial waters.  
 
The crew safely abandoned the vessel prior to it sinking with the assistance of an accompanying vessel. The investigation revealed that steering gear compartment of the vessel had suffered a breach while she was enroute. The breach, which had gone unnoticed, resulted in the steering gear compartment filling up with sea water, which subsequently caused water to enter the engine room compartment and disabled the vessel.  
 
The investigation also revealed that there were no requirements for the installation of bilge alarm for the vessel under the regulations she was certified, and there was no process in place for the crew to check on the condition of the steering gear compartment during the voyage. 
 
Though not contributing to the sinking, the operator of the vessel had not ensured that the vessel was manned by suitably qualified personnel. 
 
 ","","Total loss of the ship","49","","","","3","","","[Primary Annex 2 not designated]","[Primary Annex 2 not designated]","[Primary Annex 2 not designated]","[Primary Annex 2 not designated]","[Primary Annex 2 not designated]","[Primary Annex 2 not designated]","2020-04-14",""
"C0012251","1","Tropical 1 (-)","Tropical 1: Unknown/unspecified","MOZ","2019-02-14 00:00","Very serious","295326S 0310051E","Port","1","0","Fire or explosion","The fishing vessel was docked at Durban for repair work when it caught on fire, killing six crew members and injuring three more.","Fish Catching Vessel","Loss of life,Serious injuries,Ship rendered unfit to proceed","344","","","","9","0","","6","0","0","3","0","0","2019-08-06",""
"C0012888","1","JUN RONG (IMO 8665143)","JUN RONG: Unknown/unspecified","TWN","2019-02-11 19:00","Very serious"," ","South Atlantic Ocean, 86 miles N of Port Stanley, Falkland Islands","0","0","Fire or explosion","The ship sustained explosion in engine room and caught fire in the South Atlantic Ocean, 86 miles N of Port Stanley, Falkland Islands (Malvinas) at 1900 hours local time (UTC-3) on 11 February 2019.

The fire spray throught the ship which was completely burnt out. 64 crew were rescued by nearby FV 'ZI DA YE', subsequently transferred to FV 'LIAN RONG'  and taken to Montevideo, Uruguay. The remaining 5 crew were missing assumed lost. The abandoned burnt out ship drifted to waters 220 miles NE of Port Stanley whilst being monitored by FV 'JIN YUH LONG' and Falkland Island (Malvinas) FPV 'PROTEGAT'. The ship was towed to Cape Town, South Africa and recycled in November 2019.
","Fishing Vessel","Loss of life,Total loss of the ship","998","[No class]","","","69","","","[Primary Annex 2 not designated]","[Primary Annex 2 not designated]","[Primary Annex 2 not designated]","[Primary Annex 2 not designated]","[Primary Annex 2 not designated]","[Primary Annex 2 not designated]","",""
"C0012879","1","SINPYAUNG (IMO 5329267)","SINPYAUNG: Unknown/unspecified","MMR","2019-02-11 04:30","Very serious","185700N 0932754E","Bay , 4 miles N of the coast of Zee Taw, Munaung Township, Myanmar","0","0","Foundering","The ship took water and sank in the Bay of Bengal whilst achored 5 miles N of the coast of Zee Taw, Munaung Township, Myanmar at LAT. 18 57'00""N, LONG. 093 27'54""E at 0430 hours local time (UTC+6:30) on 11 February 2019 in heavy weather.

The ship had archored at the scene for routine maintenance of a lighthouse nearby, and took water through windows after sustaining heavy weather damage. Crew attempted to pump water out but was unsuccessful. 7 crew were rescused, 10 were found dead and remaining 8 crew were missing. Local authorities and fishermen assisted in SAR operations.","Buoy Tender","Loss of life,Total loss of the ship","743","[No class]","579","","25","","","[Primary Annex 2 not designated]","[Primary Annex 2 not designated]","[Primary Annex 2 not designated]","[Primary Annex 2 not designated]","[Primary Annex 2 not designated]","[Primary Annex 2 not designated]","",""
"C0012312","1","JUDIBANA (IMO 7334280)","JUDIBANA: Non-SOLAS","USA","2019-02-07 15:30","Less serious","005580S 0803840W","PUERTO ATUN, JARAMIJO","1","0","Fire or explosion","El día jueves  07 de febrero de 2019 el B/P JUDIBANA sufrió un incendio en EL área de habitabilidad, mientras se encontraba atracado a Puerto ATUN, de acuerdo a la versión del señor Manuel Yagual Quinde, portador de cédula No. 0908159940, era una de las personas que se encontraban a bordo del B/P “JUDIBANA”, manifestó que el día jueves 07 de febrero de 2019, aproximadamente a las quince horas y  treinta minutos, se encontraba realizando trabajos en el taller ubicado en la cubierta 200 sección proa, cuando el buque presentó un corte de energía, procedió a dirigirse a la cubierta principal, percibiendo olor a quemado, cuando se decidió a continuar investigando evidenció humo que emanaba del área de habitabilidad","Fishing Vessel","","1299","","","","","","12","[Primary Annex 2 not designated]","[Primary Annex 2 not designated]","[Primary Annex 2 not designated]","[Primary Annex 2 not designated]","[Primary Annex 2 not designated]","[Primary Annex 2 not designated]","2019-10-18",""
"C0013136","6","Koi 3 (-), KOI 3 (-), Koi 5 (-), KOI 5 (-), Shun Sheng (IMO 9279692), TIGER KNIGHT (IMO 9279692)","Koi 3: Non-SOLAS, KOI 3: Non-SOLAS, Koi 5: Non-SOLAS, KOI 5: Non-SOLAS, Shun Sheng: SOLAS, TIGER KNIGHT: Unknown/unspecified","HKG,SLE","2019-02-07 05:00","Very serious","010989N 1034140E","Westbound lane of TSS, Singapore","1","1","Collision","At approximately 05:00 Local Time (UTC +8 hours) on 7 February 2019, Tugboat KOI 3 which was towing Barge KOI 5, capsized due to the collision with chemical tanker M/V SHUN SHENG. Tugboat KOI 3 and Barge KOI 5 which was loaded with about 4046 tons of Silica sand, departed from the port of Pasir Gudang, Malaysia, destination Tuas, Singapore. The accident happened approximately at the position Lat.: 01o 09.9’N – Long.: 103 o 41.4’E.
Two crew members of Tugboat KOI 3 who were missing, were found dead in the afternoon of 7 February 2019.
","Towing / Pushing Tug","Loss of life,Ship rendered unfit to proceed","98","Sing Lloyd (SGL)","","","6","0","0","[Primary Annex 2 not designated]","[Primary Annex 2 not designated]","[Primary Annex 2 not designated]","[Primary Annex 2 not designated]","[Primary Annex 2 not designated]","[Primary Annex 2 not designated]","2021-01-08","2021-04-12"
"C0012890","1","ORC IV (IMO 8775558)","ORC IV: Unknown/unspecified","NGA","2019-02-06 18:45","Very serious"," ","Bight of Bonny, 11 miles off Bonny Island, Nigeria","0","0","Fire or explosion","The ship caught fire whilst underway to the fishing grounds in the Bight of Bonny, 11 miles off Bonny Island, Nigeria at 1845 hours local time (UTC+1) ON 6 February 2019.

8 crew members were rescued by sister vessels whilst 2 of the crew went missing. The local authorities and Nigerian Navy attended the scene. SAR operation was effected with the assistance of local fishermen. The blaze was extinguished 2 days later with assistance from tug 'CTOW AN SOFIE'. The ship sustained serious damage and was subsequently taken in tow to the Orc Jetty at Kirikiri, Lagos, Nigeria for inspection and repairs. ","Fishing Vessel","Loss of life","123","[No class]","","","10","","","[Primary Annex 2 not designated]","[Primary Annex 2 not designated]","[Primary Annex 2 not designated]","[Primary Annex 2 not designated]","[Primary Annex 2 not designated]","[Primary Annex 2 not designated]","",""
"C0013045","1","KOMIZA (IMO 7321908)","KOMIZA: Non-SOLAS","HRV","2019-02-06 06:03","Serious","433970N 0153950E","Adriatic Sea","0","0","Stranding / grounding","On 6 February 2020 around 06:00 local time (UTC + 1) crew members of passenger vessel “Komiza” began unberthing and maneuvering off the berth in the cove Muna (Island of Žirje) towards the Port of Kaprije. When the vessel sailed outside the breakwater (moving astern), she started drifting downwind under the influence of strong wind gusts and then she rotated for about 90° (pointing with the bow towards the inner part of the cove which is shaped like a funnel). In that position, Master was trying to use the engines to overpower the effect of the wind on the movements of the vessel but did not manage to do so. Shortly after, the vessel grounded on the eastern side of the cove Muna. Consequently, material damage on the underwater part of the hull occurred, but without water ingress, pollution and other damage to third parties. There were no fatalities or injured crew members, passengers nor other persons.","High Speed Craft","Ship rendered unfit to proceed","181","Croatian Register of Shipping (CRS)","","","4","4","0","[Primary Annex 2 not designated]","[Primary Annex 2 not designated]","[Primary Annex 2 not designated]","[Primary Annex 2 not designated]","[Primary Annex 2 not designated]","[Primary Annex 2 not designated]","",""
"C0012895","1","SOLO (IMO 9075670)","SOLO: Unknown/unspecified","PLW","2019-02-05 01:00","Very serious","114046S 1601850E","Kangava Bay, Rennell Island, Solomon Islands","0","0","Stranding / grounding","The ship stranded on a reef after dragging anchor in Kangava Bay, Rennell Island, Solomon Islands in LAT. 11 40'46""S, LONG. 160 18'50""E at 0100 hours local time (UTC+11) on 5 February 2019 in heavy weather.

There was no injuries reported. The ship sustained damage to hull and took water in engine room. All crew were evacuated. Salvage attempts were delayed due to adverse weather conditions. At least 75 tons of fuel oil were leaked into surrounding waters. Australian MSA assisted with spill containment measures. Salvors lightered remaining bunker fuel to a barge in earl March 2019. The ship was refloated with tug assistance on 11 May 2019. The ship was damaged beyond economic repair and towed to Bangladesh for recycling. ","Bulk Carrier","Pollution","38779","Nippon Kaiji Kyokai (NKK)","73592","","","","","[Primary Annex 2 not designated]","[Primary Annex 2 not designated]","[Primary Annex 2 not designated]","[Primary Annex 2 not designated]","[Primary Annex 2 not designated]","[Primary Annex 2 not designated]","",""
"C0012169","1","SOLOMON TRADER (IMO 9075670)","SOLOMON TRADER: SOLAS","HKG","2019-02-04 23:30","Very serious","114077S 1601879E","Kanggava Bay, Rennell Island","0","0","Stranding / grounding","The vessel grounded around 2330 hours on 4 Feb 2019 due to strong wind. All crew abandoned the vessel on 7 Feb 2019 without any injury. Oil spill was reported and clean-up operation was still in progress until 1 Apr 2019.","Bulk Carrier","Pollution","38779","Nippon Kaiji Kyokai (NKK)","73350","","24","","","[Primary Annex 2 not designated]","[Primary Annex 2 not designated]","[Primary Annex 2 not designated]","[Primary Annex 2 not designated]","[Primary Annex 2 not designated]","[Primary Annex 2 not designated]","",""
"C0012599","1","AL RAWDAH (IMO 9349564)","AL RAWDAH: SOLAS","MHL","2019-01-30 13:05","Very serious","205550S 0551720E","Pointe des Galets, Reunion Island","1","0","Fall from height","A Wiper fell down a ventilation duct in the ship's engine room while changing an impeller for a ventilation fan. He died due to injuries received when he fell.","Container Ship (Fully Cellular)","Loss of life,Ship remains fit to proceed","75579","Lloyd's Register (LR)","85326","","","","","[Primary Annex 2 not designated]","[Primary Annex 2 not designated]","[Primary Annex 2 not designated]","[Primary Annex 2 not designated]","[Primary Annex 2 not designated]","[Primary Annex 2 not designated]","2020-06-03",""
"C0012903","1","LR2 POSEIDON (IMO 9378632)","LR2 POSEIDON: Unknown/unspecified","HKG","2019-01-28 13:00","Very serious","405044N 0291710E","Tuzla, Turkey","0","0","Fire or explosion","The ship sustained explosion in pump room and caught fire whilst undergoing repairs at the Gemak Shipyard at Tuzla, Turkey at LAT. 40 50'44""N, LONG. 029 17'10""E at 1300 hours local time (UTC+3) on 28 January 2019.

The blaze was extinguished with assistance from local fire services. 2 shipyard workers were dead, 10 were injuried and taken to local hospitals for medical attention. Inspection was effected. The extent of damage was unknown. Local authorities conducted investigation of the incident. The ship remained at the shipyard for repairs.","Crude/Oil Products Tanker","Loss of life","59172","American Bureau of Shipping (ABS)","109996","","","","","[Primary Annex 2 not designated]","[Primary Annex 2 not designated]","[Primary Annex 2 not designated]","[Primary Annex 2 not designated]","[Primary Annex 2 not designated]","[Primary Annex 2 not designated]","",""
"C0013002","1","EVER SUMMIT (IMO 9300453)","EVER SUMMIT: SOLAS","PAN","2019-01-28 04:01","Serious"," ","Vancouver, BC, Canada","1","0","Contact","On 28 January 2019, the container vessel Ever Summit was berthing under the conduct of a pilot at Vanterm in the Port of Vancouver, British Columbia (BC), with 2 tugs assisting when the vessel struck the berth and a nearby ship-to-shore crane. The vessel, berth, and crane were damaged. There were no injuries or pollution. ","Container Ship","Ship rendered unfit to proceed","76261","American Bureau of Shipping (ABS)","78612","","22","","","[Primary Annex 2 not designated]","[Primary Annex 2 not designated]","[Primary Annex 2 not designated]","[Primary Annex 2 not designated]","[Primary Annex 2 not designated]","[Primary Annex 2 not designated]","2020-11-27",""
"C0012506","1","SIMON STEVIN (IMO 9464807)","SIMON STEVIN: Unknown/unspecified","LUX","2019-01-28 00:00","Very serious","511935N 0031283E","Port","1","0","","Victim fatally wounded after a fall of approximately 12 meters. Victim fell down from a storage deck onto the closed moonpool of a fall pipe vessel.","Other Activities Ships","Loss of life,Ship remains fit to proceed","35034","","35930","","","0","","1","0","0","0","0","0","2019-11-21",""
"C0012221","1","EF Ava (IMO 9389306)","EF Ava: Unknown/unspecified","PRT","2019-01-28 00:00","Very serious","552389N 0375050W","Open sea","2","0","","The ship was on passage to Reykjavik in heavy weather and rolled heavily. The Master, who was on watch at the time, fell and sustained fatal injuries.","Container Ship","Loss of life","7545","","8168","","14","0","0","1","0","0","0","0","0","2019-07-04",""
