Reference,NumberOfShipsInvolved,ShipsInvolved,SOLASStatus,FlagStates,IncidentDateTime,TypeOfCasualty,Coordinates,Location,NumberOfInvestigationReports,NumberOfAnalyses,InitialEvent,SummaryOfEvents,ShipType1,Consequences1,GrossTonnage1,ClassificationSociety1,Deadweight1,Cargo1,CrewOnboard1,PassengersOnboard1,OthersOnboard1,DeadMissingCrew2,DeadMissingPassengers2,DeadMissingOthers3,SeriouslyInjuredCrew2,SeriouslyInjuredPassengers2,SeriouslyInjuredOthers2,InvestationReportDate,AnalysisDate
"C0007473","1","STAR BIRD (IMO 9041423)","STAR BIRD: SOLAS","XDA","2009-08-11 19:30","Serious","150970S 1452390E","Of east Australian coast","0","0","Machinery damage","On 11th August 208 the general cargo vessel STAR BIRD was off the east Australian coast when shel experienced trouble with a lube oil pump on the gear, and after repair lube oil filters kept  clogging up. Steel chips were discovered in the filters and it was decided to stop the vessel to prevent further damage to gear.

Vessel was drifting and subsequently towed to Cairns by tug BURDEKIN.","[Primary Annex 1 not designated]","[Primary Annex 1 not designated]","[Primary Annex 1 not designated]","[Primary Annex 1 not designated]","[Primary Annex 1 not designated]","[Primary Annex 1 not designated]","[Primary Annex 1 not designated]","[Primary Annex 1 not designated]","[Primary Annex 1 not designated]","0","0","0","0","0","0","",""
"C0007678","2","CONGER (IMO 9198771), SAETTA (IMO 9384069)","CONGER: Unknown/unspecified, SAETTA: Unknown/unspecified","GRC,MHL","2009-08-10 12:41","Less serious","521215N 0015180E","9.5 miles south east of Southwold","1","1","Collision","On 10 August 2009, the Greek registered tanker Saetta and the Marshall Islands registered tanker Conger collided when completing a ship to ship (STS) transfer operation off Southwold, Suffolk. Saetta’s starboard lifeboat and davit were damaged. Conger was undamaged and there were no injuries and no pollution.

The collision occurred at a very slow speed, and resulted from the failure of Conger’s main engine to start as the ships separated.
Both manoeuvred to try and avoid a collision, but there were very close when the engine failed and the action taken was not effective. The response to the engine failure, and poor communications, were also contributory factors.
","Oil Chemical Tanker","Ship remains fit to proceed","13431.62","","64959","","23","","","[Primary Annex 2 not designated]","[Primary Annex 2 not designated]","[Primary Annex 2 not designated]","[Primary Annex 2 not designated]","[Primary Annex 2 not designated]","[Primary Annex 2 not designated]","2010-03-26","2012-04-25"
"C0007470","1","VILLE DE MARS (IMO 8905957)","VILLE DE MARS: SOLAS","GBR","2009-08-09 17:20","Serious","232500N 0615900W","Gulf of Oman","0","0","Accidents with life-saving appliances","The Ville de Mars was in the Gulf of Oman on 9th August 20009. At approximately 17.20 hours an AB was mounting wire rope on the lifeboat davit drum.  He wanted to use the electric motor to wind the wire but finding that the motor would not start, informed the bridge of the problem and started turning the drum with the manual handle.  The electric motor suddenly started up, and the handle hit him, causing multiple fractures and serious injury to the AB.  ","CONTAINER SHIP","Serious injuries","37235","","43714","","","","","","","","1","","","",""
"C0007859","1","BRAVERY (IMO 8110100)","BRAVERY: SOLAS","PAN","2009-08-08 15:57","Less serious","223880N 1201270E","Kaohsiung, Taiwan, China ","1","0","Stranding / grounding","1983 built M.V. Bravery sailed from Kaohsiung, Taiwan, China at 0850 hrs on 4th August 2009 with Ballast. Arrived Kaohsiung port no.1 anchorage Lat 22º 38.8´N Long 120º 12.7´E
On 0445 hrs 07th Aug 2009 duty officer chief officer informed master after found dragging on 1050hrs 08.08.2009 got underway after anchor aweigh for seeking shelter. On 1557 hrs 08 Aug 2009 aground at 22º 48.38´N 120º 12.58´E   due to rough sea, Self refloated on 1820hrs 13 Aug 2009.
","[Primary Annex 1 not designated]","[Primary Annex 1 not designated]","[Primary Annex 1 not designated]","[Primary Annex 1 not designated]","[Primary Annex 1 not designated]","[Primary Annex 1 not designated]","[Primary Annex 1 not designated]","[Primary Annex 1 not designated]","[Primary Annex 1 not designated]","","","","","","","2010-08-19",""
"C0007775","1","HUA PENG HAI (IMO 9092422)","HUA PENG HAI: SOLAS","KHM","2009-08-07 21:22","Very serious","200670N 1083620E","China coastal","0","0","Capsizing / listing","At 2122 on AUG. 7 2009, Cambodia bulk cargo ship HUA PENG HAI 02 in NO. 1 anchorage ground of BaSuo port of HaiNan Province of China was capsized by tropical storm “swan” and sunk at the position 20°06.7′N/108°36.2′E. the casualty results 14 million RMB directly economy loss, one crew loss and 3 missing.","GENERAL CARGO","Loss of life,Total loss of the ship","3598","Union Bureau of Shipping (UBS)","6389","","15","","","4","","","","","","",""
"C0007639","1","KANHAVE (IMO 9548562)","KANHAVE: Unknown/unspecified","DNK","2009-08-06 15:30","Less serious","555200N 0102400E","Kattegat","0","0","Fire or explosion","During regular service between Sælvig and Hou carrying 116 pasengers and 11 crew members a fire occurred in the ship's engine room.

The fire cause damage to the ship, delay and inconvenience to passengers, but no injury to persons.

The fire was caused by ardhing at power supply cables for the electric heating element on a hot-water tank, where the arching ignited flammable insulating material on the tank. The fire spread to the sourroundings in the engine room where the hot-water tank was installed, but it was limited to that area.

The fire was detected by an alarm from the automatic fire alarm and detecting system, and it was controlled by the release of the water mist plant, but the release of the water mist plant was relativley late, because the chief engineer intended to examine the situation in the engine room before a release of the system.

During the fire there were problems with the information to passengers because of maloperation of the public address system.  ","RORO CARGO/FERRY","Ship remains fit to proceed","4250","","","","11","116","","0","0","0","0","0","0","",""
"C0010011","1","PRINCESS ASHIKA (IMO 7234002)","PRINCESS ASHIKA: Unknown/unspecified","FJI","2009-08-05 00:00","Very serious"," ","86 km (54 miles) north-east of the capital Nuku’alofa, Tonga ","0","0","Foundered","The passenger ship PRINCESS ASHIKA, carrying 86 passengers, en route from the capital of Tonga Nuku’alofa to Ha’afeva foundered 86 km (54 miles) north-east of Nuku’alofa on 5 August 2009.  The passenger ship sent out a mayday call just before 2300 hours, followed by a distress beacon.

Fifty-four persons were rescued; 72 were reported missing with two bodies recovered. 

A search and rescue operation was deployed involving a P-3 Orion plane from the Royal New Zealand Air Force, five ships including a Tongan Navy ship were also involved in the search. 
","Passenger Ship","Loss of life,Total loss of the ship","677","","223","","","","","","74","","","","","",""
"C0008535","1","ECE NUR K (IMO 9508720)","ECE NUR K: Unknown/unspecified","TUR","2009-08-01 14:40","Serious","533690N 0093300E","Lower Elbe, Twielenfleth roadstead","1","0","Occupational accident","On 1 August 2009, the chemical tanker ECE NUR K, sailing under the Turkish flag, anchored in the Twielenfleth roadstead on the Lower Elbe, where her tanks were to be prepared for taking on new cargo. To this end, in order to remove caustic soda residues by means of a mobile pump, the third officer and an ordinary seaman entered tank no. 1 on the port side at about 14:30 hrs. Both were wearing protective equipment. The bosun stood at the coaming of the entry hatch to tank no.1 and the master was also at the forward part of the ship. 

While the caustic soda was being pumped out, the hose parted from the pressure side of the pump causing the third officer to be spattered with the caustic solution. Here, a small quantity of caustic soda also entered his eyes. Alerted by the screams of the injured, the O/S requested assistance by radio. The master and the bosun took the injured to his cabin, where they continued to rinse his eyes until the arrival of rescue services, which had been requested in the meantime.

After being evacuated from the tanker, the injured was treated as an in-patient for ten days. Environmentally hazardous substances were not realised during the accident.
","TANKER","Serious injuries","12162","Bureau Veritas (BV)","19967","","17","","","[Primary Annex 2 not designated]","[Primary Annex 2 not designated]","[Primary Annex 2 not designated]","[Primary Annex 2 not designated]","[Primary Annex 2 not designated]","[Primary Annex 2 not designated]","2012-03-09",""
"C0007834","1","FULL CITY (IMO 9073672)","FULL CITY: SOLAS","PAN","2009-07-31 00:30","Serious","585815N 0094286E","Såstein, Norway","0","0","Stranding / grounding","At 0044 hrs local time on July 31st the Accident Investigation Board Norway (AIBN) received a message from the Joint Rescue Coordination Centre (JRCC Stavanger). The Panama-registered cargo ship MV Full City, with 23 crew members onboard, had run aground at SASTEIN, off Langesund, Norway.","BULK CARRIER","Pollution,Ship rendered unfit to proceed","15873","Nippon Kaiji Kyokai (NKK)","26758","","23","0","0","[Primary Annex 2 not designated]","[Primary Annex 2 not designated]","[Primary Annex 2 not designated]","[Primary Annex 2 not designated]","[Primary Annex 2 not designated]","[Primary Annex 2 not designated]","",""
"C0007439","2","PROMITHEAS (IMO 9305611), SEAROSE G (IMO 9050096)","PROMITHEAS: SOLAS, SEAROSE G: Unknown/unspecified","BHS,GRC","2009-07-25 08:03","Serious","521490N 0015800E","Off Southwold UK","0","0","Collision","On 25th July 2007 the oil tanker PROMITHIAS was off the Southwold coast in order to carry out a ship-to-ship oil transfer with the M/V SEA ROSE G.   During manouvering for the operation the Searose G swung to port,  and struck Promitheas.","[Primary Annex 1 not designated]","[Primary Annex 1 not designated]","[Primary Annex 1 not designated]","[Primary Annex 1 not designated]","[Primary Annex 1 not designated]","[Primary Annex 1 not designated]","[Primary Annex 1 not designated]","[Primary Annex 1 not designated]","[Primary Annex 1 not designated]","","","","","","","",""
"C0007415","1","HYUNDAI TOKYO (IMO 9305673)","HYUNDAI TOKYO: SOLAS","GBR","2009-07-24 22:30","Very serious","531850N 1582650W","Bering Sea","1","0","Missing: assumed lost","A 74,651gt container ship was on a deep sea passage in calm seas in the Bering Sea in force 3 winds.  At about 1800 one of the electricians invited his colleagues for a birthday drink in his cabin which was on ""D"" deck.  Only beer and wine were said to be consumed.  At about 2200 the electrical cadet (the casualty) went to his cabin to collect his cigarettes and shortly afterwards he returned to his own cabin on ""B"" deck which he shared with an engineering cadet who was watching a movie on a his laptop computer.

A short time later the casualty went to the library to smoke a cigarette.  It appears that he then tried to use his laptop in the library to view a movie but that the laptop screen had become damaged.  The casualty went back to his cabin and told his cabin mate about the problem but he was unable to help.  He then took the laptop to the electrician whose birthday it was.  He was also unable to help but promised to look at the computer in the morning.  The casualty then returned to his own cabin where he undressed.  It is then believed that he went back onto the deck to smoke a cigarette dressed only in his shorts and sandals.  The outside temperature was quite cold at about 10 deg centigrade.

After the engineering cadet finished his movie he went to sleep.  At this time the casualty had not returned to the cabin.

The casualty did not report to the Engine Control Room at 0800 as expected.  The engineering team searched all the public rooms and cabins but could not find him and this was reported to the master.  At 0900 the master sounded the general alarm and ordered a full search of the ship.  The search was completed at 1045 but without success and so the master notified the DPA of the missing cadet.

At 1048 a message was sent to all ships in the area and also to the Maritime Rescue Centre.  The master turned the vessel back at full sea speed along the vessel's track to the position that the casualty was last seen, arriving at 2042.  The ship then commenced a single ship search assisted by Coastguard aircraft.

At 2212 the visibility had reduced to 0.1 mile and the search was called off and the ship resumed her scheduled passage.

The company's investigations identified that the casualty was a normal, quite person.  He was said to have been very friendly with his cabin mate and there were no indications of bad feeling towards him by any of the officers or crew and there was no reason to suspect foul play.  It was discovered that it was impossible to fall into the sea from ""B"" deck as a person would have landed on ""A"" deck, immediately below.  It was only possible to fall overboard from ""A"" deck.  Neither the casualty's cigarettes nor lighter were found.  The guard rails were found to be in good condition, however, because of night navigation requirements the lights around the accommodation were not switched on.

The reason for the casualty disappearing (probably overboard) was not identified.  However, there was evidence of alcohol being consumed and despite reassurances from the group attending the party that the casualty was not drunk, alcohol must be considered to have been a factor.  


","CONTAINER SHIP","","74651","Lloyd's Register (LR)","80059","Containers","","","","1","0","0","0","0","0","2021-01-07",""
"C0008509","1","ALGOCANADA (IMO 9378591)","ALGOCANADA: Unknown/unspecified","CAN","2009-07-24 12:32","Less serious"," ","Near Prince Edward Point, Eastern Lake Ontario","0","0","Fire or explosion","On 24 July 2009, while proceeding westward in eastern Lake Ontario, the petro-chemical tanker AlgoCanada experienced an explosion in the bow thrusters compartment. The ship sustained minor damage to the bow thrusters compartment and forecastle. There were no injuries and damage to the environment and the ship continued its voyage.","TANKER","Ship remains fit to proceed","8009","Bureau Veritas (BV)","11267","","14","","","[Primary Annex 2 not designated]","[Primary Annex 2 not designated]","[Primary Annex 2 not designated]","[Primary Annex 2 not designated]","[Primary Annex 2 not designated]","[Primary Annex 2 not designated]","",""
"C0007666","1","MERIT (IMO 7516644)","MERIT: SOLAS","BHS","2009-07-23 21:15","Serious"," ","Bremen","1","0","Contact","On 23rd July 2009 the bulk carrier MERIT was at Bremen when she collided with the corner of the harbour channel and the harbour basin “E” Bremen on at 21:15 hrs.
	
At the time of the collision two (2) pilots and three (3) tugs were assisting the vessel. 

The vessel was turning via astern 90° from the harbour channel into the basin E in each case one tug was connected forward and aft at the vessel. The third tug was pushing from the starboard side in way of the mid ship area.

The Captain realised, whilst turning into the basin, that the bow of the MERIT was coming very close to the bow of a big container vessel which was laid up in the canal at the opposite side of the harbour basins.

At the same time the aft ship was approaching the dolphins, which were located at the opposite side of the planned lay berth at basin 6. These dolphins were part of the the reason that the aft tug was reduced in her radius action.

Due to the fact that none of the three tugs were able to provide their full assistance with their full engine power and manoeuvring possibilities the vessel collided at the starboard side with the jetty corner of the harbour canal and harbour basin E.
The jetty is a steel / concrete construction.
During the collision with the jetty corner the ship sustained a large hole to her hull  in way of fuel oil tank no. 8 starboard. Size of tank 8 starboard: 710.2 m³.

As a result of the collision, about 6m³ of fuel oil polluted the water.
","[Primary Annex 1 not designated]","[Primary Annex 1 not designated]","[Primary Annex 1 not designated]","[Primary Annex 1 not designated]","[Primary Annex 1 not designated]","[Primary Annex 1 not designated]","[Primary Annex 1 not designated]","[Primary Annex 1 not designated]","[Primary Annex 1 not designated]","[Primary Annex 2 not designated]","[Primary Annex 2 not designated]","[Primary Annex 2 not designated]","[Primary Annex 2 not designated]","[Primary Annex 2 not designated]","[Primary Annex 2 not designated]","2010-03-18",""
"C0007379","1","LIZRIX (IMO 9428188)","LIZRIX: Unknown/unspecified","GBR","2009-07-23 14:02","Serious","500720N 0050380W","Falmouth Bay","0","0","Damages to ship or equipment","After 100 tonnes of fuel oil had been delivered to a ship at anchor, the bunker barge began to pressurise the line with 4 bar of air to blow the residue fuel into the receiving ship's tank. During the line blowing a joint between two lengths of hose failed, releasing some oil. Operations were stopped quickly but 500 litres of oil were spilt on deck and 50 litres went into the sea. The authorities were notified and a boom was deployed. A clean-up contractor attended the scene and the spill was contained. The joint had been tested about 2 months previously to 10 bar. The vessel and the fleet have been advised to check joints and packing regularly.
","[Primary Annex 1 not designated]","[Primary Annex 1 not designated]","[Primary Annex 1 not designated]","[Primary Annex 1 not designated]","[Primary Annex 1 not designated]","[Primary Annex 1 not designated]","[Primary Annex 1 not designated]","[Primary Annex 1 not designated]","[Primary Annex 1 not designated]","","","","","","","",""
"C0007525","2","GOTLAND (IMO 9223796), GOTLANDIA II (IMO 9328015)","GOTLAND: Unknown/unspecified, GOTLANDIA II: Unknown/unspecified","SWE","2009-07-23 11:20","Serious","585494N 0175950E","Nynäshamn","1","0","Collision","On 23 July 2009 the roro cargo ferry GOTLAND was outbound from Nynäshamn when she collided with the inbound roro cargo ferry GOTLANDIA 2 at 11.20 hours LT. The accident was investigated by the Swedish Accident Investigating Board and the report will be forwarded to IMO.","PASSENGER/RORO CARGO/FERRY","Ship remains fit to proceed","29746","Lloyd's Register (LR)","4730","","","","","","","","","","","2010-06-16",""
"C0007810","1","DISCOVERER 534 (IMO 7403469)","DISCOVERER 534: SOLAS","PAN","2009-07-22 15:30","Very serious","113110N 0800980E","Bay of Bengal, 21.3 n. Miles off East Coast India","1","0","Accidents with life-saving appliances","While lifting a 18-3/4” wellhead housing complete with running tool and 15 ft pup joint from the main deck to the aft catwalk, Mr. Singh  was caught between a stanchion post and the lift.  Mr. Singh suffered a crush injury to his trunk. He was administered Emergency Medical Treatment  by the Rig Doctor and then, under continuous CPR while in-flight, an emergency  Medivac chopper took him off the rig for medical treatment  in Chennai  where the Trauma Department was notified in advance of his expected arrival. He was met by an ambulance at the airport and bought to the Apollo Hospital for emergency medical care.  He was declared dead 5 minutes after arriving at the hospital","DRILLING SHIP","Serious injuries","17284","American Bureau of Shipping (ABS)","7403","","153","","","","","","1","","","2010-06-29",""
"C0007998","1","STX DAISY (IMO 9449493)","STX DAISY: SOLAS","PAN","2009-07-21 09:38","Less serious"," ","Mt Maunganui Wharf no.11, Port of Tauranga, New Zealand","1","0","Fire or explosion","MV STX Daisy arrived at Port of Tauranga at 0530 hours LT on 17 July 2009. and anchored at 0606 hrs. The port pilot boarded at 1354 hours and vessel was all fast starboard side alongside to Mount Maunganui Wharf no.11 at 1515 hours. Cargo (PKE) discharge was commenced using grabs at 1640 hours. On 21st of July during discharge of cargo from No.5 hold the excavator caught fire near its exhaust terminal. The ship’s crew tried initially to put out the fire using portable extinguishers, but was unsuccessful. They then used fire hoses from the main deck and extinguished the fire. Shore fire service arrived and ensured that there was no further risk","OPEN-HATCH BULK CARRIER","Ship remains fit to proceed","20441","Korean Register (KR)","33200","","22","","","","","","","","","2010-12-23",""
"C0008042","1","YM TIANJIN (IMO 9326744)","YM TIANJIN: SOLAS","DEU","2009-07-21 05:30","Very serious","222570N 1201880E","Roads of Kaohsiung, Taiwan, China","1","1","work related accident","At about 0530 hours  on 21 July 2009, a fatal accident occurred in the roads of Kaohsiung,
Taiwanm China on board the YM TIANJIN, a container vessel flying the German flag. The
German master, whose rotation had ended, and a German ship mechanic were to be taken ashore on a tender to start their home leave. The master boarded the tender via the combined accommodation/pilot ladder2 without any problems. However, the ship mechanic, who was following, fell into the water while stepping from the pilot ladder onto the tender's boarding platform. The ship mechanic failed to reach the lifebuoys which were thrown in his direction. He submerged very quickly after a few swimming strokes and did not reappear for quite some time. The crew of the tender were assisted in their attempts to prevent the Seaman, who was showing no signs of life, from drowning by the German master. The vessel had fenders (car tyres) attached and it was initially not possible to pull the lifeless body over her side; therefore, efforts were limited to holding the head of the injured person above water.
It was only possible to recover the seaman at about 06:20 hours after help was received
from the crew of a coastguard patrol boat from which assistance had been requested. The casualty was immediately taken ashore in the tender and transported to a hospital. However, it is very probable that he had already succumbed to his injuries before being recovered from the water.
1
","Container Ship","Loss of life","41899","Germanischer Lloyd (GL)","53627","","18","","","","","","1","","","2011-02-11","2012-04-25"
"C0007717","1","AQUILA (-)","AQUILA: Unknown/unspecified","GBR","2009-07-20 15:40","Very serious","564780N 0060500W","Bo Faskadale Reef, Ardnamurchan","1","0","Capsizing / listing","At about 15 :40 hours, on 20 July 2009 the fishing ship Aquila, with a crew of four, capsized  while dredging for scallops to the east of the Isle of Muck, off the west coast of Scotland. Three of her crew lost their lives in the accident; their bodies were recovered from the sea after the sole survivor was rescued by a passing yacht.

Aquila was trawling on the Bo Faskadale Reef when her starboard trawl warp became snagged on the seabed. She yawed and heeled to starboard in following seas. The skipper put the engine out of gear, but had no time to take further action before the ship capsized. The speed of the capsize resulted in the ship’s liferaft and emergency position indicating radio beacon (EPIRB) becoming trapped in the superstructure. Therefore, although they had been released from their stowage cradles, neither of these important safety items were able to operate as intended. 
","[Primary Annex 1 not designated]","[Primary Annex 1 not designated]","[Primary Annex 1 not designated]","[Primary Annex 1 not designated]","[Primary Annex 1 not designated]","[Primary Annex 1 not designated]","[Primary Annex 1 not designated]","[Primary Annex 1 not designated]","[Primary Annex 1 not designated]","[Primary Annex 2 not designated]","[Primary Annex 2 not designated]","[Primary Annex 2 not designated]","[Primary Annex 2 not designated]","[Primary Annex 2 not designated]","[Primary Annex 2 not designated]","2010-04-15",""
"C0007392","2","MARMARA N (IMO 7512521), MSC VOLOS (IMO 8415641)","MARMARA N: Unknown/unspecified, MSC VOLOS: SOLAS","GBR,TUR","2009-07-20 01:00","Less serious","405680N 0283890E","Ambarli Roads","0","0","Collision","Marmara N dragged her anchor and collided with the MSC Volos which was at anchor in Amabarli Roads","CONTAINER SHIP","Ship remains fit to proceed","10282","Germanischer Lloyd (GL)","13520","","","","","","","","","","","",""
"C0007399","1","ALEXANDER KUPRIN (IMO 9057317)","ALEXANDER KUPRIN: Unknown/unspecified","MLT","2009-07-18 11:47","Serious"," ","Port of sunderland","0","0","Collision","On 18 July 2009 the small general cargo vessel ALEXANDER KUPRIN was departing from Sunderland, a North East English port, with a pilot onboard. The region had recently had a large rainfall which resulted in a very strong flow from the land.
As the vessel cleared the dock, and entered the main flood stream, she did not appear to be responding well to the helm being applied.
In an effort to make the turn into the channel, hard to starboard helm was applied as the vessel proceeded towards an area of moored yachts. Despite full astern, contact was made with a small dolphin and yachts.
","[Primary Annex 1 not designated]","[Primary Annex 1 not designated]","[Primary Annex 1 not designated]","[Primary Annex 1 not designated]","[Primary Annex 1 not designated]","[Primary Annex 1 not designated]","[Primary Annex 1 not designated]","[Primary Annex 1 not designated]","[Primary Annex 1 not designated]","","","","","","","",""
