Reference,NumberOfShipsInvolved,ShipsInvolved,SOLASStatus,FlagStates,IncidentDateTime,TypeOfCasualty,Coordinates,Location,NumberOfInvestigationReports,NumberOfAnalyses,InitialEvent,SummaryOfEvents,ShipType1,Consequences1,GrossTonnage1,ClassificationSociety1,Deadweight1,Cargo1,CrewOnboard1,PassengersOnboard1,OthersOnboard1,DeadMissingCrew2,DeadMissingPassengers2,DeadMissingOthers3,SeriouslyInjuredCrew2,SeriouslyInjuredPassengers2,SeriouslyInjuredOthers2,InvestationReportDate,AnalysisDate
"C0012870","1","LINTAS TIMUR (IMO 8740618)","LINTAS TIMUR: Unknown/unspecified","IDN","2019-06-01 16:00","Very serious","014245S 1222507E","Gulf of Tolo, 14 miles off Banggai, Sulawesi Tengah, Indonesia","0","0","Machinery damage","The ship sustained main engine failure, took water, developed list and sank in Gulf of Tolo, 14 miles off Banggai, Sulawesi Tengah, Indonesia at LAT. 01 42'43""S, LONG. 122 25'07""E at 1600 hours locatl time (UTC+8) ON 1 June 2019 in heavy weather.  

All 18 crew abandoned ship. 1 crew member was rescued by MV 'NURBAYAKSAR' on 4 June 2019 after floating in the sea for 3 days and taken ashore for medical treatment for exposure and dehydration. The remaining 17 crew were missing. SAR operations were effected by local rescue agencies. ","General Cargo Ship","Loss of life,Total loss of the ship","1720","Biro Klasifikasi Indonesia","2529","","18","","","[Primary Annex 2 not designated]","[Primary Annex 2 not designated]","[Primary Annex 2 not designated]","[Primary Annex 2 not designated]","[Primary Annex 2 not designated]","[Primary Annex 2 not designated]","",""
"C0012207","1","GALAPAGOS MAJESTIC (IMO 9695999)","GALAPAGOS MAJESTIC: SOLAS","ECU","2019-05-31 01:10","Very serious","000900S 0903900W","ISLAS GALAPAGOS","1","0","Stranding / grounding","Embarcación navegaba cerca de costa y encalló el Capitán  de la embarcación no tenía el control de la posición de la embarcación, posteriormente la embracación se hundió","Passenger/Cruise","Total loss of the ship","227","","148","","","","","[Primary Annex 2 not designated]","[Primary Annex 2 not designated]","[Primary Annex 2 not designated]","[Primary Annex 2 not designated]","[Primary Annex 2 not designated]","[Primary Annex 2 not designated]","2019-10-18",""
"C0012866","1","HB CUU LONG (IMO 8656489)","HB CUU LONG: Unknown/unspecified","VNM","2019-05-30 07:30","Very serious","152838N 1084000E","Trung Giang Estuary off Tam Hai, Nui Thanh, Quang Nam Province, Vietnam","0","0","Capsizing / listing","The ship developed list and subsequently sank in the Truong Giang Estuary off Tam Hai, Nui Thanh, Quang Nam Province, Vietnam in LAT. 15 28'38""N, LONG. 108 40'01""E at 0730 hours local ime (UTC+7) on 30 May 2019.

The ship was performing sand suction dredging in the fairway at the time of the incident. All 9 crew were rescued by local authorities. Oil containment measures were effected. 9000 litres of diesel oil was to be removed prior to salvage operations. ","Hopper/Dredger (unspecified)","Pollution,Total loss of the ship","1570","Vietnam Register (VR)","1422","","9","","","[Primary Annex 2 not designated]","[Primary Annex 2 not designated]","[Primary Annex 2 not designated]","[Primary Annex 2 not designated]","[Primary Annex 2 not designated]","[Primary Annex 2 not designated]","",""
"C0012959","1","RIGA (IMO 9141376)","RIGA: Unknown/unspecified","MLT","2019-05-27 01:00","Very serious","420959N 0162460E","Open sea","1","0","","Following completion of loading of cargo, MV Riga departed from Porto Marghera, Italy, on 26 May 2019. On the evening of 27 May, the chief engineer went up to the bridge and informed the chief officer that the water ingress alarm of the cargo hold bilge well had activated and that he intended to investigate the matter. The chief officer ordered an able seafarer to open the cargo hold access hatch to visually investigate from the deck. The chief engineer accompanied the able seafarer and on noticing water inside the cargo hold, the former entered the cargo hold. While on the cargo hold ladder, he fell down the access trunk. The crew members immediately prepared for the chief engineers rescue and, on bringing him out of the cargo hold, tried to resuscitate him. However, their efforts were unsuccessful.","General Cargo Ship","Loss of life","2810","[Other]","4220","Dry bulk","9","0","0","1","0","0","0","0","0","2020-06-09",""
"C0012201","1","SENSHO MARU (IMO 9623075)","SENSHO MARU: Unknown/unspecified, SUMIHO MARU: Unknown/unspecified","JPN","2019-05-26 00:00","Very serious"," ","2 kilometers off Cape Inubosaki off eastern Japan","0","0","Collision","The Sensho Maru sank to the seafloor at a depth of about 30 meters after colliding with another 499-ton cargo ship, the Sumiho Maru, around 12 kilometers off Inubosaki in Chiba Prefecture early Sunday.


The four crew members on the Sumiho Maru, based in Kure, Hiroshima Prefecture, escaped safely. But two of the four crewmen of the Sensho Maru, based in Imabari, Ehime Prefecture, were found inside the sunken ship and confirmed dead in the following days. The event resulted in two loss of life","General Cargo Ship","Loss of life,Total loss of the ship","499","","1710","","","","","[Primary Annex 2 not designated]","[Primary Annex 2 not designated]","[Primary Annex 2 not designated]","[Primary Annex 2 not designated]","[Primary Annex 2 not designated]","[Primary Annex 2 not designated]","",""
"C0013102","2","Minx (-), Vision (-)","Minx: Non-SOLAS, Vision: Non-SOLAS","GBR,GIB","2019-05-25 18:55","Very serious","433153N 0070271E","Off Cannes, France","1","0","Collision","Fatal injury to crewman from the UK registered motoryacht Minx after a collision with the Gibraltar registered motoryacht Vision off Cannes, France.","Other Activities Ships","Loss of life,Ship rendered unfit to proceed","78.05","","","","4","9","0","[Primary Annex 2 not designated]","[Primary Annex 2 not designated]","[Primary Annex 2 not designated]","[Primary Annex 2 not designated]","[Primary Annex 2 not designated]","[Primary Annex 2 not designated]","2021-01-28",""
"C0012199","1","KMTC HONGKONG (IMO 9157753)","KMTC HONGKONG: SOLAS","KOR","2019-05-25 06:30","Serious"," ","Laem Chabang port in Thailand (Main Terminal)","0","0","Fire or explosion","A fire broke out on a box ship at Laem Chabang port in Thailand, following an explosion, sometime between 06:30 am and 07:00 on the morning of Saturday 25 May

An explosion and fire that tore through a berthed container and caused 133 people to be hospitalized ","Container Ship (Fully Cellular)","Serious injuries","16731","","20999","","","","","[Primary Annex 2 not designated]","[Primary Annex 2 not designated]","[Primary Annex 2 not designated]","[Primary Annex 2 not designated]","[Primary Annex 2 not designated]","[Primary Annex 2 not designated]","",""
"C0012957","1","LEOPOLD STAFF (IMO 9272228)","LEOPOLD STAFF: Unknown/unspecified","MLT","2019-05-25 01:00","Less serious","155899S 0191800W","Open sea","1","0","Accidents with life-saving appliances","While the vessel was underway to Durban, South Africa, the crew members decided to carry out maintenance and test the free-fall lifeboat launching arrangement. The lifeboat was lifted by the davits with her aft lashings still attached, and a test of the release hook was then carried out. Afterwards, to allow for maintenance works, the aft lashings were removed and the lifeboat was slid further down on the ramp. However, as the lifeboat was off the ramp, the hoisting slings started to slide out from their ferrules, until the lifting block recoiled and the lifeboat slid to the water. The swaging of the sheathed steel wires of the hoisting slings was considered to be the immediate cause of this occurrence.","General Cargo Ship","","24167","Polski Rejestr Statkow (Polish Register of Shipping) (PRS)","30468.8","Dry bulk","25","0","0","0","0","0","0","0","0","2020-06-09",""
"C0013060","1","KARINA C (IMO 9558000)","KARINA C: SOLAS","GBR","2019-05-24 09:45","Very serious","372160N 0055900W","Seville, Spain","1","0","Contact","Second officer fatally crushed by moving gantry crane while working on deck in harbour.","General Cargo Ship","Loss of life","4151","Bureau Veritas (BV)","7000","","9","","","[Primary Annex 2 not designated]","[Primary Annex 2 not designated]","[Primary Annex 2 not designated]","[Primary Annex 2 not designated]","[Primary Annex 2 not designated]","[Primary Annex 2 not designated]","2020-11-26",""
"C0013098","1","MAERSK PATRAS (IMO 9168221)","MAERSK PATRAS: SOLAS","SGP","2019-05-19 09:30","Very serious","482000N 0692140W","St. Lawrence River, Canada","1","0","Man Overboard","On 19 May 2019, at about 0930H, the Singapore registered container ship, Maersk Patras, was approaching Escoumins pilot station in the St. Lawrence river, Quebec, Canada at about 15 knots, bound for the Port of Montreal, Canada.

Due to the non-guaranteed availability of stevedores for lashing and unlashing of containers, ships calling the Port of Montreal would typically make use of ship’s crew to perform these tasks during the river passage from / to the port. The Second Officer, who was not wearing a safety harness and floatation device while unlashing a container at the outermost row, fell into the sea through an opening on deck. ","Container Ship (Fully Cellular)","Loss of life","31333","American Bureau of Shipping (ABS)","37842","Containers","21","0","0","[Primary Annex 2 not designated]","[Primary Annex 2 not designated]","[Primary Annex 2 not designated]","[Primary Annex 2 not designated]","[Primary Annex 2 not designated]","[Primary Annex 2 not designated]","2020-12-11",""
"C0013061","1","ELLIE-ADHAMH (IMO 9299238)","ELLIE-ADHAMH: Unknown/unspecified","IRL","2019-05-19 01:00","Very serious","521533N 0062025W","Port","1","0","","As the berthing crew were preparing to dock the MV Stena Nordica at approximately 03.40 hrs on the 17th May 2019, they noticed a man passing by No. 3 berth. He seemed unsteady on his feet and informed the berthing crew he was going to the MFV Ellie Adhamh. The man was then seen to proceed towards No. 4 berth where that vessel was moored. The last line came ashore from the MV Stena Nordica at approximately 03.55 hrs. A member of the berthing party then went to check to see if the man was alright. As he approached the MFV Ellie Adhamh he heard a noise coming from between the vessel and the quay wall. The other members of the berthing crew arrived and located the Casualty face down in the water. The berthing crew then contacted the Duty Port Controller who contacted the emergency services. The MV Stena Nordica launched its rescue boat and they recovered the Casualty. They then landed him at the Lifeboat Station but despite medical intervention the Casualty did not survive.","Fish Catching Vessel","Loss of life","230","","20.9","","","0","","1","0","0","0","0","0","2020-11-26",""
"C0012955","2","AHMET CAN (IMO 9368182), PERSENK (IMO 9578995)","AHMET CAN: Unknown/unspecified, PERSENK: Unknown/unspecified","MLT,PAN","2019-05-18 01:00","Serious","404599N 0273570E","Coastal waters (within 12 miles)","1","0","Collision","The Maltese registered bulk carrier Persenk was on passage from Istanbul Anchorage to Ashdod, Israel. On 18 May 2019, she was involved in a collision with Ahmet Can in position 40 46.0 N 027 35.7 E, in the Sea of Marmara. The collision occurred in the afternoon and in good visibility. At the time of the collision, both vessels were in sight of one another, making way in the Turkish Straits Traffic Separation Scheme. They were advancing along the general direction of traffic flow for that traffic lane, albeit on a converging course. Persenk was gradually drawing ahead of Ahmet Can. Although the weather was fine and clear, the watchkeepers on Persenk and Ahmet Can neither did they notice each other, nor discern the developing close quarter situation until Ahmet Can was very close and right ahead.","Bulk Dry (general, ore) Carrier","Ship remains fit to proceed","18873","Lloyd's Register (LR)","168","","18","0","0","0","0","0","0","0","0","2020-06-05",""
"C0012923","1","PORT STANLEY (IMO 9246463)","PORT STANLEY: SOLAS","MHL","2019-05-15 15:45","Very serious"," ","Guangzhou, China","1","0","Fall from height","An ASD fell down an access ladder inside a COT while entering the tank to inspect work done shipyard staff.","Chemical/Products Tanker","Loss of life","29998","DNV GL AS (DNVGL)","46157","","28","","","[Primary Annex 2 not designated]","[Primary Annex 2 not designated]","[Primary Annex 2 not designated]","[Primary Annex 2 not designated]","[Primary Annex 2 not designated]","[Primary Annex 2 not designated]","2021-01-26",""
"C0012855","1","KAPITAN PONIKAROVSKIY (IMO 7636614)","KAPITAN PONIKAROVSKIY: Non-SOLAS","RUS","2019-05-15 08:00","Very serious","595200N 0301323E","St. Petersburg, Russian Federation","0","0","Contact","The ship struck the quay whilst manoeuvring at berth No. CB-15 at the West Terminal at St. Petersburg, Russian Federation at LAT. 59 52'35""N, LONG. 030 13'23""E on 15 May 2019.

The ship sustained damage to hull. There was no injuries reported. Some oil pollution was reported in water. Anti pollution booms were deployed and clean up operation was effected. The ship was berthed for inspection and repairs.","Products Tanker","Pollution","5083","RINA Services S.p.A (RINA)","5450","","","","","[Primary Annex 2 not designated]","[Primary Annex 2 not designated]","[Primary Annex 2 not designated]","[Primary Annex 2 not designated]","[Primary Annex 2 not designated]","[Primary Annex 2 not designated]","",""
"C0013067","1","SEATRUCK PROGRESS (IMO 9506203)","SEATRUCK PROGRESS: Unknown/unspecified","IMN","2019-05-15 01:00","Very serious","532664N 0030074W","Port","1","0","","A freight Ro-Ro vessel was discharging HGV trailers when the 3/O was struck by a reversing trailer and fatally injured. The 3/O was stood on the vessel stern ramp as the trailer was being reversed out of the vessel's lower hold up a ramp. The trailer was being moved by a tug transporter. Neither the driver of the tug nor the 3/O on the ramp were aware of each other's presence.","Ro-Ro Cargo Ship","Loss of life","19722","","5300","","22","0","","1","0","0","0","0","0","2020-12-04",""
"C0013017","1","POLAR COD (IMO 9334557)","POLAR COD: SOLAS","MHL","2019-05-14 13:30","Very serious","270570N 0515570E","Arabian Gulf","1","0","Fall from Height","While underway in the Arabian Gulf, the Third Engineer of POLAR COD fell from an inclined ladder while ascending and landed on the main engine cylinder head intermediate platform (a height of 6-11.3 m). The Third Engineer was pronounced deceased as a result of his injuries.","Products Tanker","Loss of life","40865","American Bureau of Shipping (ABS)","73919","Product","21","","","[Primary Annex 2 not designated]","[Primary Annex 2 not designated]","[Primary Annex 2 not designated]","[Primary Annex 2 not designated]","[Primary Annex 2 not designated]","[Primary Annex 2 not designated]","2020-09-29",""
"C0012949","1","ALYARMOUK (IMO 9356438)","ALYARMOUK: Unknown/unspecified","MLT","2019-05-10 01:00","Serious","061999N 0793399W","Open sea","1","0","Damages to ship or equipment","MT Alyarmouk was drifting in the vicinity of the Panama Pacific Lightering Area, awaiting commencement of cargo operations. As no cargo operations were scheduled on 10 May 2019, it was decided to carry out scheduled routine maintenance of the hose handling crane. The bosun was perched on a bosuns chair, to carry out maintenance on the head of the cranes jib, while three other seafarers were assisting him from other locations. The chief officer was supervising the task. As attempts to complete the job were proving to be unsuccessful, it was decided to suspend the task and complete it at a later stage. While lowering the bosuns chair, the rope, by which it was suspended, parted and the bosun, in spite of wearing a safety harness, fell down a height of about 3.7 metres onto the main deck. Following medical evacuation, it was reported that the bosun had suffered from a fractured left heel and three fractured ribs.","Oil Tanker","Serious injuries,Ship remains fit to proceed","61342","Nippon Kaiji Kyokai (NKK)","239","Oil","22","0","0","0","0","0","1","0","0","2020-06-02",""
"C0012270","2","GUNGNER R (IMO 1167312), KARIN HOJ (IMO 8685844)","GUNGNER R: Unknown/unspecified, KARIN HOJ: Unknown/unspecified","DNK","2019-05-09 01:00","Very serious","532670N 0064947E","Port","2","0","Stranding / grounding","During berthing operation the captain lost control of the vessel which resulted in damages to the vessel propulsion- The officer on dech started to repair the hydraulic hoses on the propulsion gear. During this repair she entered the power pack for the propulsion gear. For some reason she dismantled a hydraulic hose which caused the cardan shaft to lower and squeze her. She was later declared dead.","Other Dry Cargo (livestock, barge, heavy cargo, etc.) Carrier","Loss of life,Ship rendered unfit to proceed","408","","492","","2","0","0","1","0","0","0","0","0","2019-09-17",""
"C0012757","1","ISRAFIL HUSEYNOV (IMO 8705125)","ISRAFIL HUSEYNOV: SOLAS","AZE","2019-05-08 18:44","Very serious","395100N 0502400E","Caspian sea, Shahdeniz Bravo","0","0","Fire or explosion","Working personnel were undertaking repair activities onboard the pipe-laying barge “Israfil Huseynov” in an area called the “Firing Line” on Injection Molding Polypropylene (IMPP) equipment (field joint coating equipment) for the Shah Deniz 2 Project in the Caspian Sea (Azerbaijan) on 8th May 2019. At 18:44, during the repair works a flash-fire occurred in “Firing Line” Working Station №7 and resulted in 14 persons being injured. 
Given that the foggy weather condition prevented the medevac, the injured personnel were evacuated by the support vessel. They were initially admitted to hospital in Baku and then transferred by the air ambulance flights to various specialized centers abroad. Unfortunately, one of the critically injured personnel died in a specialized hospital in France. The primary cause of the explosion and flash-fire was identified as the over-heating of the residual polypropylene contained in the IMPP equipment, which generated flammable vapours, as a result of violation of the rules for repair of equipment and safety.
","Other Activities Ships","Loss of life,Serious injuries,Ship rendered unfit to proceed","17592","Russian Maritime Register of Shipping (RMRS)","11159","","29","","248","[Primary Annex 2 not designated]","[Primary Annex 2 not designated]","[Primary Annex 2 not designated]","[Primary Annex 2 not designated]","[Primary Annex 2 not designated]","[Primary Annex 2 not designated]","",""
"C0012998","1","SEATRUCK PERFORMANCE (IMO 9506227)","SEATRUCK PERFORMANCE: Unknown/unspecified","IMN","2019-05-08 01:00","Serious","540157N 0060663W","Port","1","0","Stranding / grounding","Ro-Ro Cargo vessel suffers grounding resulting in breached compartments below water level","Ro-Ro Cargo Ship","Ship remains fit to proceed","19722","[Other]","5600","","22","11","11","0","0","0","0","0","0","2020-08-03",""
"C0012871","1","SL-D1 (IMO 8741600)","SL-D1: Unknown/unspecified","ZZZ","2019-05-08 00:00","Serious","151600N 1200000E","Bucao River near Barangay Bangan, Botolan, Philippines","0","0","Stranding / grounding","The ship took water, intentionally beached and partially sank in the estuary of the Bucao River near Barangay Bangan, Botolan, Philippines, at LAT. 15 16'00""N, LONG. 120 00'54""E on 8 May 2019 in heavy weather. 

There were no injuries reported. There was some oil pollution reported in surrounding waters. Local coast guard attended the scene for an inspection. Clean up measures were effected.","Dredger (unspecified)","Pollution","1203","[No class]","","","","","","[Primary Annex 2 not designated]","[Primary Annex 2 not designated]","[Primary Annex 2 not designated]","[Primary Annex 2 not designated]","[Primary Annex 2 not designated]","[Primary Annex 2 not designated]","",""
"C0012872","1","TENN MING YANG NO. 268 (IMO 8778847)","TENN MING YANG NO. 268: Unknown/unspecified","TWN","2019-05-07 07:30","Very serious","345430S 0414824E","Indian Ocean, 800 miles E of East London, South Africa","0","0","Fire or explosion","Thie ship caught fire in the Indian Ocean 800 miles E of East London, South Africa, at LAT. 34 53'30""S, LONG. 041 48'24""E at 0730 hours local time (UTC+3) on 7 May 2019.

All 16 crew abandoned ship to life-rafts and were rescued by a nearby sister FV 2 hours later. MV 'MAERSK LANCO' was also alerted to assist but stoof down after the crew were rescued. There was no injuries reported. The abandoned buring ship was left drifting and subsequently assumed to have sunk. ","Fishing Vessel","Total loss of the ship","98","[No class]","","","16","","","[Primary Annex 2 not designated]","[Primary Annex 2 not designated]","[Primary Annex 2 not designated]","[Primary Annex 2 not designated]","[Primary Annex 2 not designated]","[Primary Annex 2 not designated]","",""
"C0013138","1","NYK ISABEL (IMO 9387437)","NYK ISABEL: SOLAS","SGP","2019-05-04 17:50","Very serious","350000N 1285355E","Busan, Republic of Korea","1","0","Fall from Height","A crewmember fell 20m down from the shipboard crane cabin to the cross deck, when the crewmember was about to operate the crane, and was seriously injured. The crewmember was conveyed ashore for medical treatment by the Coast Guard but later succumbed to injuries at the hospital.

The investigation revealed that the crane cabin’s floor plate gave way which caused the crewmember to fall. The floor plate (as a part of the crane cabin floor) was found corroded with severe pitting along the welded joint which had thinned the material. The Company’s Planned Maintenance System (PMS) incorporated a quarterly inspection schedule recommended by the crane manufacturer. The crewmember who conducted the inspections, and operators of the crane, did not notice the corrosions of the floor plate over a period of time. The crane manufacturer deemed such inspections to only be carried out by their authorised and trained personnel. The crane manufacturer had not included the scope of inspection required for the crane cabin, including what was to be inspected and how the inspection was to be carried out. 

The design of the crane cabin required the operator to stand on the floor plate, albeit temporarily, adding weight on the plate which posed a risk to the operator, especially when the floor plate was corroded. The investigation team thus opined that the design of the crane cabin could be improved by providing additional load bearing support for the floor plate and on the design of the seat arrangement.","Container Ship (Fully Cellular)","Loss of life","27003","Nippon Kaiji Kyokai (NKK)","34577","Containerised ","24","0","0","[Primary Annex 2 not designated]","[Primary Annex 2 not designated]","[Primary Annex 2 not designated]","[Primary Annex 2 not designated]","[Primary Annex 2 not designated]","[Primary Annex 2 not designated]","2021-05-10",""
"C0012197","1","GRYF (IMO 8818300)","GRYF: Non-SOLAS","BHS","2019-05-04 14:05","Very serious"," ","Port of Poland","1","0","Fatality","Crew member fatality due to an a fall from deck 3 to deck 2.","Passenger/Ro-Ro Ship (Vehicles)","Loss of life","18653","Overseas Marine Certification Service, Inc. (OMCS)","6934","","37","","","[Primary Annex 2 not designated]","[Primary Annex 2 not designated]","[Primary Annex 2 not designated]","[Primary Annex 2 not designated]","[Primary Annex 2 not designated]","[Primary Annex 2 not designated]","2020-08-27",""
"C0012285","1","YM COSMOS (IMO 9198288)","YM COSMOS: SOLAS","LBR","2019-05-04 11:40","Very serious","091820N 1094810E","South China Sea","1","0","crushed in between Provision crane and railing.","On May 04, 2019 at about 1140 LT, vessel passage from Port Klang, Malaysia to Kaohsiung, Taiwan at position Lat 09-18.2 N Long 109-48.1 E, the Able Seafarer (AB) who was painting at the provision crane at the bulkhead of accommodation had squeezed in between provision crane and railing. He had injuries to his cheat.
The Master contacted to Keelung Hospital Ministry of Health through the company and had suggested to deviate at position Lat 10-25.5N Long 110-25.9E. Vessel deviated to Vungtau, Vietnam and arrived at 2130 LT on May 04, 2019. The injured crew was transferred to the hospital at 2328 LT. On May 05, 2019 at 1235 LT the Chief Officer who left for the hospital with injured crew came back with the death certificate.  
","Container Ship (Fully Cellular)","Loss of life","64254","DNV GL AS (DNVGL)","68413","","","","","[Primary Annex 2 not designated]","[Primary Annex 2 not designated]","[Primary Annex 2 not designated]","[Primary Annex 2 not designated]","[Primary Annex 2 not designated]","[Primary Annex 2 not designated]","2020-12-17",""
"C0012861","1","BARRANCO (IMO 8523814)","BARRANCO: Unknown/unspecified","ESP","2019-05-03 07:20","Very serious","422645N 0032435E","Mediterranean Sea, 12 miles E of Cerbere, Spain","0","0","Fire or explosion","The ship caught fire and subsequently sank in the Mediterranean Sea 12 miles E of Cerbere, Spain in Lat. 42 26'45""N, LONG. 003 24'35""E at 0720 hours local time (UTC+2) on 3 May 2019 in good weather.

3 crew were rescued by nearby FV 'BERTO', the body of the fourth crew member was also recovered. Salvamento rescue boats 'ALNILAM' and 'SIRIUS' and AW-139 helicopter 'HELIMER 201' attended the scene. The ship was burned almost to the waterline before sinking.","Fishing Vessel","Loss of life,Total loss of the ship","99","[No class]","","","4","","","[Primary Annex 2 not designated]","[Primary Annex 2 not designated]","[Primary Annex 2 not designated]","[Primary Annex 2 not designated]","[Primary Annex 2 not designated]","[Primary Annex 2 not designated]","",""
