Reference,NumberOfShipsInvolved,ShipsInvolved,SOLASStatus,FlagStates,IncidentDateTime,TypeOfCasualty,Coordinates,Location,NumberOfInvestigationReports,NumberOfAnalyses,InitialEvent,SummaryOfEvents,ShipType1,Consequences1,GrossTonnage1,ClassificationSociety1,Deadweight1,Cargo1,CrewOnboard1,PassengersOnboard1,OthersOnboard1,DeadMissingCrew2,DeadMissingPassengers2,DeadMissingOthers3,SeriouslyInjuredCrew2,SeriouslyInjuredPassengers2,SeriouslyInjuredOthers2,InvestationReportDate,AnalysisDate
"C0007524","1","FESTIVO (IMO 7802067)","FESTIVO: SOLAS","SWE","2009-04-03 21:05","Serious","144130N 0172650W","Dakar","1","0","Damages to ship or equipment","M/V Festivo was alongside in Dakar, Senegal and discharging Ro-Ro cargo. During discharge of WD one crane car hit one of the rails to the door from maindeck to WD. At around 21.00 the discharging of the weather deck was complete, but as the crew was closing the door to the WD it got jammed.  In order to release the door, one crewmember put a ladder against the door and started to work. Suddenly he felt that the ladder was moving and the door was falling. The crewmember became stuck in the ladder and broke his leg when the door fell. He was later taken  to hospital, and after two weeks he was flown home.  ","[Primary Annex 1 not designated]","[Primary Annex 1 not designated]","[Primary Annex 1 not designated]","[Primary Annex 1 not designated]","[Primary Annex 1 not designated]","[Primary Annex 1 not designated]","[Primary Annex 1 not designated]","[Primary Annex 1 not designated]","[Primary Annex 1 not designated]","","","","1","","","2009-11-18",""
"C0007506","2","Doris (IMO 9172210), DORIS (IMO 9172210)","Doris: Unknown/unspecified, DORIS: Unknown/unspecified","NOR","2009-04-03 00:00","Serious","474202N 0032104W","Lorient harbour entrance Fairway","1","0","Collision with a channel buoy and striking","Doris loaded with a petroleum product coming from Russia, had a cargo for Lorient harbour where she arrived very early on 03 April 2009 morning.

The ship was at 4:30 (am) hours on the leeward side of Groix Island to embark the pilot. The master was on the bridge. He was assisted by the chief officer and by an AB, both had just taken over the watch.

Considering the very poor visibility, Doris was first driven to a waiting anchorage looking forward to an improvement.

As the visibility was improving significantly, the pilot decided to sail the ship in Lorient port through the western fairway.

Doris was heading to her berth following first the ""les soeurs"" transit bearing. After having  begun to turn from 057° to 016.5°, in order  to steer on "" Ile Saint-Michel"" transit bearing the order ""starboard 20"" given to shift the helm had been wrongly  understood and the helm had been put to the left. Doris came rapidly on port and got out of the buoyed fairway and entangled the buoy chain with her screw. The damage suffered had been actually experienced only when the ship got back in the fairway.

When ""La Citadelle"" was abeam the pilot observed that Doris was not answering correctly to the helm. He then called for the tug Scorff waiting at ""Amiral"" buoy. Doris was not any more manageable, the steering was unpredictable. He stopped the headway abreast of Le Pot a shallow in the south of Le Cochon buoy.

Eventually berthed at the tankers wharf thanks to tugs help, Doris Discharged her refined petroleum product load. Two days, the ship was off in tow heading to Rotterdam in order to have her steering gear and her propeller repaired.

A floating dam had been positioned at the aft of the ship in order to prevent any pollution risk
","TANKER","Ship rendered unfit to proceed","9956","DNV AS (DNV)","16028","","16","","","","","","","","","2009-10-29",""
"C0007676","2","M.V. JIA HUA (IMO 8315231), M.V. VANCOUVER VICTORY (IMO 8010843)","M.V. JIA HUA: Unknown/unspecified, M.V. VANCOUVER VICTORY: SOLAS","PAN,ZZZ","2009-04-02 22:30","Serious","011692N 1035912E","Singapore eastern bunkering anchorage","1","1","Collision","Summary of events: On 02 April 09, the day of the incident, the vessel was receiving diesel oil from a barge, alongside on starboard side and provisions from a supply boat on port side while at Singapore Eastern Bunkering Anchorage-B, Sector-M. Another bunker barge was also approaching the vessel on port to supply Heavy oil. 
At 2230hrs, the OOW who was on the Bridge saw an out bound vessel approaching very close and attempting to pass from port to starboard bow. At this time he flashed signal lamp towards the approaching vessel and after that informed Master of the situation. By the time Master reached Bridge, the other vessel had collided. 
The starboard side gang way area of other vessel had collided with port side fore castle deck of MV Vancouver Victory.
The other ship after collision continued on her way without any concern and response. 
All tank soundings were taken and found no water ingress and all tanks intact. The DPA and the company’s superintendent were informed.
The concerned parties were notified. The vessel was then permitted, by the Class Surveyor, to proceed up to Eastern Anchorage Special Purpose for temporary repairs. After completion of temporary repairs she sailed for port of Jebel Ali on 05 April.   


DAMAGE DETAILS:

1)  POSITION:  A hole on port side shell plating in way of forecastle store between vertical stiffener 4 & 5 from centre line. Port side shell plating in way of anchor hawse pipe found cracked on the upper circumference weld seam. Port side shell plating found indented and internals found buckled from frame 280 to fore end, in way of fore peak store. Port side bulwark from centre line to vertical stiffener 14 from centre line was found damaged. Fore castle deck plate was buckled from 2nd frame to 10th frame from forward end. Fore peak vent head was found broken.     
2) ACTION PLAN:      The vessel was then permitted, by the Class Surveyor, to proceed up to Eastern Anchorage Special Purpose for temporary repairs. After completion of repairs she sailed for port of Jebel Ali on 05 April.   
","","Ship rendered unfit to proceed","35592","Lloyd's Register (LR)","","","22","","","","","","","","","2010-03-23","2012-04-25"
"C0007608","1","WELLSERVICER (IMO 8324579)","WELLSERVICER: Unknown/unspecified","GBR","2009-04-01 17:50","Very serious"," ","3 miles  SE of Aberdeen, Scotland","1","1","Fatal accident","On 1 April 2009, a rigger was working on top of a diving bell in the forward bell hanger on the diving support  ship (DSV) Wellservicer, when the winch for the diving bell's cursor suddenly  rendered, allowing  the cursor to fall on top of him. The rigger suffered severe crush injuries, from which he later died.","Diving Maintenance Support","Loss of life","9158","DNV AS (DNV)","4615","","64","","","[Primary Annex 2 not designated]","[Primary Annex 2 not designated]","[Primary Annex 2 not designated]","[Primary Annex 2 not designated]","[Primary Annex 2 not designated]","[Primary Annex 2 not designated]","2010-01-22","2012-04-25"
"C0008005","1","NORTH KING (IMO 7917862)","NORTH KING: SOLAS","PAN","2009-04-01 00:16","Very serious","414770N 0353847W","At sea from Gibraltar to Point Noire (Canada) OPEN SEA","1","0","Fire or explosion","At 22:20 hrs on April 1, 2009, as the bulk carrier NORTH KING was en route from Gibraltar to Point Noire, Canada (41°47.760’ N and 35°38.47.0’ W), a fire broke out in the engine room. The fire was caused by the spraying of lub oil on the hot surfaces of the aft turbocharger, located between cylinders 5 and 6 of the main engine. 

The fire was fought by the crew members in the engine room using localized fire fighting equipment; however, the fire expanded rapidly, forcing the crew members on-site to evacuate the engine room. In the process, 2 crew members experienced difficulties evacuating the engine room, but eventually managed to leave the engine spaces unharmed. CO2 system was activated at 22:40 hrs. 
During the first moments of the fire-fighting response, the Master of the ship, apparently, suffered a heart attack, which causes his death. At around 23:05 hrs the Chief Officer took over the Master's responsibilities and supervised the fire-fighting operations. 
At 04:00 hrs on April 2, 2009, it was confirmed that the fire was extinguished, and efforts commenced to ventilate the engine room. Power supply was restored at 08:20 hrs and after examination, the vessel headed to Ponta Delgada, Azores, Portugal, at 23:45 hrs. The vessel arrived at Ponta Delgada on April 5, where repairs were carried out, and was declared fit to proceed to sea on April 11, 2009. 
 

","[Primary Annex 1 not designated]","[Primary Annex 1 not designated]","[Primary Annex 1 not designated]","[Primary Annex 1 not designated]","[Primary Annex 1 not designated]","[Primary Annex 1 not designated]","[Primary Annex 1 not designated]","[Primary Annex 1 not designated]","[Primary Annex 1 not designated]","1","","","","","","2010-12-27",""
"C0007594","1","COASTAL DIGGER (-)","COASTAL DIGGER: Unknown/unspecified","NLD","2009-03-30 10:00","Very serious"," ","Lauwersoog, Netherlands","0","0","occupational accident","Vessel used for inspection of underwater pipelines. When vessel goes at anchor, anchor line grabs the foot of a sailor, who falls overboard. Rescue operation does not save his live.

","","Loss of life","","","","","","","","[Primary Annex 2 not designated]","[Primary Annex 2 not designated]","[Primary Annex 2 not designated]","[Primary Annex 2 not designated]","[Primary Annex 2 not designated]","[Primary Annex 2 not designated]","",""
"C0007394","1","FINNEAGLE (IMO 9138006)","FINNEAGLE: Unknown/unspecified","SWE","2009-03-29 07:00","Very serious","602700N 0220500E","Port of Nådendal","2","1","Hull failure / failure of watertight doors / ports, etc.","The Ro-Ro vessel Finneagle was alongside in Naantali, Finland when a large brown discoloration was detected on the ice between the vessel and the dock. After shifting to another berth the 2:nd engineer informed that one day tank with Marine Diesel Oil (MDO) by mistake had been overfilled to the car deck and from there into the sea. 
The engine staff directly began to clear the oil on the car deck. In order to stop further oil to come into the water they listed the vessel by 1° to starboard. 
At departure from the dock,  oil could be seen  in the propeller water and that indicated that an oil spill of MDO had happened. The Chief Engineer estimated that the spill into the water was about 50 liters. He  sent a report to the port authority.
Oil was later also found in the water in Åland's and Åbolands archipelago and  the fairway to Naantali. It was established later that this oil also came from Finneagle and that the spill was approximately 5 000 liters. 
When the vessel came back to Naantali the Master was taken ashore by Finnish police for  interrogation/interview since he was suspected for environmental crime.
","Passenger/Roro Cargo","Pollution","29841","Lloyd's Register (LR)","8383","","28","97","","","","","","","","2009-08-26","2012-04-25"
"C0007376","1","MARIA SOLTIN (IMO 7203699)","MARIA SOLTIN: Unknown/unspecified","XDA","2009-03-29 04:47","Serious","620029N 0050972E","Norwegian Archipelago","2","1","Stranding / grounding","On 29 March 2009 at 04.47 (local time) the Maria Soltin grounded in the Norwegian Archipelago in position 62°00.295 N 005°09.719 E while the ship was approaching Malöy. At the grounding the ship suffered leakage, leading to a drastically list. The crew was evacuated to the rubber lift raft and was subsequently picked up by a rescue ship from Malöy. After having ascertained that the ship would not capsize, the crew re-entered the ship. There was neither personal injury nor pollution","Tanker","","805","","1132","","","","","[Primary Annex 2 not designated]","[Primary Annex 2 not designated]","[Primary Annex 2 not designated]","[Primary Annex 2 not designated]","[Primary Annex 2 not designated]","[Primary Annex 2 not designated]","2009-07-21","2010-08-10"
"C0007521","1","ISLE OF ARRAN (IMO 8219554)","ISLE OF ARRAN: Unknown/unspecified","GBR","2009-03-28 16:51","Serious"," ","Oban","0","0","Stranding / grounding","The inter island ro-ro passenger ferry ISLE OF ARRAN was operating a route on which she was not normally engaged. 
Weather conditions over the preceding two days had been poor and resulted in a disturbed sleep pattern for the crew.
The vessel arrived in port and sailed about five minutes late on the allocated 25 minute turnaround time, with 19 passengers on board.  The bridge organisation consisted of the master on the port bridge wing with the con, the second officer as the officer of the watch, and a quartermaster stood by the helm.  The master manoeuvred the vessel clear of the berth and headed out towards a reef, five cables away, marked by north and south cardinal marks.  Speed was increased to 4 knots.  The second officer was monitoring the master’s actions in case of error and, was responsible for monitoring the vessel’s position. 
The master then instructed that control of engines, bow thrust, and helm, be taken inside the bridge.
Once inside the master stood behind a dirty bridge window, and with the sun directly ahead his vision was obscured and he arranged for the window to be cleaned but became distracted whilst in conversation; speed was increased to 8 knots.  With the window still dirty, but the buoy visual, he then altered course to port with the intention of leaving the reef and the south cardinal mark to starboard.  Inexplicably the turn was stopped early, possibly to counter the effects of leeway, with the buoy still on the port bow.
Fast approaching the reef, the master was alerted to the danger by the second officer who questioned his intentions.
The master immediately recognised the danger and applied full astern pitch and full port thrust.  Unfortunately his actions were too late.  The vessel momentarily grounded on the reef only six minutes after slipping from the berth. 
The vessel suffered substantial hull damage but was able to return to her berth without assistance. 
","[Primary Annex 1 not designated]","[Primary Annex 1 not designated]","[Primary Annex 1 not designated]","[Primary Annex 1 not designated]","[Primary Annex 1 not designated]","[Primary Annex 1 not designated]","[Primary Annex 1 not designated]","[Primary Annex 1 not designated]","[Primary Annex 1 not designated]","","","","","","","",""
"C0007811","1","VIVALDI (IMO 8303329)","VIVALDI: SOLAS","PAN","2009-03-25 08:25","Very serious","331420N 0331130E","East Mediterranean Sea ","1","0","Accidents with life-saving appliances","ON 25.03.2009 M/V VIVALDI WAS AT SEA ON THE WAY FROM ALEXANDRIA EGYPT TO BEIRUT LEBANON.

25.03.2009 08:25 MASTER WAS INFORMED BY THE CH.OFFICER THAT THE FITTER PERERA MANUWELDURA CRISHAN RANDEER HAD A SERIOUS INJURY
08:26 MASTER WENT DOWN AT POOP DECK STRD SIDE AND FOUND THE ABOVE CREW MEMBER VERY SERIOUS INJURED- HIS HEAD WAS BROKEN AND HE WAS IN FULL BLOOD. HE HAD BEEN INJURED BY HEAVY PLATES THAT COVERED HIM AFTER HE UNLASHED THEM IN ORDER TO TAKE A SMALLER PLATE FROM DOWN. HE WAS JUST BREATHING BUT HE WAS IN COMMA

08:28 MASTER CALLED THROUGH MF RADIO TO ALL SHIP'S AND S.A.R CENTERS
      FOR MEDICAL ASSISTANCE POS OF VESSEL 33 14,2 N / 033 11,3 E
08:35 HAIFA RADIO REPLIED AND MASTER ASKED FOR HELICOPTER TRANSPORTATION 
08:40 HAIFA RADIO CONFIRMED THAT HELICOPTER WILL BE AVAILABLE IMMEDIATELY AND MASTER ALTERED COURSE TO HAIFA THAT WAS      93 NM FROM SHIP'S POSITION
08:45 THE INJURED PERSON STOPPED BREATHING AND HIS TEMPERATURE WAS 35,5
      ESTABLISHED RADIO COMMUNICATION WITH THE HELICOPTER BY MF
      RADIO ON FREQ 2649,0 KH / 2225,0 KH AND RECEIVED MEDICAL  ADVICE.
10:25 1 HELICOPTER FROM THE ISRAELI NAVY ARRIVED (POS:LAT 33 05 N   033 39 E)
10:35 2 DOCTORS ON BOARD FROM ISRAELI NAVY. THE CREW MEMBER WAS EXAMINED AND THE DOCTORS CONFIRMED HIS DEATH THAT -AS THEY
      SAID- WAS SOON AFTER THE ACCIDEND
11:00 THE 2 DOCTORS LEFT THE VESSEL BY THE SAME HELICOPTER
      AND THE VESSEL CONTIN. HER COURSE (060 T) AT FULL SPEED TO BEIRUT
","CONTAINER SHIP","Loss of life","9678","Germanischer Lloyd (GL)","12750","","25","","","1","","","","","","2010-06-29",""
"C0008009","1","SHOURONG (IMO 9003615)","SHOURONG: SOLAS","PAN","2009-03-24 13:20","Very serious","011560N 1040000E","SINGAPORE STRAIT","1","0","Accidents with life-saving appliances","Vessel was proceeding at slow speed to Singapore anchorage and was supposed to pick up pilot at PEBG – B at 1400hrs. on 24.3.2009. At about 1300hrs, the crew were asked to rig the pilot combination ladder on starboard side. This ladder was being rigged by: Bosun – Clemente Thomas Jr. Aquino, Cadet – Rijie L D,  OS - Guinguing Raymund Sumagang, OS – Salguero J L.
At 1320LT on 24th March 09 at Posn 01 15.6N 104 00E, While the Pilot Combination ladder was being rigged, OS Guinguing Raymund Sumagang went on bottom platform of the gangway to adjust and connect with Pilot ladder. While he was adjusting, since gangway was not hoisting up, the air motor was taken out to check if it was working satisfactorily. While the air motor was being put back, the gangway suddenly slipped down to about one metre below water level. The O.S fell  and went down with the gangway into sea water. “Manover board” alarm was raised, released stbd MOB Marker buoy. Initially crew rushed to the aft of the vessel to look for the fallen OS, but could not find him in water. However later at 1330 hrs, the Gangway was lifted to water level and O.S  was found submerged in water face down (He was wearing life vest, safety helmet, safety shoes and safety belt which was tied to the gangway at the time of the incident). He was rescued, brought on deck, administered first aid and CPR. Mean while Singapore coast guard and paramedics from shore arrived. The said O.S was taken ashore for further emergency treatment.  But after reaching Chengi General Hospital  at Singapore at about 1600 LT, on 24th March 2009, he passed away
","ORE CARRIER","Loss of life","139668","Nippon Kaiji Kyokai (NKK)","231913","","24","","","1","","","","","","2010-12-28",""
"C0007550","1","STELLAR VOYAGER (IMO 9249180)","STELLAR VOYAGER: Unknown/unspecified","BHS","2009-03-23 22:56","Serious","544190N 0010350W","North east of the entrance to the River Tees, England","1","1","Fire or explosion","On 23 March 2009, the starboard windlass hydraulic motor on board the oil tanker Stella Voyager exploded as the ship was attempting to recover her starboard anchor in adverse weather and sea conditions, off Tees Bay, UK. Fragments of the motor and its casing seriously injured the windlass operator, who was evacuated to hospital in Middlesborough by helicopter, where he was treated for a broken leg and injuries to his groin.","Tanker","Serious injuries","58088","American Bureau of Shipping (ABS)","104801","","28","","","","","","1","","","2009-12-22","2011-03-04"
"C0007349","1","KARIN SCHEPERS (IMO 9404077)","KARIN SCHEPERS: SOLAS","ATG","2009-03-22 09:35","Serious","553944N 0124215E","The Sound","1","1","Stranding / grounding","On 22 March 2009 the container ship KARIN SCHEPERS grounded in The Sound at 09.35 hours LT. The officer on watch had been drinking alcohol and had fallen asleep, and there was no lookout.  The Bridge Navigational Watch Alarm System was switched off. The day after the grounding the ship was refloated and tugged to Copenhagen. The ship suffered minor damages to its underside.","Container Ship","Ship remains fit to proceed","7852","Germanischer Lloyd (GL)","9340","","12","0","0","0","0","0","0","0","0","2009-06-29","2010-08-10"
"C0007673","2","OMEGA THEODORE (IMO 9314179), OURANOS (IMO 8138683)","OMEGA THEODORE: SOLAS, OURANOS: Unknown/unspecified","LBR","2009-03-22 01:03","Very serious","351110N 0562420E","Fujairas Port","0","0","Collision","The incident occurred after disembarking pilot at 00:29 LT on 3/22/2009; OMEGA THEODORE was steering SW in order to leave the port of Fujairah in accordance with the recommended course.  The other vessel, OURANOS (IMO # 8138683) was observed on portside with approximate bearing  at 10:o'clock with all deck lights on. The vessel appeared to be passing clear but subsequently altered course and came in crossing situation.  Due to the deck lights/search lights being on, the navigational light of OURANOS was not visible to OMEGA THEODORE.  The Master of OMEGA THEODORE ordered helm hard to starboard but could not avoid the collision.","TANKER","Ship rendered unfit to proceed","42531","Lloyd's Register (LR)","73673","oil","23","0","0","0","0","0","0","0","0","",""
"C0007325","1","KUO CHANG (IMO 9172313)","KUO CHANG: SOLAS","HKG","2009-03-20 07:37","Very serious","343990N 1351410E","Berth No. PC-18 in Port Island, Kobe, Japan","1","0","mooring accident","When the 15,095gt Hong Kong registered container ship Kuo Chang was berthing at PC-18 berth in Port Island, Kobe, Japan at 07.37 hours LT (UTC+9H) on March 20th 2009, her mooring line broke and hit two line handling workers on shore, killing both of them.","CONTAINER SHIP","Loss of life","15095","American Bureau of Shipping (ABS)","18583","","20","0","0","","","2","","","","2011-04-28",""
"C0007520","1","COSCO HONG KONG (IMO 9227778)","COSCO HONG KONG: SOLAS","GBR","2009-03-20 07:08","Serious","220600N 1145700E","hong kong","0","0","Stranding / grounding","Cosco Hong Kong, a 5500 teu container ship, was on a coastal passage off southern China.  The planned route intentionally avoided busy traffic separation schemes with the master preferring a slightly longer passage, which took the vessel further away from the coast and through a small group of islands.  However, dense concentrations of fishing vessels, some very small, were likely to be encountered throughout the night. 
During the evening, the master calculated that he had some time in hand and decided to stop engines and drift for about 1 hour while in open water in order to save fuel. Passage was then resumed at a speed of 21 knots. The master’s night orders instructed the bridge watchkeeping officers to call him if they required his assistance.
When the chief officer came on watch at 0400, he reviewed the charts to be used and noted the potential danger areas.   Traffic density at that time was fairly light, but gradually increased.  The vessel was being steered by auto pilot and the chief officer was accompanied on the bridge by a lookout. 
By 0600 the numbers of small fishing vessels had increased substantially (Figure) causing the chief officer to make a number of course alterations in order to avoid collision.  The master briefly visited the bridge at around 0630 but, with the chief officer apparently in control of the situation, he soon went below for breakfast. The chief officer was kept busy avoiding small fishing vessels until shortly before 0700 when the numbers encountered started to reduce (Figure). By this time the vessel was approaching the most navigationally constrained part of the passage, with submerged dangers lying 8 cables either side of the planned track. Her speed was still 21 knots and she was to the south of her intended route. The vessel’s position had only been plotted on two occasions between 0600 and 0700, each based on a single radar range and distance.  An ECS was fitted but was only occasionally monitored.
Just when the chief officer thought that he had negotiated most of the traffic in the immediate vicinity, a very small fishing vessel accelerated towards the container ship’s starboard bow.  Constrained by other vessels on the starboard side, the chief officer altered course to port towards a charted reef, which had been highlighted as a danger on the paper chart in use but which the chief officer had forgotten about.  About a minute later, at 0708, the container ship passed over the reef which resulted in the breaching of five of her ballast tanks.
","[Primary Annex 1 not designated]","[Primary Annex 1 not designated]","[Primary Annex 1 not designated]","[Primary Annex 1 not designated]","[Primary Annex 1 not designated]","[Primary Annex 1 not designated]","[Primary Annex 1 not designated]","[Primary Annex 1 not designated]","[Primary Annex 1 not designated]","","","","","","","",""
"C0007651","2","COTAI STRIP COTAIGOLD (IMO 9429704), Leung Yuet Wai (-)","COTAI STRIP COTAIGOLD: Unknown/unspecified, Leung Yuet Wai: Unknown/unspecified","HKG","2009-03-20 03:44","Very serious","221288N 1140097E","Hong Kong","0","0","Collision","1.  At about 0344 on 20 March 2009, the Hong Kong, China registered catamaran passenger ferry COTAI STRIP COTAIGOLD collided with the local open sampan P40707C at Adamasta Channel off Cheung Chau in the position 22°12.88’N  114°00.97’E. 
2.  At the time of the accident, the weather was foggy with a poor visibility of between 0.2 and 0.3 nautical mile (n.m.).  
3.  COTAI STRIP COTAIGOLD sustained minor damage i.e. scratches to the bow of its port hull while P40707C was cut into two pieces after the collision. 
4.  As a result of the collision, the woman on board P40707C fell overboard and was seriously injured. She later died in the hospital.
","Other Activities Ships","Loss of life,Serious injuries,Total loss of the ship","2.01","","","","2","","","[Primary Annex 2 not designated]","[Primary Annex 2 not designated]","[Primary Annex 2 not designated]","[Primary Annex 2 not designated]","[Primary Annex 2 not designated]","[Primary Annex 2 not designated]","",""
