Reference,NumberOfShipsInvolved,ShipsInvolved,SOLASStatus,FlagStates,IncidentDateTime,TypeOfCasualty,Coordinates,Location,NumberOfInvestigationReports,NumberOfAnalyses,InitialEvent,SummaryOfEvents,ShipType1,Consequences1,GrossTonnage1,ClassificationSociety1,Deadweight1,Cargo1,CrewOnboard1,PassengersOnboard1,OthersOnboard1,DeadMissingCrew2,DeadMissingPassengers2,DeadMissingOthers3,SeriouslyInjuredCrew2,SeriouslyInjuredPassengers2,SeriouslyInjuredOthers2,InvestationReportDate,AnalysisDate
"C0006872","1","HERCULES (IMO 8907060)","HERCULES: SOLAS","FRO","2007-04-20 20:55","Very serious","412000S 0791700W","South Pacific Ocean","2","1","Fire or explosion","The fishing vessel HERCULES was a factory trawler of 7805 GT, designed with plants for deep freezing fish. The vessel was built in Spain for Russian flag in 1990 and was purchased from Vanuatu by a Faroese company in February 2007 and registered in the Faroese Register of Shipping together with her sister ship POSEIDON. 

The vessels were fishing with pelagic trawls after horse mackerel in the South Pacific Ocean. The catch was frozen without being processed and stowed into the freezing hold.

There were 116 crew members, technicians and ship’s officers on board, spread over 6 nationalities.

On Friday 20 April, the chief engineer of POSEIDON discovered that two newly in-stalled fixtures for fluorescent tubes had become overheated and begun melting the plastic sockets for the tubes and subsequently the plastic covers of the fixtures. The same type of fixtures had also been installed in HERCULES.
 
The chief engineer switched off the electric power supply for these fixtures and warned his colleague in HERCULES by an E-mail the warning.

On the same evening, a fire broke out on board HERCULES in the hold on 1st deck, where great amounts of plastic and corrugated cardboard packing were stored.

Very dense smoke spread extremely fast all over the vessel and also to the bridge, because a large number of doors and hatches were open, and because a cable shaft was leading not divided into sections from the cargo hold on 2nd deck up to a low space below the bridge.

The fire alarm systems functioned for a very short while and had only a poor effect.

A distress signal was transmitted via VHF to other fishing vessels in the vicinity. Four vessels arrived to give assistance within approximately one hour.

The crew gathered on the forecastle while smoke divers were searching in the accom-modation to get all crew members out.

Due to lack of air supply in their air breathing apparatuses it was necessary to dismiss the smoke divers quickly.

No fire fighting was carried out inside the vessel due to lack of air supply in the air breathing apparatuses.

11 crew members perished due to smoke inhalation.

105 persons were evacuated from the ship to other fishing vessels by the use of the vessel’s life rafts.

The vessel was on fire for approximately three weeks. All processing compartments, cargo spaces, accommodation and other machinery spaces burned out. The engine room remained almost undamaged by the fire. Approximately one month after the fire broke out, the vessel was towed to a Chilean port. It was eventually declared a ‘Total Constructive Loss’.
","Factory fishing","Serious injuries,Ship rendered unfit to proceed,Total loss of the ship","7805","DNV AS (DNV)","5000","frozen fish","116","","","11","0","0","0","0","0","2009-02-20","2010-08-10"
"C0006422","1","ND1379 (-)","ND1379: Unknown/unspecified","VNM","2007-04-20 17:00","Very serious","2134N 10828E","South China Sea","0","0","Stranding / grounding","At 1700 hrs on April 26th, 2007, the Vietnam bulk ship “ND1379”, which loaded 600 tons iron ore, grounded on the reefs nearby the QISHA anchorage, China because she was gone beyond the anchorage. The starboard side of fore peak tank holed, and the fore peak tank and the NO.1 cargo hold foundered, then “ND1379” sank.","","Ship rendered unfit to proceed","","","600","","6","","","","","","","","","",""
"C0006480","1","FLY EAGLE (IMO 8901614)","FLY EAGLE: SOLAS","PAN","2007-04-19 06:34","Serious"," ","Guang Zhou Port in China","0","0","Contact","At about 06.34 on 19th March 2007, as the tank FLY EAGLE was attempting to berth, she made contact with Zhong Shi Hua Xiaohu berth of Guangzhou port. This caused a 6-meters crack at the starboard bow and considerable damage to the berth. The main cause of the accident was that the pilot onboard FLY EAGLE did not properly control the vessel's speed. ","TANKER","Ship rendered unfit to proceed","56020","","98570","","","","","","","","","","","",""
"C0006521","1","MARINE EAGLE (IMO 8301436)","MARINE EAGLE: SOLAS","PAN","2007-04-17 14:50","Less serious","423460N 1325260E","OPEN SEA","0","0","Accidents with life-saving appliances","ON 17TH APRIL 2007 THE MARINE EAGLE'S ENGINE WAS STOPPED AT 14.50 HOURS LT OWING TO BLACK DOWN GENERATION. THIS INCIDENT OCCURRED WHEN THE GENERATOR WAS USED MIXED WITH SOME SEAWATER. C/E CHANGED NEW DO AND TRIED TO START M/E IN SEVERAL TIMES, BUT FAILED.","GENERAL CARGO","Ship rendered unfit to proceed","2758","Nippon Kaiji Kyokai (NKK)","4424","","15","","","","","","","","","",""
"C0006196","1","JANE (IMO 8721002)","JANE: SOLAS","VCT","2007-04-17 04:00","Serious"," ","Off Isohama Fishing port, Yamamoto Cho, Miyagi Prefecture, Japan","0","0","Stranding / grounding","Under the heavy weather, general cargo ship Jane (registered St Vincent and Grenadines, 4643 gt, built 1987), with 17 crews (Russian), ran aground on the shallows off Isohama Fishing port, Yamamoto Cho, Miyagi Prefecture, Japan.
The Japan Coast Guard dispatched the patrol ship and helicopter, and all crew were rescued. But oil spill remained.","GENERAL CARGO","Ship rendered unfit to proceed,Pollution","4643","","5020","","17","","","[Primary Annex 2 not designated]","[Primary Annex 2 not designated]","[Primary Annex 2 not designated]","[Primary Annex 2 not designated]","[Primary Annex 2 not designated]","[Primary Annex 2 not designated]","",""
"C0007089","2","GAS MONARCH (IMO 9151149), WHISPA (-)","GAS MONARCH: Unknown/unspecified, WHISPA: Unknown/unspecified","BHS,GBR","2007-04-16 21:39","Serious"," ","6 miles ESE of Lowestof","1","1","Collision","The Liquefied Petroleum Gas (LPG) carrier, “Gas Monarch”, collided with the sailing yacht, “Whispa”, in dense fog 6 miles ESE of Lowestoft on the evening of 16 April 2007. There were no physical injuries on either ship. There was no damage to Gas Monarch and initial structural damage to Whispa was relatively minor. However, the damage to the yacht worsened due to progressive flooding as she was towed to Lowestoft by a lifeboat.","Liquefied Gas Tanker","","4402","Lloyd's Register (LR)","3800","","16","","","[Primary Annex 2 not designated]","[Primary Annex 2 not designated]","[Primary Annex 2 not designated]","[Primary Annex 2 not designated]","[Primary Annex 2 not designated]","[Primary Annex 2 not designated]","2009-08-10","2010-08-10"
"C0006195","1","SHUNLIAN 9 (IMO 8806280)","SHUNLIAN 9: SOLAS","KHM","2007-04-16 15:30","Serious"," ","At Teizan No.3 wharf, Shiogama, Miyagi Prefecture, Japan","0","0","Fire or explosion","General cargo ship Shunlian 9 (registered Cambodia, 1210 gt, built 1988), with 11 crews (Chinese), had a fire in its cargo of scrap at Teizan No.3 wharf, Shiogama, Miyagi Prefecture, Japan.
The fire was brought under control by the fire service and a patrol vessel. There were no injuries.","GENERAL CARGO","Ship rendered unfit to proceed","1210","","1300","","11","","","[Primary Annex 2 not designated]","[Primary Annex 2 not designated]","[Primary Annex 2 not designated]","[Primary Annex 2 not designated]","[Primary Annex 2 not designated]","[Primary Annex 2 not designated]","",""
"C0006798","1","ALI RIZA DENIZ (IMO 7364819)","ALI RIZA DENIZ: SOLAS","PAN","2007-04-14 09:00","Serious","373960N 0235978E","SOUTH OF LEGRENA BAY (SARONIC GULF)","2","0","Stranding / grounding","On 14th April 2007 the roro cargo ferry ALI RIZA DENIZ was en route from Patras to Istanbul when she ran aground in shallow waters at approximately 09.00 hours LT in the area of Lavrion. The ship was not carrying any cargo at the time, and all five crew members were unharmed. ","Ro-Ro Cargo Ship","","772.21","Turkish Lloyd (TL)","","","","","","","","","","","","2008-09-19",""
"C0006488","2","AUDACITY (IMO 9134751), LEONIS (IMO 9335707)","AUDACITY: Unknown/unspecified, LEONIS: SOLAS","GBR,PAN","2007-04-14 00:00","Serious"," "," River Humber ","2","2","Collision","The Uk registered tanker Audacity was involved in a collision with the Panama registered general cargo Leonis, in poor visibility and in the entrance of the River Humber","General Cargo Ship","Ship rendered unfit to proceed","4649","RINA Services S.p.A (RINA)","6500","Bauxite ore","16","0","0","0","0","0","0","0","0","2009-08-07","2010-08-10"
"C0006360","1","BOURBON DOLPHIN (IMO 9351983)","BOURBON DOLPHIN: SOLAS","NOR","2007-04-12 17:05","Very serious","605920N 0034930W","North sea","2","1","Capsizing / listing","During rigmove of Transocean Rather W of the Shetlands Bourbon Dolphin (BD) capsized to port while deploying anchor chain no 2 in a Northerly direction. The vessel had prior to the capsizing experienced severe difficulties maintaining the intended course. It had deviated in an E direction towards deployed anchor chain no 3, and was at the time of capsizing about 900 m E of intended track/position. Immediately prior to capsizing inner starboard tow pin was lowered and the chain applied its force towards the outer port tow pin. Subsequently the vessel experienced a list of about 20-40° to port for about 15 s before righting itself. Then the vessel listed to port again and capsized. The winch emergency release was active during the final list/capsize.

The wind was at near gale and the surface current has been estimated in excess of 2.5 m/s in E direction. The rig and BD had about 1800 m of anchor chain between them. 

Offshore Tug/Supply Ship Highland Valour (IMO no 9249506) had about 1 hr prior to the capsizing grappled the anchor chain behind BD in an attempt to assist the BD back on intended track. This attempt was, however, unsuccessful and culminated 40 min prior to the capsizing in a near collision between Highland Valour (HV) and BD. During evasive manouvering HV lost its grip on the chain and did not attempt to grapple again.  There is currently no indication that this incident contributed to the capsize of BD some 40 minutes later.

The BD had 14 crewmembers and one passenger (14 y.o.). 7 of the crewmembers and the 14 year old boy were lost. 

BD remained afloat after the capsize. During the rescue operations attempt was made by divers from the UK Coast Guard to enter the hull to search for possible survivors. This was aborted due to safety concerns for the divers. The vessel was examined by Rescue Operator Vehicle (ROV).

At 2116 on 15. of April the vessel sank at about 1100 m depth. The anchor chain had been cut in preparation of the salvage operation and to remove the vessel away from the rig.","TUG/SUPPLY SHIP (O.R.S.V.)","Total loss of the ship,Loss of life","2985","DNV AS (DNV)","2500","N/A","14","1","0","7","1","","","","","2008-07-17","2009-04-28"
"C0006372","1","KOBEE V (IMO 7932903)","KOBEE V: Unknown/unspecified","PAN","2007-04-12 06:20","Very serious","345560N 1291979E","14 MILES FROM BUSAN","1","0","Contact","ON 12TH APRIL 2007 THE VESSEL KOBEE V WAS EN ROUTE FROM FUKUKA TO BUSAN WITH 215 PASSENGERS AND 8 CREW MEMBERS ON BOARD, WHEN SHE STRUCK A WHALE, AT APPROX. 06.20 HOURS LT, 14 MILES OFF BUSAN. AS A RESULT, 0NE PASSENGER DIED AND 27 OTHERS WERE INJURED. KOBEE V SUSTAINED DAMAGE TO THE BOTTOM OF THE VESSEL AND SHE WAS TOWED TO BUSAN PORT. ","HYDROFOIL FERRY","Loss of life,Serious injuries,Ship remains fit to proceed","125","Korean Register (KR)","120","","8","215","","","1","","","1","","2007-10-04",""
"C0007288","1","SICHEM ANELINE (IMO 9171735)","SICHEM ANELINE: Unknown/unspecified","MHL","2007-04-11 17:30","Serious","453860N 0732860W","Port of Montréal, Quebec","1","0","Stranding / grounding","On 11 April 2007 at 17:30 hours eastern daylight time, the ship Sichem Aneline, loaded with benzene, experienced a steering gear malfunction and grounded on the south side of the Pointe-aux-Trembles anchorage in the St. Lawrence River. The ship was refloated on 15 April 2007 and towed to the Port of Montréal. They were no injuries or pollution and the ship sustained only minor damage.","TANKER","Ship rendered unfit to proceed","6202","","8941","","20","","","[Primary Annex 2 not designated]","[Primary Annex 2 not designated]","[Primary Annex 2 not designated]","[Primary Annex 2 not designated]","[Primary Annex 2 not designated]","[Primary Annex 2 not designated]","2009-05-13",""
"C0006137","1","TROPICAL BREEZE (IMO 9256444)","TROPICAL BREEZE: SOLAS","PAN","2007-04-11 15:50","Less serious","205195N 1064150E","HAIPHONG PORT BERTH NO. 4","0","0","collision to berth wall","0100 H - Vessel arrived at Haiphong Anchorage and dropped her port anchor 6 shackles on the water at lat. 20-39.2 N long. 106-52.5 E
1130 H - Tested all navigational and communication system all found in good working condition.
1225 H - Vessel weighs her anchor and proceed to Haiphong Pilot boarding ground at lat. 20-40N Long. 106-51E.
1255 H - the pilot was on board. The Pilot and Masters discussed the manoeuvering plan for berthing and proceed to entrance channel with extreme caution.
1547 H - About 3 cables form Haiphong Berth no. 4 with speed of 6 Knots, stopped her engine and tug boat""Da Tuong"" made fast on her port bow. The current set and drift WSW/2 Knots and wind from SE´ly with beaufort scale of 4.
1548 H- Engine propulsion was reversed to slow astern and bow thurster full to startboard.
1549 H- the vessel still moving ahead, the Master order the Engine ""Full Astern"".
1550 H- The vessel collided on the fender of the berth no. 4 approximatley in position Lat. 20-51.95 N long. 106-41.5 E and engine still in full astern.
1551 H- After she collided on the berth fender and wall, the vessel moved Astern.
1552 H- Stopped Her engine and followed by various manuevers.
1630 H- Vessel safely moored starboard side alongside.
            Inspection carried out and the vessel sustained damage to her port bulbous bow, with approximate measurement of H206 cm x W130cm x inside dented 11 cm including chaffing of paints.
The berth side sustained damage with two vertical rubber fender, the berth wall and surface was partly cracked.","WOOD-CHIP CARRIER","Ship remains fit to proceed","18680","Nippon Kaiji Kyokai (NKK)","21624","","18","","1","","","","","","","",""
"C0006548","1","TAURACAVOR (-)","TAURACAVOR: SOLAS","PAN","2007-04-11 15:35","Very serious","331720N 0775010W","Open Sea","0","0","Capsizing / listing","On 7th April 2007 the dredger ""Tauracavor"" left New York (U.S.A.) for Colon (Panama) towed by the tug ""American Challenger"".
At 10:00 hours EDT on 11th April 2007, whilst en route at approximately 5 kts on a handing of 227 D T with 25-30 kt SSE winds and an Easterly 3 feet swell, the weather began to increase, despite the contrary and mutiple weather forecasts the tug master had obtained earlier that day.
The flotilla hove-to at 11:45 hours with SE winds of 45-50 kts.  At 14:00 hours, the seas increased in size to 10-12 feet, but the flotilla remained stable.
At 14.50 hours, the tug master was notified by his officer on watch that the dredger had begun to list.  The tug master immediately contacted the USCG and his home office, who in turn contacted the dredger owner and alerted a salvage company to begin immediate mobilization.
The dredger appeared to be stable but then rolled to port with a list of approx.  20-25 degrees.  The dredger capsized at 15:35 hours, about  27 miles south of Wilmington- North Carolina (U.S.A.) in approximately 105 feet of water.  There was no indication of any pollution.  Drug test were administered to the master and alternate captain by urine analysis; all tests were negative.
At first the bow section of the dredger remained floating (due to air bubbles), but on 18th April 2007 at approximately 17:00 hours the bow section disappeared beneath the surface and sank towards the sea bed.","Dredger","Total loss of the ship","1259","American Bureau of Shipping (ABS)","","","","","","","","","","","","",""
"C0006151","1","BAHIA BLANCA (IMO 9156589)","BAHIA BLANCA: SOLAS","PAN","2007-04-11 02:44","Less serious","082241N 0624053W","ORINOCO RIVER","0","0","Stranding / grounding","The vessel loaded a part of cargo (36,760LT of Iron Ore in Bulk) at Puerto Ordaz and left there at 0200 hours LT on 11 April 2007 with a harbour pilot and a river pilot. The harbour Pilot left her at 0231 hours LT.

En route to next loading place (Boca Grande Transfer Station), the river pilot wrongly kept the buoy no. 180.5 (Green Light) in Orinoco River with her port side and the vessel missed the traffic route and went aground at 0244 hours LT on 11 April 2007 at lat 08°22.41N, long 062°40.53W, Near Buoy 180.5 in Orinoco River.

The vessel could not refloat by her own engine even with assistance of tug boats. After lightering 2,168LT of the cargo, the vessel refloated by her own engine even with assistance of tug boats at 0558 hours LT on 22nd April 2007.

There was no secondary consequence such as human injury, marine pollution and no apparent damage to the vessel.","BULK CARRIER","Ship remains fit to proceed","38477","Nippon Kaiji Kyokai (NKK)","74043","","20","","1","","","","","","","",""
"C0006293","1","SCAN FJELL (IMO 7700609)","SCAN FJELL: SOLAS","XDA","2007-04-11 02:00","Serious","580000N 0073000E","Mannefjorden","1","0","Stranding / grounding","On 11th April 2007 the ceneral cargo ship SCAN FJELL was en route from Aalborg, Denmark, to Mandal, southern part of Norway, loaded with building materials and fish food.
Just prior to arrival in Mandal, at 02.00 hours LT, the vessel made a sharp turn and grounded on a small island. Approximately 12 hours later the vessel was re-floated by 2 tugs and brought alongside in Mandal. The vessel sustained leaks in the forepeak tank, the bowthruster room and the No. 1 starboard ballast tank.  

","GENERAL CARGO","Ship remains fit to proceed","2195","DNV AS (DNV)","1376","fish food and building material","8","0","0","","","","","","","2007-08-29",""
"C0006426","1","MSC SONIA (IMO 7111999)","MSC SONIA: SOLAS","PAN","2007-04-10 09:45","Less serious","374880S 1445490E","MELBOURNE, EAST SWANSON DOCK, BERTH N01","1","0","CASUALTY NOT NAMED ABOVE","A SEAMAN SUSTAINED STEAM BURN INJURIES WHEN WORKING ON THE FUNNEL TOP ON 10th APRIL 2007 AT ABOUT 0835 LT.

HE SUSTAINED HEAVY BURNS WHEN HE WAS PAINTING THE FUNNEL EXHAUST UPTAKES. STEAM WAS RELEASED DURING THE BOILER SURVEY WHICH WAS TAKING PLACE IN THE ENGINE ROOM. THE BOSUN WAS WORKING ALONG WITH THE O.S. ON THE FUNNEL BUT ESCAPED UNHURT AS HE WAS ON THE OTHER SIDE OF THE FUNNEL OPENING.

THE SEAMAN WENT TO MELBOURNE HOSPITAL, AND RECEIVED TREATMENT FOR HIS INJURIES AT THE TIME OF SUBMISION OF THIS REPORT.
VESSEL ANCHORED AT MELBOURNE INNER ANCHORAGE OF THE 08th AFTERNOON. PAINTING OF FUNNEL EXHAUST UPTAKES WAS PLANNED FOR AT THE ANCHORAGE BUT DUE OTHER JOBS, THIS WORK GOT DEFERRED FOR ALONGSIDE BERTH. ON THE 09th/1936LT VESSEL BERTHED & CARGO WORK WAS COMMENCED ON 09th/2300LT. O/S ASSISTED IN CARGO WATCH TILL 09th/2400LT AFTER WHICH HE WENT FOR REST. HE AGAIN REPORTED FOR WATCH ON 10th/0600LT. AS PLANNED, BOSUN TOOK UP THE JOB OF PAINTING FUNNEL EXHAUST UPTAKES FOR WHICH HE WAS ASKED TO TAKE AN ADDITIONAL CREW FROM CARGO WATCH DUTY AFTER ASKING DUTY OFFICER. THE VESSEL´S BOILER WAS SCHEDULED TO BE SURVEYED BY CLASS-GL FOR WHICH SURVEY BOARDED AT 0900HRS ON 10th.
AT THIS TIME CHIEF OFFICER WAS NOT AWARE OF THIS BOILER SURVEY. GL-SURVEYOR AFTER DISCUSSING ABOUT THE SURVEY WITH CHIEF ENGINEER, LEFT MASTER´S CABIN FOR ENGINE ROOM. AT AROUND 0945LT, THE OIL FIRED BOILER STEAM PRESSURE WAS RAISED FOR TESTING OF THE SAFETY VALVE AS REQUIRED BY THE SURVEYOR. ENGINEERS WERE NOT AWARE THAT CREW WERE PAINTING THE FUNNEL EXHAUST UPTAKES. WITH THE LIFTING OF BOILER SAFETY VALVE, STEAM WAS RELEASED WHICH VENTED ON THE FUNNEL TOP WHERE CREW WERE PAINTING THE EXHAUST UPTAKES. VENTING OF THIS STEAM CAUSED SEVERE BURNS TO THE O/S.","CONTAINER SHIP","Serious injuries","50646","Germanischer Lloyd (GL)","35280","","31","","","","","","1","","","2008-08-14",""
"C0007540","1","CAMLIN STAR (-)","CAMLIN STAR: Unknown/unspecified","","2007-04-09 00:00","Serious"," ","Banacher, Co. Offaly","1","0","Collision","On the afternoon of 9th April 2007 the pleasure craft ""Camlin Star"" collided heavily with the Carrick jetty at Banagher, Co.Offaly.

As result of this collision, one person was thrown backwards and suffered back injuries.

The ship was holed above the waterline on the starboard bow, No pollution was caused.
","","Serious injuries","","","","","8","","","[Primary Annex 2 not designated]","[Primary Annex 2 not designated]","[Primary Annex 2 not designated]","[Primary Annex 2 not designated]","[Primary Annex 2 not designated]","[Primary Annex 2 not designated]","2009-12-08",""
"C0006452","2","HARVEST (IMO 8201026), JIN HAI KUN (IMO 8817320)","HARVEST: SOLAS, JIN HAI KUN: SOLAS","BLZ,CHN","2007-04-08 04:01","Very serious","281990N 1220270E","East China Sea","1","1","Collision","At 0401 on April 8th 2007.The vessel HARVEST of KAIlAI TOYOSAWA CO.(HK) collided with the vessel JINHAIKUN of FUJIAN SHIPPING COMPANY at southeast sea of nine miles from DACHEN island. MV HARVEST sunk and twenty seamen were missing, bow of the vessel JINHAIKUN damaged.","General Cargo Ship","Ship remains fit to proceed","17061","China Classification Society (CCS)","27887","","13","0","0","20","0","0","0","0","0","2008-10-08","2014-08-11"
"C0006194","2","EIFUKU MARU NO.7 (-), YINHE NO. 1 (IMO 8811089)","EIFUKU MARU NO.7: Unknown/unspecified, YINHE NO. 1: SOLAS","JPN,KHM","2007-04-07 05:17","Very serious"," ","Off Susami Cho, Wakayama Prefecture, Japan","1","1","Collision","General cargo vessel Yinhe No.1 (registered Cambodia, 1,592 gt, built 1988), with 10 crew (Chinese), and general cargo vessel Eifuku Maru No.7 (313 gt, built 1984), with 4 crew (Japanese), were in collision off Susami Cho, Wakayama Prefecture, Japan.
Although Yinhe No.1 sustained cracking damage to its port bow and bulbous bow resulting in water ingress, it could navigate under its own power. There were no injuries among the 10 Chinese crewmen on board.
Eifuku Maru No.7 sank, leaving 1 crew missing.
The Japan Coast Guard dispatched five patrol boats. An oil slick from the Eifuku Maru No.7 remained near the accident site.","AGGREGATES CARRIER","Ship remains fit to proceed","1592","","1255","","10","","","","","","","","","2008-04-24","2010-08-10"
"C0006112","1","SEA DIAMOND (IMO 8406731)","SEA DIAMOND: SOLAS","GRC","2007-04-05 16:00","Very serious"," ","Santorini, Greece","0","0","Stranding / grounding","The Sea Diamond, a Greek-flagged passenger cruise ship, hit a reef near the port of Santorini late Thursday 05 April, and sank at dawn on Friday, 6 April 2007.  In total, 1156 passengers and 391 crew were on board at the time of the collision.  All but the two passengers, whom were unaccounted for, were  evacuated and removed to safety. An oil slick approximately 100 m wide appeared on Thursday, in the aftermath of the collision.  An immediate response was launched and all the initial oil was recovered.   A remotely operated submarine was launched, in an attempt to locate the two lost passengers, as well as to conduct an overall assessment of the current state of the sunken vessel.  Estimates indicate that some 50 tonnes of oil have leaked out.  In spite of clean-up efforts have been 2 km of pebbled shoreline has been oiled on Santorini.  ","Cruise Passenger Ship","Loss of life,Pollution,Total loss of the ship","22412","","1825","","391","1156","","","2","","","","","",""
"C0007721","1","ASTORIA (IMO 8000214)","ASTORIA: Unknown/unspecified","BHS","2007-04-05 10:30","Very serious"," ","Kerkyra, Corfu","0","0","Accidents with life-saving appliances","On 5th April 2007 the passenger ship ASTORIA was at berth at Kerkyra conducting a fire and abandon ship drill. The starboard lifeboats were lowered to the water in succession, but as  No. 7 lifeboat was lowered the bowsing tackles secured and the tricing pennants released. As the bowsing tackles were being released the aft davit detached from the guides and the boat fell to the vertical position, secured to the damaged davi by the aft falls. Five crew in the boat were immediately rescued, and four of them recovered from the injuries received, but one crew member was fatally wounded.","PASSENGER","Loss of life","18591","Germanischer Lloyd (GL)","3245","","","","","[Primary Annex 2 not designated]","[Primary Annex 2 not designated]","[Primary Annex 2 not designated]","[Primary Annex 2 not designated]","[Primary Annex 2 not designated]","[Primary Annex 2 not designated]","",""
"C0006123","1","CELTIC AMBASSADOR (IMO 8917417)","CELTIC AMBASSADOR: Unknown/unspecified","GBR","2007-04-05 03:30","Serious","422850N 0154440E","AT SEA","0","0","Machinery damage","MaK 8M453C medium speed main engine, cylinder #8 piston broke in operation.  The vessel had to be towed ashore for repairs.  On examination it was found that the 4 bolts holding the piston crown and piston skirt together, had come undone and this caused the skirt to drop down causing the engine to seize.  ","GENERAL CARGO","Ship rendered unfit to proceed","3739","","5788","","","","","[Primary Annex 2 not designated]","[Primary Annex 2 not designated]","[Primary Annex 2 not designated]","[Primary Annex 2 not designated]","[Primary Annex 2 not designated]","[Primary Annex 2 not designated]","",""
