Reference,NumberOfShipsInvolved,ShipsInvolved,SOLASStatus,FlagStates,IncidentDateTime,TypeOfCasualty,Coordinates,Location,NumberOfInvestigationReports,NumberOfAnalyses,InitialEvent,SummaryOfEvents,ShipType1,Consequences1,GrossTonnage1,ClassificationSociety1,Deadweight1,Cargo1,CrewOnboard1,PassengersOnboard1,OthersOnboard1,DeadMissingCrew2,DeadMissingPassengers2,DeadMissingOthers3,SeriouslyInjuredCrew2,SeriouslyInjuredPassengers2,SeriouslyInjuredOthers2,InvestationReportDate,AnalysisDate
"C0009370","4","BRAVE (-), FORTUNE CLOUD (IMO 8103846), KINDA (IMO 8217697), MYCENAE (IMO 9557135)","BRAVE: Unknown/unspecified, FORTUNE CLOUD: SOLAS, KINDA: Unknown/unspecified, MYCENAE: Unknown/unspecified","MHL,PAN","2013-09-09 23:45","Very serious","221580N 0914400E","ANCHORAGE, CHITTAGONG PORT","2","1","Collision","Sep 9 -- Bulk carrier Fortune Cloud (20432 gt, built 1983) was in contact with bulk carrier Abdullah (26070 gt, built 1996) at the Alpha Anchorage of Chittagong port, at around midnight of Sep 9. Both vessels incurred damage with the Fortune Cloud sustaining a ruptured bottom hull and water ingress to its engine-room. Crews of both vessels are safe. Authorities said that navigation at Chittagong port was not affected by the accident.","Bulk Carrier","Ship rendered unfit to proceed,Total loss of the ship","20432","Isthmus Bureau of Shipping, S.A. (IBS)","34070","","21","","","[Primary Annex 2 not designated]","[Primary Annex 2 not designated]","[Primary Annex 2 not designated]","[Primary Annex 2 not designated]","[Primary Annex 2 not designated]","[Primary Annex 2 not designated]","2014-07-08","2018-12-03"
"C0009861","1","LUNA-S (IMO 7361491)","LUNA-S: Unknown/unspecified","XVA","2013-09-08 08:25","Very serious","372900N 0061400E","50 MILES NORTHEAST OF JIJEL, ALGERIA ","0","0","Fire or explosion","CAUGHT FIRE IN ACCOMMODATION BLOCK IN THE WESTERN MEDITERRANEAN SEA 50 MILES NORTHEAST OF JIJEL, ALGERIA IN LAT. 37 29N., LONG. 006 14E., AT 0825 HOURS LT ON 08/09/13. DAMAGED BEYOND ECONOMICAL REPAIR.
ALL 8 CREW ATTEMPTED TO ESCAPE BUT RESCUED AND DETAINED BY FRENCH NAVY FRIGATE 'COMMANDANT BIROT'. NO INJURIES REPORTED. ALGERIAN SAR FORCES ASSISTED IN DOUSING THE BLAZE. ARRIVED AT TOULON, FRANCE ON 12/09/13 IN TOW OF TUG 'ABEILLE FLANDRE' FOR INSPECTION. REPORTED CREW INTENTIONALLY SET FIRE TO VESSEL WHEN INTERCEPTED BY THE FRENCH AUTHORITIES. 20 TONS OF CANNABIS SUBSEQUENTLY DISCOVERED ON BOARD. SUSTAINED SEVERE FIRE DAMAGE.","General Cargo Ship","Total loss of the ship","1990","","1530","","","","","[Primary Annex 2 not designated]","[Primary Annex 2 not designated]","[Primary Annex 2 not designated]","[Primary Annex 2 not designated]","[Primary Annex 2 not designated]","[Primary Annex 2 not designated]","",""
"C0009912","1","ZHONG YANG 26 (IMO 9671773)","ZHONG YANG 26: Unknown/unspecified","CHN","2013-09-08 00:00","Very serious","271700S 1442000W","20 MILES NORTH OF RAPA ISLAND, FRENCH POLYNESIA","0","0","Capsizing / listing","CAPSIZED AND SUBSEQUENTLY SANK IN THE SOUTH PACIFIC OCEAN 20 MILES NORTH OF RAPA ISLAND, FRENCH POLYNESIA IN LAT. 27 17S., LONG. 144 20W., AM ON 05/08/13 IN HEAVY WEATHER.
FRENCH NAVY HU-25 AIRCRAFT LOCATED THE VESSEL THE SAME EVENING AND DROPPED 2 LIFERAFTS. A NAVAL AS-365 HELICOPTER AIRLIFTED 5 CREW OFF THE SINKING VESSEL AND A 6TH CREW MEMBER WAS RESCUED FROM THE WATER SUFFERING FROM HYPOTHERMIA. ALL SURVIVORS TAKEN TO HOSPITAL IN RAPA. 4 DEAD BODIES SIGHTED IN WATER AND 4 CREW MISSING. VESSEL INITIALLY CAPSIZED ONTO STARBOARD SIDE AND SUBSEQUENTLY SANK IN THE EVENING OF THE FOLLOWING DAY.","Fishing Vessel","Loss of life,Total loss of the ship","317","","","","","","","8","","","","","","",""
"C0009862","1","GOLD STAR (IMO 7393860)","GOLD STAR: Unknown/unspecified","XVA","2013-09-06 16:20","Very serious","362000N 0145000E","35 MILES NORTHEAST OF MALTA","0","0","Fire or explosion","CAUGHT FIRE IN SUPERSTRUCTURE IN THE MEDITERRANEAN SEA 35 MILES NORTHEAST OF MALTA IN LAT. 36 20N., LONG. 014 50E., AT 1620 HOURS LT ON 06/09/13. SUBSEQUENTLY BEACHED AT ALIAGA, TURKEY ON 12/02/14 FOR BREAKING UP.
ALL 9 CREW JUMPED OVERBOARD AND WERE RESCUED BY ITALIAN COAST GUARD. NO INJURIES REPORTED. 3 MALTESE ARMED FORCES VESSELS ASSISTED WITH FIREFIGHTING. REPORTED THAT CREW INTENTIONALLY STARTED FIRE TO DESTROY CARGO OF 30 TONS OF CANNABIS TO AVOID ARREST BY AUTHORITIES FOR DRUG TRAFFICKING. BLAZE EXTINGUISHED AND TOWED TO POZZALLO, SICILY BY TUG 'NOS TAURUS' FOR INSPECTION. SUSTAINED SEVERE DAMAGE TO SUPERSTRUCTURE. ","General Cargo Ship","Total loss of the ship","2438","","2105","","","","","[Primary Annex 2 not designated]","[Primary Annex 2 not designated]","[Primary Annex 2 not designated]","[Primary Annex 2 not designated]","[Primary Annex 2 not designated]","[Primary Annex 2 not designated]","",""
"C0010466","1","FROMVEUR II (IMO 9588134)","FROMVEUR II: Unknown/unspecified","FRA","2013-09-03 10:30","Less serious","482434N 0045714W","Coastal waters <= 12 nm","2","0","Stranding / grounding","As the M/V FROMVEUR II was approaching the port of Molène Island with a poor visibility, she grounded near the entry of the fairway. A small flooding in the engine room was quickly controled by the ship’s bilge system. She was re-floated about 2 hours later by her own means, after the landing of all the passengers (361 persons).","Passenger / General Cargo Ship","Ship rendered unfit to proceed","774","Bureau Veritas (BV)","","Solid cargo - Containers","8","361","0","","","","","","","2016-11-23",""
"C0012332","1","EL NENE (-)","EL NENE: Unknown/unspecified","ESP","2013-09-03 01:00","Very serious","363520N 0022880W","Coastal waters (within 12 miles)","3","0","Fire or explosion","The fishing boat ""EL NENE"" sank because of a fire ocurred inside the engine roo, while was towing.A person died as a consecuence of drowning during the abandon of the boat.","Fish Catching Vessel","Loss of life,Pollution,Ship rendered unfit to proceed","85.73","","","","","0","","1","0","0","0","0","0","2019-10-22",""
"C0009863","1","XIANG HE (IMO 8318013)","XIANG HE: Unknown/unspecified","CHN","2013-08-31 08:30","Very serious"," ","70 MILES EAST OF FUZHOU, CHINA ","0","0","Hull failure / failure of watertight doors / ports, etc.","SUSTAINED STEERING FAILURE IN THE EAST CHINA SEA 70 MILES EAST OF FUZHOU, CHINA IN LAT. 26 05N., LONG. 120 29E., AT 0830 HOURS LT ON 31/08/13. DAMAGED BEYOND ECONOMICAL REPAIR AND SUBSEQUENTLY SOLD FOR BREAKING UP.
TUGS 'DONG HAI JIU 112' AND '113' PROCEEDED TO ASSIST AND EFFECTED TOW TO DONGGANG, CHINA FOR CARGO DISCHARGE AND INSPECTION. SUBSEQUENTLY TOWED TO FUJIAN XINYUAN SHIPBUILDING YARD, NINGDE, CHINA WHERE ARRIVED ON 05/09/13 TO AWAIT SALE FOR DEMOLITION.","Container Ship (Fully Cellular)","Total loss of the ship","24043","","30940","","","","","[Primary Annex 2 not designated]","[Primary Annex 2 not designated]","[Primary Annex 2 not designated]","[Primary Annex 2 not designated]","[Primary Annex 2 not designated]","[Primary Annex 2 not designated]","",""
"C0012399","1","VALLE DE ELDA (-)","VALLE DE ELDA: Unknown/unspecified","ESP","2013-08-29 01:00","Very serious","382560N 0004840E","Open sea","1","0","Fire or explosion","On 29 August 2013, at 12:00, a fire was detected in the fishing boat VALLE DE ELDA, while sailing to her port of registry, SANTA POLA. Initially, the fire was focused in the chimney located in the aft area on the port side, but quickly spread to the rest of the boat. After giving notice of the emergency through VHF Channel 16 to SASEMAR, its 11 crew members threw themselves into the water. Eleven of them managed to reach the liferaft and were picked up by a recreational sailingboat, another failed to reach it and floated with the help of a lifeboat, being rescued by the rescue helicopter HELIMER 207. One of the crew had burns and other, symtoms of hypotermia. The fishing boat sank. It was not possible to conclude on the basis of the information available the causes of the fire in the ship.","Fish Catching Vessel","Serious injuries,Ship rendered unfit to proceed,Total loss of the ship","100.88","","","","12","0","0","0","0","0","2","0","0","2019-10-25",""
"C0012717","1","Scuderia (-)","Scuderia: Unknown/unspecified","FRA","2013-08-28 01:00","Serious","500037N 0050793W","Coastal waters (within 12 miles)","1","0","Stranding / grounding","On August 28, 2013 around 23:00 (GMT + 2), the fishing vessel SCUDERIA of the armament Eouzan Travadon, on his way to reach his fishing grounds, stranded on the shores of theEnglish Cornwall. The ship has various cracks on the works, including a crack in the front diesel fuel tank which lets out about 10 000 liters of diesel fuel causing a marine pollution without any significant impact on the marine environment.No injuries are to be deplored.The ship remains aground five days, then returns to the ports of Falmouth then Boulogne-sur-Mer in tow for repairs. After expertise, it will finally be destroyed.","Fish Catching Vessel","Pollution,Ship rendered unfit to proceed","113.84","","","","5","0","0","0","0","0","0","0","0","2020-02-17",""
"C0010087","1","THISSEAS (IMO 9493896)","PLATA FEEDER: Unknown/unspecified, THISSEAS: Unknown/unspecified","LBR","2013-08-25 23:10","Less serious","342900S 0582200W","Parana River","0","0","Collision","On August 25, 2013, M/V THISSEAS departed San Lorenzo and was Port bound for Rotterdam. At approximately 23:10 LT, PLATA FEEDER (Paraguay Flag, IMO No. 7822524), heading upstream the Parana River (Argentina), collided with THISSEAS as the vessel (THISSEAS) was heading downstream. THISSEAS sustained damage to bow, port and starboard side hull shell plating, and port side pilot’s combination ladder. PLATA FEEDER ran aground and sustained holes with ensuing water ingress. The collision neither produced personal injuries nor the environmental pollution.","Bulk Carrier","Ship remains fit to proceed","41101","Bureau Veritas (BV)","75200","","","","","[Primary Annex 2 not designated]","[Primary Annex 2 not designated]","[Primary Annex 2 not designated]","[Primary Annex 2 not designated]","[Primary Annex 2 not designated]","[Primary Annex 2 not designated]","",""
"C0010539","1","CMA CGM PEGASUS (IMO 9399210)","CMA CGM PEGASUS: Unknown/unspecified","MLT","2013-08-24 18:53","Very serious","390043N 1215211E","Internal waters - Port area","1","0","Other","On 24 August 2013, at about 1853, an able seaman (AB) was struck by a mooring rope during unberthing operations on board the Maltese registered container vessel CGM CMA Pegasus. The AB suffered a serious injury to the back of his head and was taken to a nearby hospital. He succumbed to his injury later during the night due to excessive bleeding.

The safety investigation was unable to determine as to how the mooring rope jumped off the roller guide and caused the accident. However, a number of safety factors were identified, including incorrect procedures, inadequate supervision and inadequate risk management during the mooring operations. The safety investigation also concluded that the ergonomics at the forward mooring station had contributed to the accident.","Container Ship","","131332","Bureau Veritas (BV)","131268","","29","0","0","1","0","0","0","0","0","2017-02-15",""
"C0010116","1","FAVORITA (IMO 9298519)","FAVORITA: SOLAS","NOR","2013-08-24 09:20","Very serious","264500N 1230300E","Open sea - Outside EEZ","1","1","Other","The MV Favorita had been discharging salt in China, and was en route to Japan for loading cement clinker when the accident happened.
Prior to commencement of work on the 24th August, a safety meeting including safe job analysis in connection with cleaning of the cargo holds was conducted.  Both the deck- and engine crew which was involved in the cleaning operation was participating. The meeting included a check of the personal protecting equipment as well as a discussion regarding the upcoming job, which method and equipment to be used, and risks involved in the cleaning operation.
The engine crew was responsible for the cleaning cargo hold number five, in accordance with the routines of the company. The crew entered the cargo hold via a protected, fixed ladder in the forward part of the cargo hold, and started the preparations for work. Two men were in the cargo hold, while one man was situated on deck by the hatch coaming to assist with lowering equipment, regulating the water supply to the high pressure machine etc. The crew had hand held radios for communications. 
During the cleaning process, the motorman was standing in a portable aluminum ladder operating the high pressure machine; one man was supporting the ladder and controlling the safety line, while the third crewmember was occupied with miscellaneous tasks. Shortly after nine o’clock, an additional man from the engine crew entered the cargo hold to assist with the cleaning procedure. He started to assemble scaffoldings for use when cleaning the forward and aft bulkheads.
After completion of cleaning one part of the bulkhead the motorman moved down the ladder in order to move the ladder to the next position. The engineer which supported the ladder had to move to the side in order to give way for the motorman on his way down. Just about one meter before he reached the tank top, the motorman raised and disconnected the safety line from the harness. The engineer shouted to him to inform him he should wait as he was not yet down in a safe position. At the same time the motorman suddenly fell backwards. His safety helmet fell of just before the back of his head hit the tank top. The accident happened at approximate 0920 local time.
The engineer noticed that the motorman was unconscious and was bleeding from the back of his head. He supported the head and shoulders of the motorman in his lap in order to try to stop the bleeding. At the same time the engineer called the rest of the crew in the cargo hold for attention, and to get assistance and inform the rest of the crew about the accident.
The master was out on deck at the time of the accident when he heard the call on the radio that one crew member fell and got injured in cargo hold number five. Together with one other crew member, he immediately climbed down in the cargo hold. Some of the crew brought down a resuscitator from the hospital and commenced first aid procedures. After a while a mobile stretcher with neck stabilizer was lowered down in the hold. The motorman was transferred to the stretcher, strapped and hoisted from the cargo hold. The crew used manpower, rope and blocks in order to hoist the injured motorman from the cargo hold, as the master decided not to use the ships cranes due to some swell.
After they brought the motorman up on deck, he was transferred to the ships hospital where he got oxygen supply and the crew monitored the pulse and blood pressure of the injured motorman.
In the meantime the master contacted the company’s emergency telephone number, and at 1001 the master contacted the nearest coastal radio station which was Keelung in Taiwan, China. Keelung CRS relayed the master to NRCC Taiwan, China were helicopter rescue was ordered. The master changed the ship’s course in order to shorten the distance for the helicopter.
The helicopter arrived at 1141, and 1157 the injured motorman was transferred to the helicopter by hoisting him in the ship’s stretcher. The helicopter headed for shore, and landed at the base at 1250. The motorman was transferred from the helicopter base to the hospital by ambulance. At 1529 the hospital reported the motorman was declared deceased.","Bulk Dry (general, ore) Carrier","Loss of life","30078","","","","","0","","1","","","","","","2015-12-07","2018-12-03"
"C0009691","1","Ocean Elite (IMO 9561825)","Ocean Elite: Unknown/unspecified","IND","2013-08-23 15:15","Very serious","093500N 0760800E","Kochi port area","0","0","Missing: assumed lost","Tug Master fell over board while crossing from MV Ocean Symphony to MV Ocean Elite which were double banked with one another. Immediately, two life bouys were thrown into water and search and rescue operation launched with the help of port crafts. However, the missing person could not be located. After 3 days, the mortal remains of the person were found floating in the port area.","Bulk Carrier","Loss of life","468","Indian Register of Shipping (IRS)","","","10","","","1","","","","","","",""
"C0009981","1","SHARP LADY (IMO 9577044)","SHARP LADY: SOLAS","IMN","2013-08-23 10:39","Very serious","110000S 1080000E","Eastern Indian Ocean","1","1","enclosed space entry fatality","On the 23rd August 2013 it was decided to enter the cargo tank to retrieve the broken sampler. The Chief Officer and Cadet entered the cargo tank after an Enclosed Space Work Permit and Risk Assessment had been completed. When the Chief Officer and Cadet reached the bottom of the cargo tank they felt debilitating effects of hydrocarbon vapour present at the lower level of the cargo tank. Both the Chief Officer and Cadet attempted to activate their Emergency Escape Breathing Devices and exit the cargo tank. The Master observed the Cadet in difficulty and quickly entered the tank ignoring the advice of a fellow crew member. The Chief Officer successfully exited the cargo tank but the Cadet had collapsed unconscious on the tank bottom. When the Master reached the tank bottom to aid the Cadet he was overcome by hydrocarbon vapour and collapsed.
The alarm was raised and a rescue was quickly initiated. The Master and Cadet were retrieved from the bottom of the cargo tank and brought to the main deck were first aid was administered.
The report concludes that the Master died and the Cadet was injured as a result of entering the cargo tank containing a concentration of hydrocarbon vapour at the bottom of the cargo tank. The ship’s safety procedures for enclosed space were not fully complied with and the risk posed by the hydrocarbon vapour measured in the cargo tank was not appreciated by those involved in the tank entry preparations.","Crude Oil Tanker","Loss of life,Ship remains fit to proceed","64089","Lloyd's Register (LR)","116619","oil","","","","1","","","2","","","2015-06-18","2017-12-04"
"C0010767","1","CAPTAIN PETROS H. (IMO 9426415)","CAPTAIN PETROS H.: Unknown/unspecified","GRC","2013-08-23 09:55","Very serious","023039S 0442136W","Internal waters - Channel, river","1","0","Other","On 23rd of August 2013, at PONTA DA MADEIRA anchorage - BRAZIL, the 3rd Engineer of M/V ""CAPTAIN PETROS H"", Philippine national, opened the manhole cover of waste oil tank No 2 in order to repair the tank's gauge. Hot oil from the tank splashed and covered his body resulting to second degree burns. By noon same day he was transferred to local hospital by helicopter where he remained hospitalized until 4th of September 2013 when he passed away.","Bulk Dry (general, ore) Carrier","Loss of life","91499","Lloyd's Register (LR)","","","24","0","","1","0","0","0","0","0","2019-11-25",""
"C0012639","2","La Pelle Admiral 2 (-), Nidagas 3 (-)","La Pelle Admiral 2: Unknown/unspecified, Nidagas 3: Unknown/unspecified","FRA","2013-08-23 01:00","Very serious","431662N 0051898E","Coastal waters (within 12 miles)","1","0","Collision","An inflatable pleasure boat, sailing at high speed in the wake of a small passenger ship, steered suddenly to starboard out of the wake and collided with another inflatable one sailing at the same course as the passenger ship. Two women passengers of the second ship were violently hit by the hull of the first one and thrown in the sea. They were evacuated by the rescue boat to the hospital. One of them died shortly after.","Other Activities Ships","Loss of life,Serious injuries,Ship remains fit to proceed","","","","","1","7","","0","1","0","0","1","0","2020-02-14",""
"C0010544","1","BSLE Teresa (IMO 8609620)","BSLE Teresa: Unknown/unspecified","MLT","2013-08-22 04:10","Serious","533159N 0095906E","Internal waters - Port area","1","0","Other","On 22 August 2013, at about 0410, one of the oilers on board the general cargo vessel BSLE Teresa suffered from serious burns in the chest area and thoracic cavity. 

The oiler was checking the status of the water level in the cascade tank soon after he arrived in the engine- room.  Unable to locate the meniscus on the sight glass, he eventually came to the conclusion that the cascade tank could have run dry.  He therefore decided to open slightly one of the three dome covers on the top of the cascade tank to determine the water level. 

As soon as he cracked open the dome cover, hot condensate water (at about 80°C) escaped from the opening and spilled over the oiler.","General Cargo Ship","Serious injuries","6500","RINA Services S.p.A (RINA)","8914","","17","0","0","0","0","0","1","0","0","2017-02-17",""
"C0009111","2","Modris (-), MSF3 (-)","Modris: Unknown/unspecified, MSF3: Unknown/unspecified","DNK,LVA","2013-08-21 12:30","Less serious","554221N 0210743E","port of Klaipeda","0","0","Contact","Because the tug "" Modris "" master was not on the tug board, and the production was a necessity, a drunken 1.34 pm. tug mechanical enginer without navigator certificate took the steering  and sail from floating crane "" Astraxana "" side overboard and maneuvering touched the starboard side midship in an angle of approx. 20 degrees making 2 tyremarks from its fenders nave ship MSF3.","","Ship remains fit to proceed","22","Russian Maritime Register of Shipping (RMRS)","7.2","","1","0","0","[Primary Annex 2 not designated]","[Primary Annex 2 not designated]","[Primary Annex 2 not designated]","[Primary Annex 2 not designated]","[Primary Annex 2 not designated]","[Primary Annex 2 not designated]","",""
"C0010197","1","KRISTIN C (IMO 9523938)","KRISTIN C: SOLAS","GBR","2013-08-21 11:15","Serious","371500N 0273600E","Port of Güllük ","1","0","Damages to ship or equipment","During port departure maneuvers while the aft of the ship departed only 2-3 m from the dock and the tugboat continued to pull the ship by increasing boat’s speed gradually from slow to half speed, the rope used in towing suddenly broke from the middle part at 11:15 and snapped back to the dock struck and caused grave injury to the port’s personnel who was serving at the wharf as mooring staff.","General Cargo Ship","Serious injuries","4151","","6750","","10","0","0","[Primary Annex 2 not designated]","[Primary Annex 2 not designated]","[Primary Annex 2 not designated]","[Primary Annex 2 not designated]","[Primary Annex 2 not designated]","[Primary Annex 2 not designated]","2016-02-26",""
"C0009068","1","ISLA GUAR (IMO 8200228)","ISLA GUAR: Unknown/unspecified","CHL","2013-08-21 07:15","Very serious","413800S 0724400W","SENO DE RELONCAVÍ - CHILE","1","0","Capsizing / listing","La Nave de carga general ""Isla Guar"", de 60 metros de eslora y propiedad de Transportes Marítimos Kochifas S.A., fue modificada para el transporte de peces vivos mediante la instalación de 9 estanques de 45 metros cúbicos cada uno, ubicados en un nuevo entrepuente alto construído en la bodega. Zarpó de Chinquihue, al Estero de Reloncaví, con todos sus estanques cargados al 100% de agua y salmones smolt. Las condiciones de mar y viento eran favorables. Transcurrido un lapso cercano a una hora, el buque presentó una leve escora a estribor de app 5°, la cual fue corregida por medio de achicar el estanque doble fondo de lastre 3 Eb. Pocos minutos después la escora a estribor volvió a presentarse y continuó aumentando hasta alcanzar los 45°, donde comienza a inundarse la bodega u sala de máquina, todo lo cual produce el hundimiento por popa de la nave, la cual zozobró en aguas profundas.

La dotación compuesta por 13 personas abandonó ilesa la nave, utilizando para ello el bote auxiliar inflable de la propia nave, debido a que las balsas salvavidas no se activaron.

Se activó el MRCC CHILE. La lancha menor ""Serranía"", la cual se encontraba en las inmediaciones, asistió el salvamento, siendo posteriormente apoyada por lanchas patrulleras de la Armada. No se constató vertimiento de hidrocarburos producto del naufragio.

(Versión en Inglés)

“The General Cargo Vessel “Isla Guar”, 60 meters length and property of Kochifas Maritime Transportation S.A., specially adapted for the transportation of living fish on 9 tanks of 45 cubic meters, located on the upper between-deck , set sail from Chinquihue towards the Reloncaví Estuary, with all its tanks filled with water and Smolts Salmons. The sea and wind conditions were favorable. After approximately one hour, the ship had a lift to starboard that has been corrected by balling out ballast. Few minutes after that, the ship listed to starboard again and it have increased up to 90º. After that the ship has sunk its bow and finally has disappeared on deep waters.

The crew of 13 people has abandoned the vessel with no harm using an auxiliary inflatable boat which belonged to the vessel since the life rafts did not activate. The minor boat “Serranía”, which was on the proximities, assisted the rescue, being lately supported by patrol boats from the Navy.

The MRCCCHILE has been activated. Nor Oil spill neither oil leakage has been reported as a result of the wreckage.”","General Cargo Ship","Total loss of the ship","902","[No class]","1125","LIVE FISH","10","0","3","[Primary Annex 2 not designated]","[Primary Annex 2 not designated]","[Primary Annex 2 not designated]","[Primary Annex 2 not designated]","[Primary Annex 2 not designated]","[Primary Annex 2 not designated]","2017-06-16",""
